,tweetnegative,keyphrases
343,this man really just gave us the first bite the same way does with every mukbang sign tchouameni and rdp don t want this rice fella at chelsea it wasn t as polite as go and watch chelsea it was fuck off to chelsea if you don t like they have every right to vent nothing you can say to convince that tammy is not treated unjustly at chelsea absolutely nothing youre one of those crazy fans provokes them to make such statements get off my mention dude u hating a player becos of his fan base my thoughts on the final day of the my nerves are shattered it s going down to the wire for the blues how has your club done let s have a chat about it talk to me about your joys disappointment,"[('tammy', 0.2969), ('blues', 0.2975), ('joys disappointment', 0.3013), ('fans', 0.3112), ('chelsea', 0.4463)]"
344,why ppl blood bad like this up chelsea blues for lyfe if you know who he is why the hell do you think the manager of chelsea wouldnt is chelsea really this dumb since after the chelsea game you don t wanna talk about football with me now liverpool won t sign him unless they sell mane or salah salah will cost a fortune that no one can afford and mane is out of form and also expensive can t see anyone buying them i can t see chelsea spending big on a winger when they need a st plus already have cho and ziyech this myth marina didnt like rice total myth,"[('winger', 0.3001), ('chelsea game', 0.3574), ('liverpool', 0.3752), ('chelsea', 0.4732), ('chelsea blues', 0.4755)]"
345,yes and that person gave them that trophy that one person created a history how many history has have those bunch of she goat give us just pain and pain upon pain and you call it business handled so poorly only wonder how players from the academy will go from here mans spent his whole life at yeah chelsea arnt paying that either my problem is jorginho and kovacic and kante have played brilliant under tuchel but i just know in the back of my mind they don t care about that and just want rice because he used to be from chelsea i was gonna call you posh for having a chelsea bun plate i didn t know chelsea were a relegation threatened team called west brom or a el level team called everton,"[('jorginho', 0.3009), ('everton', 0.333), ('chelsea bun plate', 0.3558), ('tuchel', 0.3739), ('chelsea', 0.5058)]"
346,bad news to chelsea fans as the blues have a setback against aston villa on sunday given up on chelsea so basically if you dont rate declan rice your xenophobic for not rating english players false narratives about each big 6 club that need to end man utd bruno is a penalty merchant man city they have no fans liverpool worst champions of all time none of these are true exactly i think has more of a problem with the chelsea fans that currently supporice over their own players which would certainly annoy me the thing that annoys me though are people who don t rate rice simply because he s not an exotic name from a different league chelsea people with violence everywhere,"[('chelsea', 0.4431), ('rate declan rice', 0.4941), ('chelsea people', 0.5267), ('different league chelsea people', 0.5592), ('chelsea fans', 0.5988)]"
347,youre right bro he doesnt worth that amount why would chelsea think of paying such an amount for him because hes an english player i like rice but do we need another defensive holding mf that doesn t score it isn t the defense that is the problem we need goals remember going to cambridge early 80s and the old bill took all our boots off us what a joke mind it ain t nothing new here s a bunch of blues skins at chelsea away getting the same treatment early 70s yea if backing the cobham boys players that are chelsea through and through is a problem then yes i am 100 guilty speaking of kids look at this shit that popped up on my memories today baby chelsea,"[('amount', 0.2801), ('english player', 0.3186), ('cobham boys players', 0.3208), ('chelsea', 0.4244), ('memories today baby chelsea', 0.4825)]"
348,it s so embarrassing seeing chelsea fans twerk for a rival players they protect rice better than our own players he s not even an upgrade on j5 or kante this fool is not even a chelsea fan two obvious areas of corruption shearer turned us down i cant stand the clintons but this chelsea tweet is fake how can anybody reply to this geezer he s a chelsea fan 2 he didt know the club existed until roman came along wearing a united shidoesn t mean you suppounited whereas sancho literally claim chelsea stop being deluded naturally i m always going to hate tottenham i d like to think they will always hate me,"[('chelsea', 0.5029), ('chelsea tweet', 0.5642), ('chelsea fan', 0.6035), ('chelsea fans', 0.6117), ('chelsea fans twerk', 0.6763)]"
349,chelsea fans pushing prem proven narrative for reguilon apparently gettin exposed in pl when their best player of recent time cant do shit in the same league is funny af yeah why not they wont because theyre all against chelsea i only became a chelsea fan in 2008 but i think that s long enough still unreal to me that we lost the fa cup final it really hume so bad like for the first time in a really long time i was hurt bit of a stretch these only bad one is aurier against city and dier against chelsea the others can and does happen to any team ffs dan wise up attention seeking cretin suppose it was the big bad chelsea fans found a new drum to beat now that the chelsea hierarchy have sussed you out,"[('chelsea hierarchy', 0.4227), ('bad chelsea', 0.4726), ('chelsea fan', 0.5224), ('chelsea fans', 0.5422), ('big bad chelsea fans', 0.5713)]"
350,oh the insufferable disdain of the relatively young amp healthy chelsea is a lesbian bff i cant put that in my username akdbfhehejsjwj what do you mean lost its value because chelsea didnt win it always the cho stans swear chelsea fans even hate them now that we re back in for rice people still have a problem with it idk why people are so against him the 80m tag everyone complains about is old news no way united pay that much let alone chelsea if he wants to leave he will and i will definitely take him at the bridge even you know thats bollocks chelsea are worried sorry we should have a choice all over 50s being herded onto a vaccine with clotting potential no matter bet man city and chelsea are absolutely shitting themselves over a fine,"[('united', 0.3665), ('chelsea', 0.5679), ('healthy chelsea', 0.5932), ('bollocks chelsea', 0.6006), ('chelsea fans', 0.6039)]"
351,they were greedy and wanted the money 7 we were underdogs i dont identify with man city as liverpools rivals jose mourhino left me with an intense hatred for chelsea and that i cant erase lmao deji would fuck you up sit down white girl lets be real it would be more shocking if a chelsea player whos started big games for chrlsea recently wasnt picked by scotland you cant put a price on ability leadership which chelsea have lacked for years now last day of the epl season is sunday all i want is last minute drama and heartbreak for chelsea fans the only reason why i don t want him at chelsea is cause of his weird ass fan base and his huge price tag,"[('liverpools', 0.3837), ('chelsea player', 0.4315), ('liverpools rivals', 0.4336), ('chelsea', 0.4897), ('chelsea fans', 0.5207)]"
352,sancho isn t a chelsea fan he was bought up watching them n arsenal and also said his dad supported arsenal but he never actually favourited a team he cared more about his own football idiot timo doesn t have the potential to get 30 goals playing for chelsea his finishing is horrible class like when he called chelsea clinton a dog chelsea will suffer with 3 5 2 formation thats the formation he started with this season lewa didnt score a single meaningful goal after the chelsea game could never be coman jorginho gets more stick for playing good than rice gets for being overpriced by chelsea fans no thanks don t ever want to see city with a cl title rather chelsea win that though can t stand them either,"[('dog chelsea', 0.4397), ('chelsea', 0.4592), ('chelsea win', 0.4766), ('chelsea fans', 0.5701), ('chelsea fan', 0.5856)]"
353,oh i remember when i became a chelsea fan the football gods said you can t watch any other leagues now unlucky chelsea has zero chance of signing kane the two clubs dont do business we wouldnt sell them modric they would sell us rudriger or giroud there is no trading history or love lost between the two clubs whose fan base cant you stand do you expect his fans to take all this disrespect hes getting from people like you tammy is quality and if a player like werner can get a minutes in chelsea then tammy deserves it too what did tammy do to you all to deserve this,"[('tammy', 0.3383), ('kane', 0.3449), ('chelsea', 0.413), ('unlucky chelsea', 0.4742), ('chelsea fan', 0.5144)]"
354,its not the top 6 its the big 6 its based on wealth and history if anything city and chelsea should be the ones to fuck off if it was based on performance the top 6 would change every season well chelsea didn t win the league that season he let the entire club down but i am sure you knew that maybe have a look at that squad he let down and failed with any player who twerks for other clubs while under contract at one is unprofessional and should not be signed plus he brings nothing to the table to improve chelsea other than a massive transfer fee,"[('league', 0.2105), ('top', 0.2274), ('entire club', 0.2654), ('chelsea didn', 0.3982), ('chelsea', 0.4289)]"
355,no wonder we get bullied by city uyd liverpool chelsea big club small pockets no cheats no silver all top clubs have previous mutu jones blind sakho kolo toure we got ledly pissed nigh club dele pissedvon a beach walker gas sucking now sucking high energy counting medals fantastic blog i can t believe a chelsea fan like me was singing embo embo when he scored what are you two doing to me chelsea to drop points and miss out on champions league spurs to lose to leicest chelsea is in declan s blood his whole family suppothe club he idolises jt lamp,"[('liverpool', 0.4522), ('champions league', 0.4668), ('chelsea', 0.5142), ('city uyd liverpool chelsea big club', 0.5461), ('chelsea fan', 0.5522)]"
356,football existed before premier league and is made up of the pyramid system with other clubs and a lot of history thats why these teams need punishing for such ridiculous thought man city and chelsea relatively modern history has literally proved billionaires can buy success you can rate declan rice but still think he isn t worth upwards of 50m chelsea fans protect this guy more than they do their own players man reguilon is terrible as is telles people completely undervalue being pl proven which i don t understand one bit rice would be much better at chelsea than most dm s from other leagues hazard has to be the most unlucky player ever he leave for madrid boom chelsea are in the final of the ucl chelsea man city and man utd arent top european clubs,"[('madrid boom chelsea', 0.4746), ('chelsea', 0.4788), ('chelsea fans', 0.4795), ('ucl chelsea man city', 0.5229), ('chelsea man city', 0.5301)]"
357,he played the same thing at juve chelsea amp now at inter amp you my man are talking rubbish talking about understanding fluidity when you don t understand the basic ridiculous rice did not face and has never faced tuchels chelsea before he missed the game we won so there is only 1 way he watched rice he left his duties to watch rice its freaking declan rice judge dismisses murder charge against california mother after stillbirth please please chelsea you can t bottle this one they saved no one i dont think chelsea would have played a second string team after losing an fa cup when they are at home to the team that beat them to that trophy with fans returning after 15 months out,"[('basic ridiculous rice', 0.3735), ('juve chelsea amp', 0.3736), ('declan rice', 0.4502), ('tuchels chelsea', 0.4517), ('declan rice judge', 0.4647)]"
358,speaking of the chances of being hit by lightning how many have died from the virus in australia this year if we do manage to get that guy will bleed blue till the day he retires and beyond these are the type of players our club needs and misses badly juve will not make top 4 and midfield attack combination is so sick mf he was 37 get f cked the way these 13 year olds use united to get cheap likes rts is almost hilario he plays for a rival get it into your head has a poor player with an inflated price and he is not a chelsea player istg rice isnt even worth 60million chelsea and united are dundees did they not tell her shhh look away chelsea,"[('poor player', 0.3565), ('chelsea', 0.3854), ('chances', 0.393), ('chelsea player', 0.4348), ('chelsea player istg rice', 0.4682)]"
359,i dont want lukaku at chelsea rice yes but lukaku is a no no food for children is not a footballing moment tho you are disrespectful tammy at chelsea scored 30 goals thus far at astonvilla scored 25 in a or chelsea spends that kind of money on him i ll be mad angry oh noooooo i meant first show back my bad andre silva has scored more goals than haaland in bundesliga this season lewandowski has 40 timo werner went from scoring 28 last season at leipzig to 6 at chelsea something tells me this league aint serious the defending is just atrocious,"[('chelsea rice', 0.3544), ('season lewandowski', 0.3685), ('chelsea something', 0.4098), ('chelsea', 0.4168), ('lukaku', 0.4915)]"
360,but the obvious point you re missing is that other top clubs aren t treating their female players like sh t it s only liverpool look at the massive investment from city chelsea amp now utd in their women s teams it s shameful by liverpool amp we have american owners automatically lower the standard of the league i think hes a horrible player and i dont want him at chelsea he wont demand such ludicrous wages fees from a club like madrid city chelsea etc its just us because we are desperate please god no it s a dumb ass loaded question he won titles at madrid chelsea won the europa league at utd left spurs and according to kane left behind a team that were too weak to rise to the challenge pussies,"[('madrid city chelsea', 0.3547), ('top clubs', 0.3693), ('city chelsea', 0.4028), ('liverpool', 0.4192), ('chelsea', 0.4298)]"
361,cost a billion to build second largest debt to service in the pl 750 mill after chelsea amp no benefactor what a shame chelsea could lose it all this coming week plastic team with no soul that s chelsea he faded at chelsea faded at villa and shit on the blues no thanks i didnt think ramos was poor against chelsea was a controversial opinion but apparently it is i m so sorry chelsea chelsea you cant possibly be this dumb can you average and overrated i d take a bissouma or ndidi over him chelsea won t even pay that insane fee,"[('chelsea chelsea', 0.4953), ('chelsea', 0.5043), ('sorry chelsea', 0.5501), ('sorry chelsea chelsea', 0.5668), ('shame chelsea', 0.5699)]"
362,why are spurs there the whole narrative of spurs being paof the big six is nonsense they last won the fa cup the year before the pl was formed the last fans to see spurs win a league are mostly all dead this team will tear that chelsea team apart one of many tapped chelsea fans who don t have a barney what they are on about haaland numbers will drop if he joins chelsea walahi looooool you people wanted to kill kepa for tielesmans goal watching westbrom goals against chelsea lol tuchel after 4 months has identified declan rice as his first target that headline is not complete to me no way tuchel with all the headache and dilemma chelsea were in already knows declan rice,"[('chelsea', 0.4214), ('chelsea lol', 0.455), ('chelsea fans', 0.4638), ('spurs', 0.4786), ('dilemma chelsea', 0.4992)]"
363,tt isnt interested in this off and on english star its just england being england chelsea doesnt need rice at all chelsea will be humiliated on 29 05 2021 same lot who said no to thiago silva chelsea are not a retirment home they said listen boy banter apaokay tottenham can never be a stronger team to beat than chelsea calling chelsea weak and tottenham a mountain completely wrecks your football knowledge and thats fact no results made tomorrow would make any sense of this nonsense you wrote here jesus never lived up to expectations at city chelsea are it of the running for various reasons cant offer what city amp united would offer kane as for united a rw dm and cb is more essential than a striker,"[('thiago silva chelsea', 0.3617), ('kane', 0.3889), ('city chelsea', 0.453), ('england chelsea', 0.4547), ('chelsea', 0.4587)]"
364,chelsea green opens up about wwe release i thought i was going to be upset you cant say that these clowns at chelsea cant link up with him as well as the dortmund team hes playing with chelsea fans are deluded look at del piero in the final of euro 2000 probably call him crap too what a tool he mentions a fraud think he needs to check himself disagree players are human and they have emotions like anyone some deal with it immediately others dont and mistakes are made like i said i dont take away from the winner but like i said chelsea inflicted 2 self wounds back to back and against a quality team no comeback ya mad chelsea must drop from that top 4 and milan lose,"[('milan lose', 0.3467), ('mad chelsea', 0.3906), ('chelsea', 0.3912), ('chelsea green', 0.4073), ('chelsea fans', 0.4969)]"
365,i had a dream chelsea lost the to city and cho had a gruesome injury i pray the latter doesnt happen but im fvckin here for the former i will never manage spurs never to deduct points punishes the supporters and distorts the league table that means chelsea and city and maybe united will just throw money at the team to get round the points deduction his stans will be soo unbearable honestly don t want him here at chelsea stupid man utd and chelsea fans telling me lingard is better than saka unbelievable theres no way he goes from spurs to chelsea surely that would be an outrageous transfer and his reputation at spurs would be destroyed stop trying to be us chelsea,"[('man utd', 0.4233), ('stupid man utd', 0.4335), ('chelsea fans', 0.4633), ('chelsea', 0.4807), ('dream chelsea', 0.5786)]"
366,10 minutes for the arsenal trophy room theyre the 3rd most successful club in english history you fucking idiot chelsea still miles behind despite theyre recent success in winning sorry buying trophies and history lamaprd got sacked because he wanted an academy reject the declan rice that chelsea or united fans are expecting is better than prime busquets you guys are insane he s not even better than seydou keita we re just ruthless were did u get this stupid news from lol you must really be a clown that and chelsea and tottenham not doing business luka modric chelsea already had a colossal squad and they would have spent if they could we flogged our better 11 to death because we had no one else and it snowed in the end,"[('arsenal', 0.4642), ('business luka modric chelsea', 0.4667), ('united fans', 0.5017), ('chelsea', 0.5605), ('fucking idiot chelsea', 0.659)]"
367,as i said poch dragged the poor poor squad to compete for leages and cl amp in spite of poor backing by levy is chelsea clinton really that stupid chelsea are loosing both finals ooooo what a sufficient god i served before the staif the window the prices are always inflated kante needs help so chelsea needs to get declan or a good cdm from france we cannot win the league with jorginho and kova because they are way more inconsistent than not has he been a little disappointing yes although hes been very much hampered by injury although as a chelsea fan im sure youd know a lot about disappointing signings it s a pity he won t be joining chelsea new match preview out now hes not joining chelsea god forbid,"[('chelsea new match preview', 0.4488), ('disappointing signings', 0.4585), ('chelsea fan', 0.4686), ('chelsea', 0.4736), ('stupid chelsea', 0.5621)]"
368,calling chelsea fans plastics for not liking him you are rather going to be my ucl trophy cos chelsea is not winning it sorry this man with excuses how many injuries did they av compared to man u chelsea man city sef its impossible to win an argument if its against united chelsea fans walahi nopeee plus he wants chelsea let him go chelsea i don t want him to come to united just cuz chelsea didn t want him una really hate this chelsea ooo we will overcome in a ya bratty protagonist way sorry not sorry he was really good for stoke but sitting on the chelsea bench seems to ruin keepers the same thing happened to cech and then missing an open goal,"[('chelsea man city', 0.5007), ('man chelsea', 0.5211), ('chelsea fans', 0.5452), ('chelsea fans plastics', 0.5569), ('united chelsea fans walahi nopeee', 0.6108)]"
369,and you have no chance from dying from the pfizer vaccine no preventable death is acceptable where a non lethal alternative exists i m convinced women are nowhere close to chelsea lukaku would be foolish to come back to chelsea hes a king where he is it is best for him to continue there chelsea will dump him immediately his productivity appears to have declined the one chelsea dont need lool i dont trust napoli or milan lile to draw atletico win chelsea or livepool finish 5th we are not going along with any reopening of the economy when you keep on selling out with and the we are on to your shady corruption and we expose it everywhere we go from red hook to harlem to chelsea,"[('preventable death', 0.3666), ('atletico win chelsea', 0.3925), ('pfizer vaccine', 0.407), ('chelsea', 0.4584), ('chelsea lukaku', 0.4767)]"
370,these numbers are false in my town i personally know 3 women who got hospitalized and i dont know that many people none of the above cases hit mainstream media because doctors wont confirm it unless you die they should ban the vaccine for women the owners arent broke just want to operate the club as a business where it runs off its own money the owners take a salary and take a profit too whats annoying is as fans we want owners like city psg and chelsea but then point the finger at them fsg need to invest,"[('club', 0.2536), ('mainstream media', 0.2614), ('many people none', 0.2817), ('chelsea', 0.2826), ('vaccine', 0.3504)]"
371,you re goddamn right they re so obsessed with pure blueness and even slander their legend player for this i can t figures out the conflict between being a blue and liking a boy who played for us for 7yrs i never get over eden hazard i promise and i stan chelsea forever if chelsea manage tchouameni and lacroix while we spend all summer chasing rice and kounde i will be rather upset not only its complicated enough to do player exchange cash now i see chelsea fans suggest 2 for 1 player exchange cash am all for getting rice on least terms negotiable but people need to stop being ridiculous brentfowill replace them another trouble for chelsea don t know why chelsea fans are happy with the results,"[('pure blueness', 0.3486), ('stan chelsea', 0.4154), ('chelsea don', 0.4537), ('chelsea', 0.459), ('chelsea fans', 0.5386)]"
372,leicester wont have it easy vs tottenham and liverpool wont have it all their way either if you think you we are getting harry kane you are deluded chelsea spurs dont sell to each other chelsea get phobia for finals west brom and bournemouth both gone a chelsea fans dream im in tears i think the animosity against chelsea is global because is also very rife here in nigeria as a chelsea fan i didnt want to see bournemouth back to pl soon that team always beat us 4 0 every january nomatter the ground phew who knows but if everyone worries about insignificant risks associated with vaccines it will be years,"[('leicester', 0.4858), ('chelsea fan', 0.5051), ('chelsea', 0.5274), ('chelsea fans', 0.5349), ('chelsea fans dream', 0.578)]"
373,are u crazy he never won the ucl at chelsea he won it at madrid get your facts right before u post lol he cost us the ucl against autd nah i hate them both in fact anyone but madrid or barca or united or chelsea or bayern or psg or any of the big clubs we both know tt is not playing him cos he does not rate him please ruin chelseas season king rice amp sancho are life long chelsea fans so give it a break youll be one of the 1st people to statweeting crap when they dont join with your ridiculous hashtag sancho deadarse denied supporting chelsea last year even though he clearly used to what app do you use for this,"[('chelsea', 0.4359), ('long chelsea fans', 0.4825), ('chelsea fans', 0.488), ('chelseas season king rice amp sancho', 0.4932), ('chelseas season', 0.4953)]"
374,watching other clubs score within the first 5 10 minutes of kickoff and i can no longer relate at a chelsea fan this are some of the reasons why this chelsea team never go forward if doesnt talk about chelsea he will probably get sick forget about how he left us 1 good game every 6 weeks doesn t track back terrible decision making bit of a knob off the pitch getting smashed etc not good enough for chelsea or villa no thanks sunderland is his destiny chelsea go lose na,"[('thanks sunderland', 0.4227), ('destiny chelsea', 0.4435), ('chelsea team', 0.4632), ('chelsea', 0.4784), ('chelsea fan', 0.5612)]"
375,it s heartbreaking what they do to their own children i ve seen interviews with chelsea where she s wearing an upside down crucifix i m of the opinion that evil is a learned behavior all of gods children are born with love in their hearts hil and bill ruined chelsea why are chelsea fans picking on bournemouth i know they stress us a lot though well stay pressed in the championship bourney the evil yall done and he copped worse in bali and didnt go down like a chelsea winger whyd he grab his forehead and nose after getting it on the chin gaming it hes not the only one,"[('chelsea winger', 0.3387), ('evil', 0.347), ('gods children', 0.3708), ('chelsea', 0.4416), ('chelsea fans', 0.4972)]"
