,tweetnegative,keyphrases
247,yeah 100 its pretty much about jealousy and the fact that other fans get thir fill by slagging us off chelsea and city arent football clubs they are toys for billionaire tyrants i can t see him being welcomed anywhere other than chelsea he s a cunt and nobody likes him he never won the champions league with chelsea lol stop lying na everybody hate those chelsea fans cause they are touts thugs and noise makers kepa to chelsea is probably the worst tranfer in modern football y all defense for signing foreign league players with way more ability than rice for probably less money is that he s prem proven lmao holy shit chelsea just go sign him so these people can finally shut the fuck up ffs,"[('chelsea', 0.435), ('chelsea lol', 0.4652), ('shit chelsea', 0.4707), ('lmao holy shit chelsea', 0.5559), ('chelsea fans', 0.5766)]"
248,that s fucking terrible how can the prem clubs take more chelsea and city are allowed 5 850 in fucking portugal there was enough moaning for our ballot for the semi you know whats wrong with this tweet the word you but we turn on each other now letting divisive politics win it does tho man played a back 6 against chelsea in the first leg can never be my coach i m a chelsea fan and we don t want you please join a bigger club jorginho howler as tuchel s blues stumble to rare defeat so in other words liverpool and tothenham games have been rigged to cost chelsea just want chelsea to lose ucl funal,"[('prem clubs', 0.4387), ('words liverpool', 0.4663), ('chelsea', 0.4933), ('chelsea fan', 0.5084), ('cost chelsea', 0.6037)]"
249,declan rice going to chelsea who the fuck are we even going to sign i genuinely have no idea who and who were bringing chelsea have some nerve making an approach for harry kane daniel levy wont sell them his torn socks let alone harry kane and the cheek to offer dross like kepa and tammy fuck outta here dear mr and mrs stone im deeply saddened by your complaint to chelsea high school regarding our lyrics lose to chelsea i was wrong she stopped her with 9 seconds left in the 5th i m a chelsea fan and we don t want you here lol we are not fighting again man city alone arsenal man u liverpoool are all enemies within they just want to see chelsea fail keyword chelsea no sensible football fan rates that guy,"[('declan', 0.3772), ('declan rice', 0.4331), ('chelsea', 0.5039), ('chelsea fan', 0.5046), ('chelsea fail keyword chelsea', 0.5426)]"
250,the irony is lost on chelsea probably explains why chelsea doesnt to this day own a blue dress with you real were kicked out of cl by chelsea they are no good side i think chelsea would miss out on the champions league tomorrow lmao chealsea don t talk shit chelsea easily has the dumbest fan base on earth a bunch of emotional illogical incels racists and xenophobic freaks i dont hate chelsea either but their fans make it so hard to not hate them lol you cant when fake supporting chelsea suarez scores while benzema misses we dont deserve anything this season with how bad we have been through the whole season and especially in the matches against villareal and chelsea where we had to win,"[('chelsea suarez scores', 0.4084), ('benzema misses', 0.4186), ('champions league', 0.4207), ('chelsea', 0.5246), ('shit chelsea', 0.5681)]"
251,chelsea ft will sell their organs and their family s for this guy and it baffles me zidane cost us the chelsea game over both legs and is doing the exact thing here the fact that he s stubborn and never le watching these games makes me think that chelsea dominating both madrid teams twice each wasn t all that impressive uno zidane ruined the chelsea game and hes doing the same thing here again drinkwater was never chelsea quality terrible example the point is chelsea and man city the two most dominant english teams the last 10 years have never consistently bought players from within the prem you pushing an agenda and can t even get all the nationalities right,"[('chelsea ft', 0.4181), ('impressive uno zidane', 0.4434), ('chelsea', 0.4531), ('zidane', 0.4579), ('chelsea quality', 0.5164)]"
252,unbelievable striker one of those you hate to love had he not played for chelsea i d have liked him a lot more chelsea you are not only pathetic but so ignorant to what youre parents has done to people and our country your mother i honestly dont understand the hype they have on rice he might have graduated from the chelsea academy but hes nowhere near the player that we desperately need learn to beat your master chelsea youve been his side chick for too long the fact that he s stubborn and never learns is really annoying so many of these players dont deserve to wear this shirt fucking embarrassing chelsea away and this game actually killin i can t believe chelsea seriously said this im gobsmacked,"[('chelsea academy', 0.3899), ('chelsea', 0.4407), ('master chelsea', 0.4755), ('unbelievable striker', 0.5188), ('embarrassing chelsea', 0.5372)]"
253,so many of these players dont deserve to wear this shirt fucking embarrassing chelsea away and this game actually killing me theyre not even trying guys this is funny as heck but there is no way chelsea actually wrote this right i fucken told you messi is retiring at barcelona aguero arriving was confirmation of that now they getting depay too sell dembele to chelsea please i beg you no need for a striker if he comes sign him remember when una sack lampard and one of the reasons was him pressing for rice and chelsea board not willing to spend on a player they released,"[('chelsea', 0.3945), ('way chelsea', 0.4099), ('chelsea board', 0.464), ('messi', 0.4788), ('embarrassing chelsea', 0.4864)]"
254,no way shit on us from a big height and proved very little since he left us not progressed at all as chelsea and even villa dont wont him let him find his level and go play for the barcodes or even palace if chelsea finishes out of top 4 and also lose in the champions league final this season is going to be a terrible one for them think of it losing fa ucl top 4 all in one season meanwhile chelseas attack is as clueless as werner no prayers needed we ve spent we ve spent 170 million on kovacic jorginho drinkwater and bakayoko but 60 mil on potentially a key paof a chelsea spine for 10 years is where it would be money poorly spent fuck me,"[('chelseas', 0.3906), ('paof chelsea', 0.4093), ('chelseas attack', 0.4139), ('chelsea', 0.427), ('chelsea spine', 0.4311)]"
255,pl proven farce like it actually annoys me if anything chelsea should have learnt from that scam most of our greatest buys were not from the pl that s a fact exactly the reason we ended up with torres and not aguero i saw a post on a similar situation in chelsea yesterday the person brought the car to a vet but the cat died maybe it was their own pet s vet dunno football fans are crazy tho coz i know if bruno was a chelsea player united fans will also have all soof agenda against him and swear he is a mid player chelsea fans have no respect for their captain and vice captain i dont even know the football club people hate more between real madrid amp chelsea the way i dislike atletico and chelsea,"[('chelsea', 0.4057), ('anything chelsea', 0.4152), ('chelsea fans', 0.4994), ('mid player chelsea fans', 0.5178), ('chelsea player united fans', 0.523)]"
256,must stop letting united and chelsea idiots wind me up u add this pic for what to make the fans feel like things are ok bunch of jerk dude brought chelsea this far yet he never gets featured in all previous game that sucks shut the fuck up you chicken wing looking bitch 100 they got inspiration for abby from chicken little when seeing you boys will really make fun of you then proceed to post a tiktok edit of chelsea fc lmaoo thomas tuchel laments chelsea s bad luck after fa cup final loss via some chelsea fans can never learn players coming from other leagues takes time to adapt to epl i dont care about other players they waved ozil off better than could ever wish for is a joke celebrating a chelsea legend whilst disregarding our own,"[('chelsea fc', 0.4737), ('chelsea legend', 0.5108), ('chelsea bad', 0.5176), ('chelsea fans', 0.5986), ('chelsea idiots', 0.6289)]"
257,some chelsea fans agenda on rice is so weird exactly was so shocked to see atleti against chelsea don t care should have came to chelsea this bloody b tammy is being hated even though he is chelsea top scorer last season while werner is getting comforted even though they paid him money just to miss a whole load if clear cut chances this is what chelsea fans did to mourinho sundowns have not even bothered to condemn this this is a disgrace to the football of southern african hemisphere im sure the young motsepe will condemn this this is the tension that will spread across chelsea and liverpool tomorrow real madrid and barca will not win today,"[('chelsea', 0.4527), ('chelsea don', 0.4704), ('mourinho sundowns', 0.5146), ('chelsea fans', 0.5888), ('chelsea fans agenda', 0.6406)]"
258,tuchel saying complaining because chelsea are at a disadvantage because villa fans will be in the stadium makes no sense and we get on with it you aint say nothing when chelsea fans were present against leicester just get the team to do the job i always see a disastrous take on chelsea twitter everyday these days wtf this ref wants to pull a chelsea on us i hate chelsea underdog chelsea side how the fcuk was the most expensive resembled team at the time bar barcelona an underdog team today s fifa fans really are thick aren t they i know totally we missed the boat on the oil money not saying enic haven t made mistakes but 90 of the hate is based upon looking at chelsea amp city for sure,"[('chelsea side', 0.4886), ('chelsea', 0.4906), ('chelsea underdog chelsea side', 0.5492), ('villa fans', 0.5497), ('chelsea fans', 0.5765)]"
259,chelsea must not have watched the news should we tell her about her father sick to fucking death over chelsea fans going at eachother for rating mount pulisic cho jorg etc just stfu and back th just listen to the latest podcast from chelsea vs leicester ding dong round 2 and i am struggling to put into words how terrible it was guys if you don t like football don t do a podcast on it hint chelsea your father had sex with underling the hypocrisy of democrats chelsea you are not only pathetic but so ignorant to what youre parents has done to people and our country your mother is the most cruelest hate filled person who has walked this earth and your fathers inability to keep his pants on what a disgrace to out country,"[('leicester', 0.2929), ('disgrace', 0.2971), ('democrats chelsea', 0.4819), ('chelsea', 0.4859), ('chelsea fans', 0.5866)]"
260,it s ironic how you have carefree in your name yet you tweet more about arsenal than chelsea you mug yall are so dramatic chelsea lose 2 games and all of a sudden these players dont want to play for chelsea bunch of drama queens in this app yeah he was gone to chelsea for like 35m in the summer but snaked out of the deal and signed for 15m in january where his agent got a massive fee for so he basically screwed the club out of 20m hes had bad guidance and seems to have some serious personal issues same mistake against chelsea same mistake today please stop tweeting about declan rice as he was our player this is beyond embarrassing,"[('arsenal', 0.326), ('declan rice', 0.3441), ('chelsea bunch', 0.3559), ('chelsea', 0.429), ('dramatic chelsea', 0.4665)]"
261,what s this got to do with chelsea are you not allowed to think someone s not good just cos they ve got more goals bamford isn t clinical at all can just tell you re a lampard sexual or some shit after mcmaster criminal administration brought new faces to the equity and inclusion office after the removal of honest individuals such as chelsea gibson the new members remain unresponsive for my request to access my personal documents sincerely i never saw what chelsea fans are seeing in rice i absolutely dont to me hes just an average player thats hipped n made captain of west ham nothing this is how chelsea will choke lau lau man city feel sorry for the people who actually think chelsea are going to shell out 90m for a mediocre dm in declan rice,"[('west ham nothing', 0.3395), ('chelsea gibson', 0.355), ('goals bamford', 0.4548), ('chelsea', 0.4877), ('chelsea fans', 0.5481)]"
262,i didnt blame him for chelsea but ill surely blame him for this not saying this tchouameni geezer isn t good but remember last time we signed a hyped up french cdm from monaco bro i don t know why you ve got your knickers in a twist chelsea is not worth having kane you guys are destroyer look at werner john terry claims rio ferdinand snubbed him on a dubai beach when he tried to discuss racism row involving stars brother anton and chelsea legend insists theres no chance of reconciliation has to be chelsea i do not like that club i m not watching chelsea tmrw it didn t sit right with me don t give the labour exploitation funded youtube channel your clicks,"[('blame', 0.4158), ('twist chelsea', 0.4369), ('chelsea', 0.452), ('chelsea tmrw', 0.4685), ('chelsea legend', 0.4892)]"
263,i don t get the outrage considering we as fans don t pay the money you can tell a lot of these fans only drink in a wetherspoons i dont feel like happy anymore chelsea fans protect this guy more than they do their own players spot on baffling any team that draws or lose will not make it especially those that have 66 points ya dunno maybe cause chelsea had a shit manager for half of the season oh wait you re in 9th too low to know sorry chelsea even cant win fa cup against leicester he couldve gotten paid 30 million a year in chelsea man city or psg you idiot who the hell stays in a club like this barca you fentuo ankasa i no dey understand you 2 of them treated like shit by chelsea,"[('outrage', 0.3619), ('chelsea man city', 0.4327), ('chelsea', 0.4346), ('sorry chelsea', 0.5203), ('chelsea fans', 0.5728)]"
264,lets hope not youre going to witness the worst chelsea agenda those within the fanbase not enthusiastic with the declan rice links is this simply because of the fee or that he s not rated you never beat this average chelsea team so i guess you should be worried chelsea fans follow me and unfollow me back if i dont follow back within 15 minutes seeing as hes not kicked on and been basically a flop at chelsea and villa no whats the point zidane keeps doing this shit and i am sick of it he did the same with ramos in the 2nd chelsea game,"[('worst chelsea', 0.4365), ('zidane', 0.4471), ('chelsea fans', 0.4673), ('worst chelsea agenda', 0.4967), ('worried chelsea fans', 0.5809)]"
265,no way was meant to be this amazing player with so much talent and season after season it never happened fucked off to chelsea and then said we never gave him a chance or proper training sid benson brought him through when he was a kid disrespectful rat bissouma will not take us to the next level dam chelsea looks annoyed by you trev la liga ruining my acca and my weekend so far chelsea better win tomorrow this is hilarious chelsea is such an incredible hypocrite just like her despicable parent why am i vo ting for chelsea ffs this is hilarious chelsea is such an incredible hypocrite just like her despicable parents nothing to push chelsea never gonna win ucl this year,"[('sid benson', 0.3338), ('chelsea ffs', 0.4754), ('chelsea', 0.4898), ('next level dam chelsea looks', 0.5342), ('hilarious chelsea', 0.6281)]"
266,i really dont get why chelsea are hunting for a dm tbvh theyve got kante kovacic and jorginho just imagine the infinitesimal amount of banter we would get if we lost out on sancho to liverpool or chelsea but especially liverpool smh why does chelsea have to always think in this way do they not have a good scouting team that they should be faithful in why cant we like leicester scout and buy good players they buy at 30 and sell at 90 and we buy at 90 and reap benefits of 30mil value bs chelsea fans piping up after long time of misery dfkm villarreal is basically chelsea under thomas tuchel they will sit back a lot and frustrate their opponent if we are not patient enough this wednesday we are fucked,"[('liverpool', 0.3735), ('liverpool smh', 0.4143), ('chelsea', 0.5543), ('chelsea fans', 0.5649), ('30mil value bs chelsea fans', 0.5793)]"
267,ngolo kante isnt good enough for chelsea same mistake he did against chelsea why should i hate chelsea chelsea had the advantage over leicester what a fucking melt want chelsea to get absolutely peppered by villa i don t even know who i ll suppoin cl final i don t want you guys to win and chelsea also ight fellas told myself after the chelsea game i would rage quit the season i m gonna go ahead resume my rage quitting 45 more minutes to save my tickets and your title ambition you fucking idiots thats the sentimental decisions of zidane that i always talk about why toy with a partnership thats proven itself same thing he did that ruined the match against chelsea,"[('chelsea', 0.4259), ('zidane', 0.4277), ('chelsea game', 0.4302), ('ngolo kante', 0.5388), ('kante', 0.5501)]"
268,declan rice is not a chelsea player supporting and advocating for him more than our current players and by slandering our current players is wrong and frankly a bit weird you re putting a silver spoon in his mouth kane amp sancho is ok but varane has no place in chelsea he messed up the line up against chelsea amp now benching nacho over varane in a do or die situation article lacks balance you go to great length to discuss some bad luck that has worked against us what about our victory against chelsea 2 shots on target flukey goal crystal palace 3 shots on target 3 goals a soft penalty at old trafford how come the claim is misleading,"[('target flukey goal crystal palace', 0.3101), ('soft penalty', 0.3125), ('chelsea', 0.3762), ('chelsea player', 0.4271), ('declan rice', 0.4624)]"
269,not racist but hes got a history of saying racist stuff and has a reputation for being racist among ex chelsea players i suppochelsea you clown and we absolutely shipped you back to madrid fans forget how we hated his guts at chelsea and man city away pls remove chelsea from the list i dunno them this imaturity is disturbing this first half might ve been worse than the one against chelsea would ve been a lot different if the penalty was given don t know if having to order 3 chelsea shirts for next weekend in different sizes is a sign i have put on way too much weight ye its for my home town dundee united not chelsea unfortunately i cant go to chelsea games just yet last time that happened it failed miserably against chelsea,"[('chelsea shirts', 0.4149), ('chelsea', 0.4165), ('madrid fans', 0.4268), ('chelsea games', 0.4312), ('racist', 0.4323)]"
270,it s actually mad that chelsea have made the champions league final and their leading goal scorer in the pl has just sev chelsea ladies stood no chance this is the craziest domination ive seen both in male and female football against city last 2 seasons we were very poor varane was very shaky and everyone saw yet zidane make no chance until the 80 min against chelsea ramos hazard very poor vini on the right very bad yet zidane played hazard for 80 mins and kept ramos throughout the game the same juve that s struggling to make top 4 today and chelsea who were 8th when lampard got sacked if you don t like him i get it but don t deny his coaching credentials,"[('craziest domination', 0.3594), ('champions league', 0.4222), ('chelsea ramos hazard', 0.4332), ('sev chelsea ladies', 0.4812), ('chelsea', 0.4853)]"
271,his last 6months at chelsea was a nightmare for him bro check your facts please dont jinx chelsea bro ill never call pep a takla again you have to focus on yours too and always bear in mind that you can never and ever score chelsea in your history never back to back injuries take a toll on form and fitness especially when a player like him has never really been scarred by injuries so often i wish he remained at chelsea coz he was enjoying his football here but he made his move sad for him and madrid that it didnt work out imagine being a chelsea fan and still not wanting to sign for them,"[('pep', 0.3042), ('chelsea coz', 0.3633), ('chelsea', 0.4045), ('chelsea fan', 0.4242), ('chelsea bro', 0.4603)]"
272,when are madrid fans going to realise that your nothing anymore since ronaldo left you got absolutely slapped by chelsea and now by villarreal who still have a cup final left to play by the way no owner with genuinely earned money will treat a club like a pet project chelsea is backed by an oligarch who loots russia the story of every player at chelsea sad to see the total weirdo then lists some ways to use menstrual blood to create your own personal magic teen vogue responsible for not arsenal fan here and the reds cards and penalties are the memories that he leaves behind in my books shitty transfer considering we let nacho and koscelney go free and then went for a pensioner from chelsea this club is ran by clowns,"[('arsenal', 0.4093), ('arsenal fan', 0.4724), ('madrid', 0.4966), ('chelsea', 0.5137), ('madrid fans', 0.6175)]"
273,varane trained for 3days and zidane bench nacho for him and we are losing blame it on 65 injuries all u want but zidane is the main problem both tactical and selection while benzema is a good player his attacking positioning is very stupid and useless and then that player signs for some other pl club and plays like complete ass zidane got it wrong by even starting varane he did the same with chelsea urg stick the vaccine in your ass chelsea or your mouth since they are basically the same place i don t think we need a cb at all,"[('cb', 0.4203), ('varane', 0.4324), ('complete ass zidane', 0.4451), ('zidane', 0.5375), ('zidane bench nacho', 0.6071)]"
274,he s such a legend as a chelsea fan it s just burned into your brain to hate spurs like they haven t personally done anything to me but you just hate them the first fixture i look at every weekend are spurs to hope they ve lost i know the chels score because i watch them an average not me please i don t give two shits about chelsea zidane and the team couldn t win the most important games this season vs sevilla chelsea and now villareal same thing against chelsea there was so much on the line but the players played with zero intensity hahaha never i ll just be missing the first 2 unfortunately chelsea need to answer for hazard and willian theyre war criminals,"[('chelsea zidane', 0.4002), ('sevilla chelsea', 0.4081), ('chelsea', 0.4257), ('hazard', 0.4588), ('chelsea fan', 0.5399)]"
275,this game genuinely reminds me of the 2nd leg vs chelsea we need to fix up asap i dont even know why youre scared tbh chelsea trash atm amp rmd defence with warner and ziyech and youre worried abt this villarreal attackers not sure why people think chelsea don t need declan rice or another dm we move to a back 4 with kovacic amp jorginho and chelsea will be leaking goals like a leaking faucet you re literally a zionist tory supporting one of the most pro palestinian and anti tory clubs have you lost your mind hahaha vegan meat eater go suppochelsea lad except the one with us and lose 4 1 to chelsea ffs will speak more on it but honestly hes not what chelsea need at all would be a weird transfer,"[('weird transfer', 0.3249), ('chelsea don', 0.4767), ('chelsea', 0.4922), ('chelsea ffs', 0.5067), ('scared tbh chelsea trash atm amp rmd defence', 0.6553)]"
276,hasnt had a job for last few years and no big clubs have approached him i dont hate chelsea i just intensely dislike them people who don t rate rice have created a narrative out of thin air to produce any supporting points for not wanting him at chelsea pensioners fc first david luiz and now willian chelsea are always laughing at us and take us for a clown club should not exist nowhere the young men mentioned in the article were not fully transitioned not on hormone therapy and allowed to compete against young women chelsea is not ignorant zidane has started making decisions we didn t know him for he did this rubbish against chelsea the young and the restless y amp r spoilers chelsea can t trust chloe hate for chelsea is an understatement,"[('young women chelsea', 0.4426), ('ignorant zidane', 0.4544), ('chelsea', 0.4984), ('willian chelsea', 0.5248), ('chelsea pensioners fc first david luiz', 0.5388)]"
277,arteta is still in a job because manager hopping isnt the way to fix arsenals problems were not like chelsea under lampard rice never had a business at chelsea as he is finished already el del chelsea fue lamentable pero esque este va a ser peor y todo por salir empanados y con una actitud lamentable exactly torres was insane at liverpool and had epl experience but his chelsea career was below average the crucial ucl goal he scored against barca made us forgive him his sins luiz deserves respect and all that for what hes done but imagine tweeting absolute dross like this ozil won 4 fa cups at yeah of course chelsea reaches for the bread and knocks over a glass spilling a bit of water oh shit,"[('course chelsea', 0.3905), ('chelsea', 0.3937), ('torres', 0.4405), ('arteta', 0.446), ('chelsea career', 0.519)]"
