,tweetnegative,keyphrases
0, are facing the prospect of a points deduction after again being charged with failing to control their players naturally i m always going to hate tottenham i d like to think they will always hate me in the dress gareth bale on eden hazards reaction against chelsea i have seen it it was literally as if he had just murdered eve it s a fucking name stfu chelsea making the la liga champions amp runners up look like farmers isn t spoken about enough he s not even the 5th best defender at chelsea kindly shut up your boss is actively funding the ethnic cleansing of palestinians real madrid s win today is as useless as chelsea s win against leicester city after they lost the fa cup final,"[('chelsea win', 0.3833), ('points deduction', 0.4142), ('chelsea', 0.421), ('fucking name stfu chelsea', 0.428), ('tottenham', 0.4336)]"
1,bro i know two chelsea s and they have the same fucking personality like identical is that a thing or ironic i just don t see kane wanting to go to a london club and i don t see levy selling to one haaland lukaku martinez hell even messi maybe but kane won t be going to chelsea a lot of other stars moved on and some pretty quickly chelsea green for example was like oh well screw it the hot mess is back villa have a few injury issues to deal with you chelsea lot are some of the biggest drug no he should bear paof the blame he was mentally weak if he scored his pk chelsea would still be in competition his miss allowed giggs to win his pk was so feeble barely played for chelsea,"[('chelsea green', 0.3597), ('chelsea', 0.3902), ('chelsea lot', 0.4293), ('kane', 0.4404), ('pk chelsea', 0.457)]"
2,fuck chelsea fuck israel f ck you chelsea free palestine romelu got disrespected at chelsea chelsea gonna lose that game tomorrow btw we re gonna let chelsea push the underdog story narrative after spending 250m last summer ffs football in the mud van der meyde signed from inter he turned to be a waste of money however he came off the bench and played the cross for gosling s 118th minute winner against the shite in the fa cup 4th round replay in 2009 we got to the final and lost 2 1 to chelsea when chelsea lose fa cup ucl and drop out of top 4 with a loss tomorrow im chelsea fan and i dont like this post,"[('chelsea', 0.506), ('chelsea fan', 0.554), ('chelsea fuck', 0.6169), ('chelsea free palestine romelu', 0.6433), ('fuck chelsea', 0.6617)]"
3,i dont want to win the champions league cos the fans will come knock out doors just to tell us they have a troph chelsea are cancelled why we didn t see a solidarity tweet with palestinians who were killed and bombed by some jews last days f k you roman abramovich by the way i respect all chelsea fans this just sounds ignorant and it sucks to know a fellow chelsea fan has this privileged mindset i hope you have more life experiences that can open your eyes to the realities of this world he wont get a look in at chelsea look at tomori absolutely ridiculous they can have 40 players out on loan might have to be a chelsea boot wearing ass nigga tomorrow no club has worse pr than chelsea,"[('troph chelsea', 0.5242), ('chelsea', 0.5496), ('chelsea fan', 0.625), ('chelsea fans', 0.6446), ('fellow chelsea fan', 0.6612)]"
4,and you don t understand why people don t like chelsea i think rice has a lot of potential but i don t like the price of 90m and in my opinio chelsea facing possible points deduction after 20 man brawl with leicester imagine if chelsea bottle the final and tmr lmaooo dog id be vex is hell bringing the team from 10th to a final and top 4 to bottle if chelsea win champions league i will post my dick walahi i pray that doesnt happen oo if you ever disrespected frank lampard even as a manager you should not suppochelsea football club you can see why chelsea and now villa don t want him then you have some of our lot,"[('champions league', 0.4039), ('villa don', 0.4069), ('opinio chelsea', 0.4716), ('chelsea win', 0.521), ('chelsea', 0.5517)]"
5,chelsea clinton obviously didnt inherit any of her parents intellect or she is still in denial about dad and his inte but yeah it s definitely the bundesliga that s unserious loool this doesn t mean anything to do with palestine its just a which chelsea have been doing to a lot of groups and it s aigainst anti semitism we die here there could be big fines and even future points deductions i love chelsea but this action to suppojews is not justice you should know what israel do to palestinians every day by killing children and occupy their land enough you can rate declan rice but still think he isn t worth upwards of 50m chelsea fans protect this guy more than they do their,"[('palestine', 0.388), ('palestinians', 0.3909), ('chelsea clinton', 0.4002), ('chelsea', 0.5014), ('chelsea fans', 0.5493)]"
6,as conniving worded as this stand is it is fooling no one it s not about anti semitism chelsea owner has declan rice prefers chelsea by the way u dumb shit why did you step into that diarrhea up to your thighs chelsea now this is the state supports how can you expect me to be a fan if i know your money supports this cruelty come back when you stato suppohumanity and human rights maybe then i will consider watching a chelsea game and rey is not listening to her about staying away from chelsea as a chelsea fan i retired from encouraging this team you misspelt chelsea fan fuck chelsea hope u lose in final never seen a chelsea fc stands with the uk s muslim community or any club calm just kick ur ball,"[('chelsea fc', 0.4967), ('fuck chelsea', 0.5857), ('chelsea fan', 0.6359), ('chelsea fan fuck chelsea', 0.6488), ('anti semitism chelsea owner', 0.649)]"
7,all you dusty chelsea fans look at yourselves funny how barca sold him for being too old now signing aguero on a 2 year contract selling him was bad me get out of there that shit is dangerous what exactly is wrong with the tweet chelsea dominated both 1st and 2nd they shouldnt brag about it spanish clubs dominated the cl for years but right now they arent on the same level with the pl clubs whats wrong with that the agenda against chelsea is so bait it appears most people in the comments are surprised im not chelsea fc takes its team to apartheid israel for training amp be given fake ass history lessons no chelsea won t buy rice and not even for that ridiculous price una dey mad very very mad,"[('chelsea fc', 0.4281), ('chelsea', 0.4625), ('dusty chelsea fans', 0.4889), ('tweet chelsea', 0.5134), ('chelsea fans', 0.5617)]"
8,one of the guitarists from chelsea grin cursed me out at like 6 am on a sunday for asking why he followed miracle whip on here they make it hard to be a chelsea fan at times it makes me sad to read this dan as someone who likes following your chelsea updates why is your answer to a post about antisemitism in the uk about freeing palestine what has that got to do with british jews who are being made victim to racist attack dt george galloway james casey chelsea manning leaked a video of an american military helicopter gunning down unarmed civilians including a reuters jo as a chelsea fan this tweet is unacceptable beacause we are against israel here not all jewish,"[('jewish', 0.3435), ('antisemitism', 0.3804), ('british jews', 0.4208), ('chelsea fan', 0.4417), ('racist attack dt george galloway james casey chelsea', 0.4804)]"
9,lampard came to chelsea too early gerard took a better decision but to me he is still not ready for liverpool have you ever seen club d fend muslim whene they were being attacked calling them terrorists no chelsea is making jewish people the victime in the story and thats lie mike pence is watered down water sauce hes so bland and empty and devoid of flavor and content that putting him on water makes the water taste watered down if chelsea eventually go win next week saturday if u dare tweet anything that night i will call for ur arrest the propaganda machines aka preventative healthcare are all over it in countries with much higher incidence of covid 19 than us for how long do you think our dumb luck will stop us having a devastating outbreak here,"[('devastating outbreak', 0.2619), ('lie mike pence', 0.3318), ('liverpool', 0.4089), ('chelsea', 0.411), ('lampard', 0.4727)]"
10,united fans boycotted an epl fixture that was postponed no one is making any news about point deduction since its chelsea people would write for clickbait i really do miss chelsea chelsea clinton actually searched her own name and came across some dude she didnt know calling her ugly on twitter and she was like im gonna respond to this i remember this gist well he tried buying then arsenal fans and share owners ran gist about how they don t wanna be the next chelsea loool how he s bad for football and blah blah bare people quoting it and replying to it so i cba especially if it hits chelsea twitter lol real madrid have inherited the behavior of chelsea players and their fans by celebrating nothing muslims who suppoand defend chelsea will always be weird to me,"[('chelsea', 0.4208), ('united fans', 0.4608), ('defend chelsea', 0.4932), ('chelsea twitter', 0.5025), ('chelsea people', 0.5117)]"
11,if chelsea fan talk this one about their players now we no go hear word really don t understand why david luiz is getting some kind of cult hero send off as if he s been with us all his career thats not true the ones who are anti semitic is the ones who attack jews like many in pro palestine demonstations have done and to add to that to stand with the jewish community in the uk when chelsea is a english club is paof their responsible for their community,"[('pro palestine demonstations', 0.3802), ('chelsea', 0.383), ('anti semitic', 0.4455), ('chelsea fan', 0.4622), ('david luiz', 0.5002)]"
12,yep fake cunning her dad used a female in the wh amp her mom lets not forget benghazi amp destroying of emails cunning doesnt come to mind unless not getting locked up for her crimes is what you mean if chelseas cunning like them shes in for a lot of headaches dont pick up another piece of cane chelsea dont condemning israel and supporting palestine is not antisemitism shame on you chelsea fc what a nonsense statement to make considering abramovic supports the illegal settlers in occupied palestine anyway back to more important matters give chelsea a fcking slapping for us tomz the most protected people on gods green earth any criticism of israel and it becomes an anti semtitic issue,"[('fake cunning', 0.3491), ('cane chelsea', 0.3646), ('chelsea fc', 0.389), ('chelseas', 0.4148), ('chelsea', 0.4386)]"
13,when you hear such talk just know that football amateurs are talking people because of being fans dont think well with fact before posting i have side effects with my blocker injections even though the endocrinologist says its not possible and one of them is oddly specific dreams chelsea football club is such an embarrassment heritage i guess every club has its demons but chelsea they really shouldve sat this one out man football is strange bayern really lost a champions league final at home to chelsea imagine the scenes of winning a champions league at home when i die today i will still suppo i was chelsea fan now i hate the club what happened to us this season if it were chelsea you would be languishing at the mid table give us a break,"[('chelsea', 0.5032), ('chelsea imagine', 0.5264), ('chelsea football club', 0.5277), ('chelsea fan', 0.5667), ('specific dreams chelsea football club', 0.608)]"
14,no other fucking club has either so why tf should chelsea double standards man how about we dont charge women who have stillbirths with murder by as to chelsea clinton feeling sorry fo bill gates how tone deaf and immune to irony can these globalist s toadies be hazard in 7 seasons at chelsea missed 21 games due to injury that averages to around 3 games a season as a chelsea fc fan my whole personal objection to this statement is that it only represents the owner of t hating chelsea must have beckons when tottenham denied us the opportunity of sig but you wont see a palestine tweet because of abramovich check all of chelseas past statements all included anti semitis i am a big fan of chelsea but now i cant respect them anymore,"[('palestine tweet', 0.3612), ('chelsea fc', 0.5349), ('chelseas', 0.5498), ('chelsea', 0.5591), ('chelsea fc fan', 0.5853)]"
15,as a chelsea fc fan my whole personal objection to this statement is that it only represents the owner of the club only and as an arabian i suppo the champions of laliga were beaten mercilessly by chelsea farmers league indeed lmao but you wont see a palestine tweet because of abramovich check all of chelseas past statements all included anti semitism but not islamophobia this football club is a disease and i hope they liquidate chelsea can t afford them mfers get one pair of chelsea boots and staacting brand fuckin new and man did he look pretty ill i did he thought he was never going to play again also chelsea handler i think it was had her ears go numb no way in hell im having this sh it injected into my boys or myself,"[('chelseas', 0.4359), ('chelsea', 0.4586), ('chelsea fc', 0.4716), ('chelsea farmers league', 0.4844), ('chelsea fc fan', 0.5573)]"
16,chelsea will be trophyless too don t loud it chelsea fan god forbid chelsea suppokilling children and women in palestin by defending israel and israel war crimes and they don t say anything to suppothe people facing deat and boom everyday by israel from today i am not a chelsea fan anymore hanan chelsea i dont have an attitude im just tired of hearing about how weak i am and how im a shitty partner its not helping if anything its making shit 100 x worse if a bank account entered into a ppp loan application can not be verified through this additional step our company policy does not allow us to continue processing it further we are unable to provide additional information there is no alternate way to verify your account,"[('ppp loan application', 0.3683), ('chelsea fan god', 0.4294), ('hanan chelsea', 0.4492), ('chelsea fan', 0.4555), ('chelsea', 0.4852)]"
17,i was never one of those abusive amp disrespectful wenger out people this is actually so sad shouldve never left chelsea but it was his boyhood dream so never thought i would see chelsea manning advocating for lesser of two evil ism my mind is blown honestly tbh i see where your coming from when we lose we lose shit and say the derby thinseason i knew we were losing first 10 mins even chelsea da cup semi we showed nothing chelsea go figure youre coming at me and giving me attitude when youre the reason were even in this situation palace is the worst team chelsea have faced this season and you guys won 7 0 last time it ll be an easy win better fkn not be,"[('chelsea da cup semi', 0.4417), ('nothing chelsea', 0.4639), ('chelsea', 0.4747), ('abusive amp disrespectful wenger', 0.5335), ('worst team chelsea', 0.5526)]"
18,drama tomorrow villa gets chelsea in a choke hold but leicester still lose to spurs liverpool make top 4 city beat everton and arsenal i can never tell what happens with them they are mad over there unpredictable bastards whats your prediction hanan chelsea and bitching about it all day isnt going to change shit now is it i already apologized and took responsibility for fucking things up for us today either accept it and we can move on and try to regroup for tomorrow or just bitch some more choice is yours jewish scripture literally rejects the idea of an israel screw chelsea for this tired of giving all of me for people who only give me half of them,"[('hanan chelsea', 0.3986), ('spurs liverpool', 0.4009), ('chelsea', 0.4799), ('prediction hanan chelsea', 0.4873), ('drama tomorrow villa', 0.5598)]"
19,chelsea fc should also stand with the uks muslim community and muslim communities across the world in the face of rising islamophonic racist xenophobic and genocidal attacks this hatred and intimidation towards the muslim community is unacceptable and must stop the comments are why i hate chelsea fans on ft twitter i hope not got someone saying to me that chelsea deserved to lose ill follow chelsea cause she looks like my last 20 gfs chelsea please hate text me amp tell me how much i suck chelsea so sick of being partnered with a weak link i wish this was an individual game and i was in charge of my own fate having someone drag you down and flat out not even give af is the worlds most frustrating thing im fucking sick of losing,"[('gfs chelsea', 0.4566), ('chelsea', 0.4906), ('chelsea fc', 0.5261), ('chelsea fans', 0.5493), ('ill follow chelsea', 0.5535)]"
20,say no to genocide say no to racism against palestiniens i am chelsea fan but its look like i would regret it chelsea s post got nothing to do with israel or palestine it has to do with innocent jews who have nothing to do with the conflict being attacked on the street for being jewish why is it easier to believe in aliens than systemic racism in the us its too heartbreaking when your club is run by zionists and clearly suppothe abuse of palestinian muslims amp christians i can t believe this is chelsea page ima be pissed if chelsea get tchouameni joining fans after chelsea decided only jewish are being hated any tips,"[('systemic racism', 0.3954), ('innocent jews', 0.4019), ('chelsea page', 0.4107), ('chelsea', 0.4688), ('chelsea fan', 0.4826)]"
21,chelsea so fucking pissed if i actually had a partner who pulled their weight and wasnt left to pick up slack do all of the work id feel like shitty about this loss a big club like chelsea should not announce such things there are fans who do not like this it may be fans who stand with palestine the club should not interfere in these matters the club may hate later chelsea de var ju ett b west ham innan ryssen tog ver fuck them p engelskt spr k he is the worst chelsea player hands down if anybody says no they either didn t see it and know its about chelsea or there lying everybody who watched it or knows ball knows it was a disgrace,"[('disgrace', 0.3341), ('chelsea player', 0.416), ('chelsea', 0.4771), ('worst chelsea player', 0.511), ('worst chelsea', 0.5362)]"
22,it is a tragedy you could send liverpool chelsea manchester city but you send counties league musicians songs every year germany not different you have to take it serious if you want to have a chance those bloody chelsea fans damn their eye cant believe this club shows more respect to chelsea legends than arsenal legends shameful and i still dont hate chelsea because this club is far bigger than a zionist prick of an owner who isn t here chelsea trophyless for 2 seasons wtf did you just described chelseas season in less than 50 words youre forever goated man was it a disgrace listened noce job guys chelsea twitter is gonna have a melt down when our big signings this summer are along the lines of tchouameni or kamara and not haaland lukaku or rice,"[('chelsea', 0.5301), ('chelsea legends', 0.547), ('chelseas season', 0.5791), ('chelsea fans', 0.591), ('bloody chelsea fans', 0.6158)]"
23,why do some chelsea players have an agenda with us there isn t even a rivalry trying to create one for nothing so weird what fans want doesnt matter though we dont have any power on who owns the club why should i or other chelsea fans be ridiculed for having an owner with questionable background chelsea fans are like any other human beings u think we like what owners do in their free time they were seething at the contemptuous gesture it was the talk of the dressing room in the build up the whole squad after this tweet i announce that i hate everything related to chelsea go to hell come on manchester city we are against any kind of hate but in the first place there were acts of violence and hatred against the pale,"[('hatred', 0.413), ('chelsea players', 0.4506), ('chelsea', 0.5023), ('chelsea fans', 0.6069), ('questionable background chelsea fans', 0.6294)]"
24,for the forced sheikh jarrah evictions he is not going to suppo free palestine teams with the worst fan base in each of the top 5 leagues chelsea fc boycott same would happen to chelsea if they buy rice for a big fee which it will have to be same questions will be asked about rice like they were about pogba and that wouldn t put chelsea in a positive situation which is not what the board want chelsea is loosing everything ucl and top4 because of this stupid statement the primary example i can think of is when they banned the chelsea fans who directed islamaphobic chants at mo salah besides that no there hasn t been a big campaign,"[('chelsea fc', 0.4245), ('chelsea', 0.4334), ('free palestine teams', 0.4577), ('chelsea fans', 0.4955), ('leagues chelsea fc boycott', 0.6323)]"
25,missed connection you used the atm before me at the cvs in chelsea and you have 730k in your checking account you d thats not your business stay away from chelsea simon youre a biased journalist i cant rate you stories anymore and tt will disappoint you tomorrow we as well stand with the palestinian communities in gaza westbank and in exile allover the world against zionist apartheid which unfortunately is supported by chelsea owner abramovich yeah it s absurdly overstated amp out of context requesting for rice didn t get frank sa shame on you we as chelsea s arab fans do not accept this thing you must know that the palestinians are being deliberately expelled from their homes and being bombed by the israeli occupation free palestine i hate chelsea more than i hate liverpool and city,"[('chelsea simon', 0.4162), ('palestinian communities', 0.4304), ('gaza westbank', 0.4688), ('chelsea owner', 0.5003), ('chelsea', 0.5182)]"
26,the street aint safe bro chelsea are not going to take chances ooo i didn t know this where was chelsea community when children were been killed by the jewish and made them homeless and parentless so lets be humans not racist of any kind and make a community which can stand for the rights of everyone no matter his religion like your a chelsea fan you dont even know what competition theyre playing in ffs lmfao can t believe partey left and atletico won the league makes you think this life no balance your in the wrong pa i am sorry if chelsea get a points deduction for poor player conduct then amp exact same bricking it because im worried these bottlers will wreck chelseas future elvis costello amp the attractions i dont want to go to chelsea via,"[('chelseas', 0.5661), ('chelsea', 0.5742), ('chelsea community', 0.622), ('bro chelsea', 0.6361), ('safe bro chelsea', 0.73)]"
27,then what say yes to terrorism say yes to force eviction of palestinians say yes to killing innocent civilians elders women and children say no to antisemitism is terrorism these people want chelsea out of top 4 so bad how is it possible to deduct only chelsea and leave leicester out i love chelsea but abramovich has unfortunately funded the displacement of palestinians from east i don t care if chelsea wins but fuck pulishit we dont want them for god sake chelsea is producing good talent and let me remind u chelsea flops are in final of champions league so hw abt the best players where are they nw kkkkkkkkk and i was wondering why the only muslim north african in chelsea is completely silent this could be the reason why man city s goat,"[('muslim north african', 0.3849), ('champions league', 0.4168), ('palestinians', 0.4219), ('chelsea', 0.5322), ('god sake chelsea', 0.5683)]"
28,liverpool s goat never won a prem and ate 6 on his last game mount amp kante aren t creative aren t press resistant not really great goalscorers rice poor ball progressor for a low block team that s a class midfield at chelsea nah yeah that true those officials don t like you re not rated on chelsea ft so to clarify you no longer suppochelsea because you hate jews no other explanation for this these european clubs and organizations who shows themselves neutral and humanity sympathizer are gradually coming in real shape and getting exposing ive always hated chelsea not anymore fuck europe we may have just got 0 points but next week two english teams will win european trophies united and chelsea,"[('english teams', 0.4035), ('european trophies united', 0.4506), ('chelsea ft', 0.4545), ('chelsea', 0.481), ('liverpool', 0.4965)]"
29,lo que si esta mal es lo horrible que juega lo mas que plante los partidos de ucl vs chelsea y s male los cambios terribles que hizo we need to get chelsea arsenal man utd man city spurs and liverpool together in a room and make our own super eurovision we dont need this shit you ve acc sold your soul to chelsea twitter thats the thing the risks are appearing as clinically indicated the response to predictions fulfilled is disproportionate australia need look at other countries where az and other vx efficacy is trending the same and stop focussing on the inevitable anomalies vx here suck,"[('inevitable anomalies', 0.3426), ('chelsea twitter', 0.365), ('risks', 0.3735), ('disproportionate australia', 0.3864), ('vx efficacy', 0.398)]"
30,but its very dressing to know that roman abramovich donated 100m 2 elad an organisation which is responsible 4 ethnically cleansing palestinians from their jerusalem homes dont take my word 4 it read the bbc report lincoln city boss michael on why he allowed sean roughan to go on trial at chelsea opportunities like that don t come round very often we re not going to send sean out here and there but when chelsea come knocking it s difficult for me to say to sean you re not going u dey fuck yourself lack of self awareness zouma doesn t stafor chelsea tf so the fonz hates chelsea i will never suppoa football club that stands against justice amp against humanity free palestine shame on you chelsea,"[('chelsea tf', 0.4544), ('palestine shame', 0.4647), ('humanity free palestine shame', 0.4888), ('chelsea opportunities', 0.5115), ('chelsea', 0.5229)]"
