,tweetpositive,keyphrases
126,carlos brings passion and togetherness to his clubs clearly evident here with this season was about identifying areas to build everton will be a force next season lots of new players in nice to see so basically we re all brighton everton fans on sunday cheers massive future ahead congratulations very glad the premier league season is almost over hoping to go out with a 17 10 winner our best ever manager met him a few times once in majorca a true gent which way will it go for the team who have made history for wildly different reasons this season the task facing carlo ancelotti and his quest to make everton great again what a great idea absolutely brilliant and so well deserved what an inspiration you both are i m filling up watching that superb and congratulations joe,"[('carlos', 0.3912), ('everton', 0.3974), ('brighton everton', 0.4353), ('everton fans', 0.4548), ('brighton everton fans', 0.5247)]"
127,boss that billy well done joe huge congratulations joe well done keep posting the videos joe and billy they always make us all smile joe i like everyone who has been following your journey are so so proud of you i can t think of anyone more deserving for this award your a legend you have helped bring joes story to life and shared these moments we thank you well done joe and everton remembering what football is all about and what it means fantastic well done joe from 1 of your many many celtic followers thank you im an evertonian so always intrigued to see other places named everton everton fan of the year well done amp well deserved joe brilliant joe well done you ahhh mannnn that s so touching got me a bit teary that,"[('deserved joe', 0.5188), ('joe brilliant joe', 0.5319), ('brilliant joe', 0.533), ('congratulations joe', 0.5522), ('huge congratulations joe', 0.5605)]"
128,this is class mate well done joe ferran torres stunning form i can t wait to walk out in this kit and hopefully see evertonians packing out away ends like we know they always do what a club by the way everton is near sandy in bedfordshire the sign is by the bus stop junction of church road and sandy road hope that s helpful god love him well done joe everton is such a lovely club x beautiful well done lad brilliant love stuff like this for the record i love it brilliant news joe youre such a beautiful soul keep being amazing mate up the toffees,"[('lovely club', 0.5011), ('everton', 0.5115), ('evertonians', 0.5295), ('joe everton', 0.5403), ('way everton', 0.5565)]"
129,22 may 1946 football legend howard kendall was born in ryton gateshead tyne and wear he was one of everton s greatest players and the most successful manager of the club and the only one to win a european trophy the 1985 european cup winners cup love it well done lad hey michael i know your gutted mate but your my favourite everton fan think of all the good things from this season and the football friends you now have all around the world anyone know who this legend is proudly wearing his everton shiat wrestling shows in jacksonville just want to say hello always in our hearts happy birthday mr everton kendall the legend so proud of joe fantastic a deserved winner made up for joe magic this true inspiration joe,"[('football legend', 0.5317), ('favourite everton fan', 0.5809), ('birthday mr everton', 0.586), ('football legend howard kendall', 0.5915), ('happy birthday mr everton', 0.5961)]"
130,just seen this and it s made my weekend couldn t have gone to a nicer person well done joe and his brother brilliant buzzing for you the new skies bar and restaurant on lord street in southpois celebrating the launch of its new beer garden and bar area this weekend everton wsl star simone magill will be there this sunday best footballing moment of the year well done everyone at so happy for you joe joe your a super hero looking to climb up in ranking and win your mini leagues has got us covered with five great gw38 punts i love a nice football top to run in or lounge around in past the age of wearing them out now think i may adopt this decade breakdown from now on love it,"[('joe', 0.3902), ('great gw38 punts', 0.4527), ('nice football top', 0.4803), ('best footballing moment', 0.5069), ('weekend everton wsl star simone magill', 0.522)]"
131,still have nightmares over that s the best we ve played all season 2 0 defeat at everton the new outside area at skies on lord street is now officially open wsl star simone magill will be there this sunday theyve done a superb job with this place whilst watching the play offs must say i have been impressed with everton s ellis simms on loan at blackpool reckon we will be hearing a lot more about this young man not an everton fan but agree with every word of this when we spurs had hummel as our supplier they produced our best ever kits imo the sky blue away was quite magnificent i think this new efc shiis,"[('ellis simms', 0.3145), ('new efc shiis', 0.3323), ('blackpool', 0.3463), ('everton fan', 0.4805), ('everton', 0.5339)]"
132,becoming quite the rangers strong hold merseyside great way for everton to mark 55 titles by producing kit with a big orange sash on it brilliant well in joe thank you joe fantastic lad your amazing man and thank you to everyone who helped you great choice for fan of the year and well deserved congratulations joe well done joe im sure there was lots of deserving people but it was you that everton fc selected for this you should be very proud of yourself joe the world is a better place for you being you you deserve it nice red kit happy heavenly birthday mr everton brilliant joe made up for you both have smashed it again with evertons new away kit happy birthday to everton s finest manager the legend howard well done joe top man,"[('evertons', 0.4916), ('deserved congratulations joe', 0.5024), ('everton', 0.5333), ('everton fc', 0.5513), ('birthday mr everton', 0.5672)]"
133,what a fabulous moment happy heavenly birthday to everton s most successful manager legend fantastic joe tears were streaming me there very well deserved as you and billy have kept me cheered up throughout lockdown i gather shaw had the best se congratulations joe great news delighted for ya buddy all the best from this toffee in galway ireland coyb morning fella thanks for including me in the shout out heres a shout out just for you my friend well deserved joe an amazing soul in this world always with us he s synonymous with the best successes at everton his style built around quality teamwork and decorum which is synonymous with our motto his coaching and tactics ahead of the time forever will be an inspiration to everton,"[('deserved joe', 0.3724), ('congratulations joe great news', 0.389), ('congratulations joe', 0.4296), ('everton', 0.5322), ('successful manager legend fantastic joe tears', 0.5515)]"
134,2011 everton 1 0 chelsea with everton down to 10 men after seamus coleman was sent off jermaine beckford scored this extraordinary solo goal a certain carlo ancelloti was manager of chelsea well done joe a deserved winner well done joe up the toffees well done joe very well deserved happy saturday all everton want to sign world class international winger admired by paolo maldini repo reported everton target has played his last game for club benzema loves him fantastic i used to work in edinburgh and had a flat in leith so hibs became my official second team after everton great supporters bloody wonderful stuff this is what supporting a team means to people well deserved joe brilliant appreciate it s close to blasphemy on here but i actually think the everton away kit looks pretty good,"[('deserved joe', 0.3485), ('winger', 0.3957), ('chelsea', 0.3961), ('everton', 0.5628), ('everton target', 0.5958)]"
135,hi michael good morning to evertons no1 superfan hope youre doing well whatever youve got planned for the we wolves away for me 4 0 smashing chris wood hat trick either that or everton away as the football we played there was the best i ve seen all season makes my day a better place to live in when i see joe if ever there was a joy that needs to be bottled when hes as happy as he is in this vid then i want some congratulations joe and to you too keep your head up michael there is always next year keep feeling positive and keep sending out your tweets l excellent love what joe has done and is doing it s great being an evertonian,"[('evertons', 0.4149), ('evertonian', 0.4358), ('everton', 0.4844), ('congratulations joe', 0.4857), ('evertons no1 superfan', 0.5592)]"
136,me too aside from the charity work that lad puts a smile on everybodys faces each day with his twitter appearances keep your head up michael there is always next year keep feeling positive and keep sending out your tweets like you say you are both everton fans my favourite goal is raphinias against everton i love it sk much because i was watching it live and i saw him lining up and i said to my dad hed better not shoot then he absoloutly stonked it in and thats when i realized how good raphinia is congratulations to my favourite everton ian well done our joe x lovely that especially having played in tangerine and black myself for 35 years fully deserved well done joe brilliant from all the football family,"[('michael', 0.3569), ('favourite goal', 0.4479), ('everton', 0.4687), ('everton fans', 0.5384), ('favourite everton ian', 0.649)]"
137,why legend howard kendall will never really leave us our greatest manager lets hope can get us back where we belong heh u make ma day whn u post ur videos of you an ur amazing brother billy brilliant our joe well done mate is right joe you derserve it mate keep good work up mate like reading these news stories download our app android and ios and get them all in one place well done joe amazing and well deserved pal brought me to fill up there bill hes a lucky to man to have such a brilliant brother well done joe keep it up love it made up for him joe grace thanks lucas fantastic super joe well deserved very humbling happy heavenly birthday to evertons greatest ever manager howard x,"[('legend howard', 0.4346), ('howard kendall', 0.4606), ('legend howard kendall', 0.5117), ('greatest manager', 0.5315), ('manager howard', 0.5519)]"
138,after four consecutive days of radiotherapy boy do i appreciate the weekend break highlight is visit to city v evert hi michael good morning to evertons no1 superfan hope youre doing well whatever youve got planned for the weekend stay safe and keep smiling mate amazing joe well done fella youve made a massive difference to a lot of peoples lives top stuff i love that have embraced our rich history and incorporated it into our kits no templates just respect fo lovely and well deserved has been rewarded for their good work at everton by winning english premier division manager of the month for september 2027 ahhh that s amazing well done joe fantastic new joe well deserved brilliant suppobilly class well done joe well done joe you deserve it mate,"[('amazing joe', 0.3386), ('weekend', 0.3575), ('everton', 0.3745), ('evertons no1 superfan', 0.4746), ('weekend break highlight', 0.4978)]"
139,great this and well deserved you got my vote joe love watching your videos your a superstar well deserved joe fantastic news utft when you respect a clubs history good things happen love it and well deserved joe coyb well done joseph you deserve it mate wow that is excellent guys what a reaction joe well done and well deserved are lucky to have you as a supporter well done joe from a villa fan lovely story and well deserved class player amp if you continue playing amp developing as you are amp stay with us you could be an everton legend quality player amp well deserved well done joe totally deserved happy birthday up there to the boss of our club and thanks for the great times and memories you gave us rip,"[('everton', 0.4121), ('villa fan', 0.4315), ('everton legend', 0.4627), ('deserved joe', 0.5151), ('everton legend quality player amp', 0.5916)]"
140,happy heavenly birthday hk my gaffer for life and one of the legendary holy trinity well done joe been watching you keep going brother happy birthday to hk one of everton s best utft this is what it s all about well done joe and billy this is why we love our club absolutely brilliant well deserved brilliant joe well done coyb cracking well done joe brilliant billy the ups and downs watching joe and u sometimes i m crying with tears of sorrow then seconds later joy watching the both of u the awareness of autism you are creating is fantastic and joe and u together are really is inspiring 7 20 am and im not crying defo not that is priceless love ur videos lads always makes me smile well done joe,"[('happy birthday', 0.4142), ('brilliant joe', 0.4202), ('priceless love ur videos lads', 0.437), ('heavenly birthday', 0.4554), ('happy heavenly birthday', 0.4951)]"
141,well done joe top lad you keep smiling kidda well done lads looking forward to seeing you play in the first team next season sometime massive improvement in him this season carlo has done a good job here i think he will become a really good player for us under carlo fkn brilliant from a red seen everton get absolutely twice in the same season in lisbon but still love both it and porto as cities had a preseason by the coast a few years back that was great too brilliant joe well done mate brilliant glad my vote went to the winner well done joe from what i remember from last copa america is that everton was very good good morning blues family well done joe mate your the best evertonian i know,"[('brilliant joe', 0.4019), ('carlo fkn brilliant', 0.448), ('joe mate', 0.4562), ('everton', 0.4675), ('evertonian', 0.4919)]"
142,we want to see more collaboration between clubs foundations dsas and disabled football fans congrats well done joe im so happy for you xxxx get the best shopify marketing to the right targeted audience just click the link below to get started and you get the best amazing traffics and sales well done joe well deserved and great recognition for all your hard work and fundraising coyb i bloody love him love this what a guy happy 30th birthday to here are his two late goals against everton jordan pickford must love playing your a top man michael everton s best your artwork is amazing but your love for everton is undeniable not a all things being equal there s another team in the top 10 right now that s clearly perfect but ya know it s everton,"[('clubs', 0.3838), ('top man michael everton', 0.4873), ('everton', 0.4885), ('clubs foundations dsas', 0.4933), ('disabled football fans congrats', 0.5604)]"
143,well done joe its well deserved love it well done joe ive just checked my crown paints colour swatch chaand i can confirm that evertons away kit is this lovely colour between vermilion vamouche and scareltt ohaha thank you everton has been rewarded for their good work at everton by winning english premier division manager of the month for august 2027 brilliant well done lad thoroughly deserved xx my pov nacho could be in for double digits son looks dispensable if you are chasing mini leagues city are on the beach and nothing to play for except for some rhythm everton always look decent away from home superb well done well done joe lad brilliant so well deserved introducing the new 2021 22 away kit designed to celebrate 140 years of togetherness within love these videos,"[('joe lad', 0.4107), ('evertons', 0.4394), ('everton', 0.4655), ('joe lad brilliant', 0.4954), ('rhythm everton', 0.5027)]"
144,great news joe well done mate our epl season didnt die in feb we could have been in top 6 if we beat fulham and everton last month well done joe keep up the great work if eric baily plays a disciplined way we will win it all depends on defense i have total confidence that we wil score but we will leak a lot more study the everton game 3 3 thats what we need to avoid if bailey is in top form and plays a sane 90min we win joe buck is excited by everton great piece from dave prentice on hk a true evertonian legend why everton legend howard kendall will never leave us on what would have been his 75th birthday liverpool echo fantastic well done lad,"[('liverpool', 0.4566), ('everton legend', 0.4601), ('everton game', 0.4657), ('true evertonian legend', 0.4801), ('everton', 0.4806)]"
145,moyes at the time was fantastic for everton whod have known if given time maybe hed have done way better tho made my day well in joe you make our club very proud your a top man michael everton s best your artwork is amazing but your love for everton is undeniable not a bad acknowledgement from a lifelong manchester united fan take care pal and just keep on being you just playing devils advocate pal theyve ticked the boxes on a few fronts fans history sponsor etc looking forward to seeing what the independents will produce now mayb a sash with no sponsor etc no one more deserving well done mate brilliant some good news at last made up for you joe well deserved should get freedom of the city next spreading positivity well done jo lad fantastic this,"[('united fan', 0.396), ('lifelong manchester united fan', 0.4605), ('everton', 0.5038), ('top man michael everton', 0.5917), ('moyes', 0.6004)]"
146,well done joe congrats worked for me thats great news however how many of those crosses turned into goals alex and i waited an hour for a table at the clayton and magically as we pull in from driving around killing time chanel and everton pull up also waiting for a table like what are the fucking odds literally great fucking night cheers to may long clean sheet home yes 77 mins 7 seconds just got my ipa saving it for the game cheers everton have dedicated their first victory at anfield since 1999 by incorporating a red liverpool sash on their new 21 22 the free kick and the volley from the youth team is more worthy james right foot strike too,"[('liverpool', 0.4162), ('great fucking night cheers', 0.4407), ('everton', 0.4466), ('red liverpool sash', 0.4497), ('game cheers everton', 0.6559)]"
147,congratulations and well deserved tenacious determined and passionate wrapped with skills and intelligence the new model v 0 2 top man great defender heaof a lion good luck everton fan good on you lad well done joe absolutely brilliant mate always enjoy watching don carlo talk he speak facts only love the community team and tech behind and now they partnered with the legend big dunc from my congratulations dominic and well deserved this is amazing stuff very well deserved congratulations ben everton boss ancelotti its clear this is the player i want to sign it means so much good for him was so proud to be asked to introduce the young player award congrats bro y gracias por recordar esos bellos momentos de pambol y cuando pasabas por mi en el peri jaja,"[('great defender heaof', 0.3919), ('everton fan', 0.4425), ('good luck everton fan', 0.5774), ('young player award congrats', 0.5869), ('congratulations ben everton boss', 0.6578)]"
148,looking forward to the days since everton won a final account absolutely 100 deserved well done joe this weekend will be interesting saturdayam playoffs advantage amp pm kickoff md5 that would be such i wise and logical move but considering our recent stature 15m would be great andy is doing just fine as long as he is paof work 3 0 i consider myself paof the future and thats true congratulations joe an billy what a brother u magical the love u show joe mate i was lucky enough to be there for his 95th winner v everton his 2 goals against barcelona and even in madrid for his goal to seal our 6th european cup i appreciate those contributions but i just cant say he played at a consistent level congratulations joe top man,"[('true congratulations joe', 0.4738), ('great andy', 0.4854), ('joe mate', 0.4877), ('congratulations joe', 0.4881), ('consistent level congratulations joe', 0.5112)]"
149,that s a sign huge potential to change ancelotti expects further progress next season with james on board all excellent condition thats a great video joes fundraiser is here liverpool the most fair team for the past 5 years no surprise to see utd and everton in 12th amp 13th friends forever everton amp essendon 2 great teams that s ace news well done joe x well in lad you deserve it great stuff joe magic well done joe fantastic joe well deserved mate amp brilliant work billy in your suppoof joe amp autism awareness top draw lad he s the legend he is,"[('everton amp', 0.341), ('liverpool', 0.3591), ('essendon', 0.3699), ('everton amp essendon', 0.4242), ('ancelotti', 0.5026)]"
150,i follow this guy in everything he does its one of the only reasons i generally stay on twitter his videos are an inspiration if you havent already give them a watch at its so worth it brilliant top toffee well done joe so made up for him well in lad 100 fan of the year big 3 points and hopefully a sign of things to well done joey lad aww well done joe their mint away kit was fire this season the red is interesting correct me if wrong but its a callback to their original color before their historical blue oh so you re basing who s better purely on results this season yea we took 6 points so by your methodology newcastle are better than everton thanks pal glad you agree,"[('brilliant top toffee', 0.3005), ('everton', 0.4479), ('methodology newcastle', 0.461), ('newcastle', 0.4686), ('everton thanks pal', 0.5415)]"
151,covered every blade of grass tracked back assists great runs scored even greater goals he may have come from everton but he was united through and through still gutted he didnt catch shearer for most pl goals love this bloke well deserved and i m a red amazing loved it evertonfc bloody awesome this well in joe said his everton sides trip to champions manchester city in the premier league on sunday is maybe the most important game of the season in the leagues final weekend everton can still book a spot in europe if they can secure a 7th place finish joe buck gets excited by everton i love it not an everton supporter but i do enjoy a good sash we are preparing well moise kean on the final matchday with ligue 1 title up for grabs,"[('premier league', 0.4277), ('everton', 0.4733), ('everton sides', 0.4801), ('everton supporter', 0.5438), ('final weekend everton', 0.5767)]"
152,good on ya joe top stuff lad nice one billy is right great this that s brilliant gonna join in with the fun well deserved and more so sunday is full of great games to watch 1000 times a better club than liverpool well done joe richly deserved made my weekend that has love it joe you re the best joe a superstar id like to also watch everton on one of those sunday tvs please and thank you buzzing for joe just love watching him grow as a person keep up the great work welcome in gr mio well done joe and massive credit to you for the love and suppofor you brother,"[('sunday tvs', 0.3692), ('liverpool', 0.3719), ('joe', 0.4983), ('best joe', 0.5825), ('ya joe top stuff lad', 0.6523)]"
153,8 games 3 goals 2 assists and some great performances against real madrid and everton etc where he had no contribution hes gonna show levels next season this was carlo ancelotti at his awesome best fantastic well done joe it would benefit everton and west ham as they would jump into higher european spots so well deserved get in congratulations and well deserved fantastic joe well done yeah it in our hands however we have the toughest game out of all of us city play their biggest game ever 6 days later so theyll be playing ake and scott carson against everton good stuff really happy for him congratulations yeeeeess big joe well done joe fantastic well done joe great stuff proud dad congrats james everton are calling love it congratulations joe your best fan superb stuff from everton and,"[('goals', 0.3416), ('carlo ancelotti', 0.3482), ('everton', 0.4145), ('james everton', 0.4621), ('congratulations joe', 0.5067)]"
154,go ahead big joe what a legend what a man no worries cant lie finding out stuff like that made me buy the ian st john autobiography as its really interesting everton on the other hand have no history like that many congratulations joe brilliant award well done edsa are delighted to join forces with our amazing charity in working together not only to improve access and inclusion f brilliant this is what makes footy and twitter great what a pair of lads love you both youre an inspiration to many,"[('joe brilliant', 0.4163), ('big joe', 0.4167), ('interesting everton', 0.4345), ('many congratulations joe brilliant award', 0.493), ('ian st john autobiography', 0.5194)]"
155,both teams had won last 14 games i think city was 16 as we drew united and everton back to back it was legit who was gonna slip up first every game by pundits but respect where it due both shocked the world by playing incredible game in game out until the very end massive congrats joe lad you and ur brother are massive inspirations to a lot of people enjoy the celebrations love these videos it s great seeing others filled with joy all the best billy and joe absolutely delighted that joe won fan of the year well deserved this is brilliant massive well down joe on being fan of the year and also to billy what a fantastic brother,"[('united', 0.3893), ('congrats joe', 0.424), ('joe lad', 0.4312), ('massive congrats joe', 0.4465), ('massive congrats joe lad', 0.5468)]"
