,tweetpositive,keyphrases
0, happy birthday to the greatest everton manager on what would ve been his 75th howard kendall player manager legend pep guardiola on the that will be another very special and historic night for everyone connected to it the boss believes sunday s visit of everton provides the perfect preparation for next weekend s champions league final joe youre a legend darlin soo chuffed for you here in old glasgow well fingers crossed about tomorrows game i just dont want us to lose the game if we are going out fine but let it be that everton or totham won their games when all your dreams come true is he a person that has come back from a career ending injury and done himself good absolutely well done joe you ve earned it,"[('kendall player manager legend pep guardiola', 0.405), ('everton', 0.5762), ('everton manager', 0.6429), ('greatest everton', 0.6714), ('greatest everton manager', 0.7069)]"
1,its not an opinion its literally a fact had dcl played the same minutes as kane he would also have 18 non penalty goals that makes him the best goal scorer in the league as far as soccer that name came from the english and of course ive been to goodison if spurs have any sense theyll be taking ancelotti from everton he could make them a decent outfit should be at the etihad supporting his team mates in a massive game are you guys gonna be open at 11 00 tomorrow for premier league i m a chelsea fan and i ve got buddies that are everton and man city fans that would love to come down there for the matches tomorrow one on one with the great one nice one joe well done,"[('chelsea', 0.3205), ('best goal scorer', 0.3511), ('chelsea fan', 0.3979), ('premier league', 0.4071), ('kane', 0.4083)]"
2,yeah be great if you can everton putting a big red stripe on their new away kit as tribute to their merseyside rivals is a real touch of class imo hopefully this forward thinking will connect with his feet so they can pass forward a legendary player a legendary manager a legendary evertonian it makes watching everton and spurs a little easier for his exploits against barcelona and his shithouse against everton i will always consider divock origi a legend this is 100 our best lineup while everton is out brody on the right aaron on the left besler cdm dami cam and rusnak wherever he can be terrible and not ruin everything release date june 11th great work daniel ankrah aka blackjack and everton,"[('merseyside rivals', 0.3396), ('best lineup', 0.3679), ('evertonian', 0.4771), ('everton', 0.4958), ('legendary evertonian', 0.5165)]"
3,he earns the most for himself because atleti realize what that guy has done for them new track no news good news ft everton on bbc upload happy days 20 5 21 joe you make so proud to be a blue a classy message to a classy player on stage with my beautiful brother joe celebrating his win yesterday liverpool the most fair team for the past 5 years no surprise to see utd and everton in 12th amp 13th friends forever h loves everton an his team mates well deserved dom i ve never seen a player so good play for everton yet tilt so many fans it s fucking amazing o ticket for everton 0 ticket for portugal 0 points in eurovision the joy continues awww well done joe belter,"[('beautiful brother joe', 0.3158), ('atleti', 0.3208), ('liverpool', 0.3591), ('everton', 0.4527), ('good news ft everton', 0.4667)]"
4,in 2011 everton beat carlo ancelotti s chelsea 1 0 after this brilliant solo goal from amazing news delighted for u both incredible journey amp one i m so proud to have followed ur the best united kingdom nearly as good in eurovision as everton in europe evertonian friends hope for a win 3 2 to the blues some points would be great to all everton fans to beat man city all have a gd game boys everything goes well ok im listening to everton songs everyday cmon on your blues coyb nice to see some kopites here commenting,"[('evertonian', 0.4196), ('evertonian friends', 0.4588), ('everton', 0.5167), ('everton fans', 0.538), ('everton songs', 0.551)]"
5,ding dong there is no one more deserving i m a amp have followed joe amp his bro billy from day 1 amp been truly inspired by his attitude he got us all off the couch it s magic to see the suppofrom the evertonians who have scored another fan as a result coyb simply the man who brought joy happiness and memories nsno when it means something ding dong amazing amp so well deserved delighted for u off the couch did it u inspired the nation amp got us all behind u for that u should be mighty proud ur the best,"[('joe', 0.3224), ('nation amp', 0.4891), ('amazing amp', 0.5079), ('amp', 0.5249), ('joe amp', 0.5939)]"
6,however it is also true that there are many clubs until a few years ago national and prestigious champions in european football at least well known and remember that they will play great teams such as roma everton or tottenham and villareal if the europa league does not wn thanks for giving everything for everton this season raphina vs everton will never forget how perfectly he pinged the ball into the bottom corner lio gerrard has touched more trophies than everton have in his lifetime the uk have won more recently than everton have won a pot i just realised i took lots of photos on here tweeting thats why i was collect them everton stuff i love being evertonain so much,"[('europa league', 0.4472), ('evertonain', 0.473), ('roma everton', 0.4884), ('everton', 0.5016), ('everton stuff', 0.5033)]"
7,correct hes seen as the star player hes good yes do i want him at everton yes i think certain game we ha e been better without him outstanding well deserved and an inspiration a great victory and the most important in front of our fans one last dance my friend make it a good one agaisnt everton love this im not everton but i ve always been friends everyone ive had the pleasure in my heayou will be in my life and always give me the best make me happy ever you are a very nice people i know on twitter we r love you guys so much ive got to go for raphinhas first goal against everton the first glimpse of real quality from our brazilian wonder man,"[('heayou', 0.3457), ('brazilian wonder man', 0.3527), ('everton', 0.4113), ('raphinhas first goal', 0.5038), ('agaisnt everton love', 0.5411)]"
8,nhs staff are the real heroes pep guardiola puts city season into perspective well done joe you totally deserved this i saw him play at everton i was young and impressionable and he was balletic and powerful you soof couldnt take your eyes off him no matter what else was happening on the pitch would just like to say to everyone for lovely special message to me i m saying getting to know each other proper i m flattered to have you guys going to see everton win tomorrow coyb we have been named on the sunday times 100 best companies to work for list for the fourth year running selected by from a huge number of nominations joe is a very worthy winner of t best goal scorer in the league its not an argument its just factual,"[('nhs staff', 0.3983), ('pep guardiola', 0.4193), ('everton', 0.4273), ('everton win tomorrow coyb', 0.4338), ('real heroes pep guardiola', 0.4717)]"
9,im sure this will go down well with everton fans well done joe and pumped money relatively successful stadium transition we have found a manager who has found his everton groove again doing more with less money james is the best footballer i ve ever seen play for everton are you really surprised he s not that arsed he s training with delph and iwobi every day everton fans r nuts having this lad in our team for even 20 games a season is boss kid is a genuine talent just enjoy him while hes here well done joe we loved this he wants to do well for his country that s it,"[('day everton', 0.4847), ('everton groove', 0.5099), ('everton', 0.5252), ('day everton fans', 0.594), ('everton fans', 0.6026)]"
10,if james is on a plane then carlo the club have given the ok keep the lad sweet i say the season is done keep him happy and get him back with some better players around him next year big congrats joe been following your story well deserved fella all the best from a happy hammer absolutely love this everton new bramley moore stadium coming along nicely everton at home last season was pretty special 5 star review from everton happy as larry i got what i wanted and i m a satisfied customer i d have given you a certificate with a picture of everton and the caption i ve been very brave today enjoy this conversation between the boss and his number nine after was named our player of the se,"[('james', 0.3004), ('keep', 0.3086), ('stadium', 0.3288), ('new bramley moore stadium', 0.3396), ('everton', 0.429)]"
11,haha cor got a booking with a new lass at ours je suis tres excited everton oh how lovely everton enter eurovision as their best chance of european success now time for the italian vote fantastic choice joe is inspirational to folk all over and from different teams im celtic a man who will be a great ambassador for everton and beyond mike as always speaks sense i have a new hairdresser and big summer for everton you need to invest in some quality players always in our hearts,"[('celtic', 0.376), ('eurovision', 0.4102), ('everton', 0.5243), ('lovely everton', 0.5577), ('excited everton', 0.569)]"
12,i reckon james does like everton cos he gets involved with all the fun stuff and he s got ancelotti and his south american mates but it s not secret how much he loves colombia and how much colombia loves him i think if there was no copa america he d have played vs wolves amp city i m pretty sure i remember him scoring an header against everton from outside the box or did i just imagine that definitely be in my all time 11 team without doubt newcastle have been in the championship in the last 5 years everton have never been relegated from the premier league everton are building a stadium which will have a bigger capacity than newcastle s,"[('years everton', 0.3668), ('james', 0.3689), ('doubt newcastle', 0.3708), ('everton', 0.3895), ('premier league everton', 0.3934)]"
13,yes james rodriguez loves his country more than everton also everton won 9 of the 14 games he didnt play in so heh its a mad world still rather have him than not love the red that arsenal die hard love it he is a top fella i love james at everton and hope he s back next season fit and well hope columbia do well copa am rica our greatest gaffer final one he comes back in the summer ready to go again he s gone with everton s permission and that s it there is no reason why he wouldn t be an everton player next season he s happy the club is happy this was always going to happen,"[('james', 0.3003), ('everton', 0.3397), ('everton player', 0.3919), ('rodriguez', 0.4122), ('james rodriguez', 0.4806)]"
14,if arsenal win tomorrow against brighton hove albion and everton who play manchester city draw or lose tottenham who play leicester city draw or lose we will have a chance to go back to european competitions by using the back door of european conference league be hopeful i secretly want germany to win for sheer comedy value what a man i met him whilst working in formby had a chat to him had all the time in the world for his fans i asked him where he was going he replied for a few wines it was 10 o clock in the morning i just laughed an said enjoy ur day an he replied i will if i remember it,"[('tottenham', 0.5263), ('leicester city draw', 0.538), ('arsenal', 0.5533), ('arsenal win', 0.5813), ('arsenal win tomorrow', 0.6215)]"
15,7 man city are currently on a 7 game winning run against everton in all competitions this is their longest ever such run a he s the best everton player some people on here have ever seen despite being bog average in about half the games he managed to appear in meh what a signing he s been for everton arsenal vs brighton arsenal win liverpool vs crystal palace liverpool win mancity vs everton man city win i also loved lithuania congratulations from an everton fan thinking of the prospect of seeing my boyhood team everton is a dream weather it s europa leauge or conference leauge i d just like to see us have a go at city try get a shock result even up here in liverpool and fans are understanding your journey amp,"[('everton fan', 0.5246), ('everton fan thinking', 0.526), ('boyhood team everton', 0.535), ('best everton player', 0.5756), ('everton man city win', 0.7214)]"
16,omg lad brilliant get him signed everton gotta a handful on your hands there mate tekkers that documentary about him is honestly one of the best ones ive ever watched what a manager he was imagine being on the everton pay roll and not having to watch a single second of tomorrow s match pure bliss god speed james great pic that what drone have you got brilliant well done joe well deserved fella we can see it means the world to you great piece from dave prentice on hk a true evertonian legend why everton legend howard kendall will never leave us 7 man city are currently on a 7 game winning run against everton in all competitions this is their longest ever such run against the toffees gorged,"[('everton', 0.4564), ('everton pay roll', 0.4615), ('evertonian', 0.465), ('everton legend', 0.5902), ('true evertonian legend', 0.6109)]"
17,marcel brands a genuinely nice man was great with my lad down working in a shipyard in birkenhead but staying in liverpool tonight had a wander up to goodison park tonight great to see the old lady pity i couldnt get in for a game nice to see you had the pleasure of meeting him and he was the dude mine likes azerbaijan the best so far thats always an option thank god evertons season ends tomorrow and we can have a break just realised something cos we all play at the same time tomorrow there is a good chance tyler and spitty will cover the liverpool game happy heavenly birthday boss hopefully everton get him would like the chance for him to return to ot,"[('liverpool game happy heavenly birthday boss', 0.4181), ('liverpool', 0.4245), ('evertons', 0.44), ('evertons season', 0.4494), ('everton', 0.4513)]"
18,here is a song i wrote about our beloved carlo i hope it rejuvenates our boys today so we can get 3 points my dream is im a die hard everton fan in barrie ontario canada and have fallen in love with your club the toffees come first for me but im all about them bees now too when the republic of everton are finally given entry you are our girl iceland best for me so far 22 may 1946 football legend howard kendall was born in ryton gateshead tyne and wear he was one of everton s greatest pla my team in is amp as pink tyson is the best your favorite team fit and with your favorite color thanks,"[('football legend', 0.376), ('beloved carlo', 0.4481), ('everton', 0.46), ('everton fan', 0.5192), ('die hard everton fan', 0.5303)]"
19,watching this yesterday made my eyes leak the only other times i have cried as an adult is for my kids i am so glad he won then paddy scores 15 to get golden boot arsenal spurs and everton lose and we make europe kerry beat dublin too perfect to be fair my hairs long glad im safe just put my self on the line for last game i hope we win everton beat city and spurs lose and then we finish ahead of spurs and no conference league that would be ideal tbh luis suarez has now won more trophies with atletico madrid than everton have won in 26 years happy 75th hk i scored 100 in the everton 2020 21 season quiz quiz,"[('europe kerry beat dublin', 0.4004), ('golden boot arsenal spurs', 0.4018), ('everton', 0.4332), ('paddy scores', 0.4843), ('win everton', 0.5564)]"
20,used to work with an everton fan a few years older than me and he told me a story about being at ot in an fa cup game and everton were comfortable till he said duncan edwards dug a mammoth shot out of the mud goal he said it was incredible officially a push over dad our son sam is 7 in a month hes been waiting ages for his new kit and was due to get it for his birthday i caved in as i knew id see this super excited face you re a star too mike very gracious of you well done joe coyb ruben dias strong performance vs everton in fa this is what my ideal pl teams would be new hoodies t shirts phone cases and more available now,"[('ideal pl teams', 0.3695), ('fa cup', 0.4041), ('fa cup game', 0.4096), ('everton', 0.446), ('everton fan', 0.4619)]"
21,thank you mike it s okay cheers since this is the first time in ages that everton s season did not end in january and that you still have something to play for on game day 38 you should focus on that absolutely amazing we ll done joe deserved nice one been twice myself coincided with national meeting nice buzz at the ground both times friendly people yer your probably right everton going in the right direction i do like him tho feel he will only get better ok il settle for lewandowski then tomorrow is a massive moment in everton fc history its the closest they ever going to get to the premier league trophy ever everton is the only team i can see,"[('lewandowski', 0.3314), ('everton', 0.4922), ('everton fc', 0.4954), ('everton fc history', 0.5408), ('right everton', 0.5609)]"
22,pep i m looking forward to playing against everton with our fans congratulations to sheikh mansour for this incredible and love it well done mate well of course psv has more money better players and performs better like psv is the chelsea of the netherlands fc utrecht is the everton of the netherlands i thank he is back to primer league but not big club maybe everton or leicester if leicester win tottenham and man city beat everton then we win brighton we go qualify for europa league happy 16th birthday to katie first present asked for top with happy girl today absolutely brilliant ryan,"[('pep', 0.4374), ('chelsea', 0.4577), ('tottenham', 0.4703), ('everton', 0.4827), ('europa league', 0.5193)]"
23,watched him play for everton against the orient in the cup towards the end of his career although it was premiership against 3 4 division cant remember what division we were in it was one of the best individual performances ive seen im a red and that made me well up get in billy mate made up for yer yh probably hopefully it s like the everton one in april massive congratulations you definitely deserve it only been a top 3 in spain in england there were 6 big clubs and other teams with high spending and great infrastructure to bridge the gap re leicester villa wolves west ham everton etc nice to see the icelandic village footy team who will be playing everton in the conference league well done joe,"[('billy mate', 0.3538), ('icelandic village footy team', 0.3792), ('everton', 0.3986), ('leicester villa wolves west ham everton', 0.4261), ('west ham everton', 0.453)]"
24,i firmly believe in the next 2 years everton leicester and newcastle will be strong challengers for top4 i will buy an everton sticker to go in it my first everton team that was the passion from those guys made me love the team am all for it everton might have a chance of finishing 6th next season so on twitter the transfer guru s all know everton are favourite to sign zingdeybxrhbs sfhbftunvdy hhfdhnvdg from hvsejnxyjnvr well i hope their sources are right such a great player they heard it from a mate who has an aunt who once sat on the same plane as mary poppins done well for yourself there if only everton could reach above expectations congratulations joe well done,"[('years everton', 0.533), ('first everton team', 0.5354), ('everton', 0.5494), ('everton leicester', 0.565), ('years everton leicester', 0.568)]"
25,true i live in eindhoven but i dont suppopsv i love fc utrecht a dutch sub top upper mid table team just below the top teams just like everton in england or villarreal in spain last but not least in terms of my pieces for covering this season 99 previews in total on liverpool and everton games so not too bad looking forward to next season everton away end hope your well pal we are rebuilding and clearing deadwoods for instance we had a good points from big 6 teams and away form improved on the other hand everton took 6 points burnley 4 wolves 6 and many more arteta need to clear more deadwoods this summer stunning goal sees second team book place at championship playoff final home team wins great stuff joe well deserved and you billy,"[('liverpool', 0.4607), ('eindhoven', 0.4632), ('season everton', 0.5102), ('next season everton', 0.5104), ('fc utrecht', 0.5349)]"
26,good luck to everton in from our 21 goal hitman to a new blue that has tackled his way into our hearts heres all of tonights winners in full we followed back every follow account fan of the year love watching these two always smile everytime i see the two of them together throughly deserved well done joe heaof the peoples club had the pleasure of meeting howard what a nice man run for the 96 completed well we had to do it and we did i am so proud of jen erin and ethan for still doing this run w i definitely would strikers can score in any game and everton are great away from home certainly a role model for many people you deserve it joe greetings from still love all our everton ladies,"[('goal', 0.3164), ('goal hitman', 0.3418), ('strikers', 0.4221), ('everton', 0.5656), ('everton ladies', 0.5976)]"
27,statistically our defence is better when he plays hes also our best cb on the ball in confined space personally i hope we dont sell him thoroughly deserved well done joe such an inspiration to soo many people well done dom well done joe well deserved congratulations joe so well deserved congrats dom you ve had an amazing season and it s richly deserved nice one joe well done pal well deserved keep up the great work that is excellent mate well done lad getting better every season outstanding player would love him at forest could see him going to villa everton west ham someone like that big congratulations to st johnstone a momentous achievement i remember going up to muirton park many times as a boy,"[('west ham', 0.3934), ('best cb', 0.3938), ('congratulations joe', 0.421), ('deserved congratulations joe', 0.4564), ('everton west ham someone', 0.4738)]"
28,i m just glad everyone has settled down now it s no given we will win and although i think we will get the point we need the newcastle brighton everton amp chelski results have hopefully sobered a few people up that s said i think we will win 13 2 we have a new high score on the for ex everton coach amp liverpool player now i like the kit six players make it happen use all your power you really are amazing joe x if everton leicester and palace won tomorrow i ll buy everyone a ferrari also the free adventure the frozen sick is the best official one ive come across yet and explorers guide to wildmount honestly blows every other setting put of the water with the exception of everton maybe,"[('everton', 0.4059), ('everton leicester', 0.4281), ('liverpool', 0.4297), ('newcastle brighton everton amp chelski results', 0.4637), ('brighton everton', 0.4741)]"
29,well done joe you re an inspiration am no greetin you are well done joe amazing have a good night lads there is a good possibility we beat man city liverpool leicester everton real madrid etc they are way bigger dan villa fair play to sergio one of the all time prem greats and my fave non everton player great finisher and strong on the ball good luck to him on his next chapter this one completes the list for the roar alone lets hope we have another tomorrow to add i want better for everton abeg periera would be perfect on the rw for everton baggies fans say hes their best player and i totally agree get him signed pickford did a lovely done that he injured van dijk,"[('everton player', 0.4792), ('everton abeg periera', 0.489), ('fave non everton player', 0.4949), ('everton baggies fans', 0.5561), ('man city liverpool leicester everton', 0.5695)]"
30,2014 15 player worn everton training shi ross barkley very good l 32 2000 02 everton home shi good xl 30 one of the great british centre halves capt of the great 80s side was the guest on ep 5 via we have a new high score on the for ex everton coach amp liverpool player scored a very impressive 115 on the icon johns nominations coming up shortly great he has the things to bring everton just signings will help this to true well deserved dom more again next season please howard had a way of doing things it proved pretty successful,"[('ross barkley', 0.4328), ('everton', 0.4672), ('ex everton coach amp liverpool player', 0.5777), ('everton home shi good xl', 0.5895), ('everton training shi ross barkley', 0.7014)]"
31,my team in is amp as pink tyson is the best your favorite team fit and with your favorite color thanks soon photoshoot with all that amazing stuff and so wow the barbies football players i am professional athlete and tomboy but always keep my feminine west ham are having better season than us my hero joe moore i hope you are lapping this up couldn t be happier for you that s just magnificent well in joe you deserve it now do it for england good luck you can do it gazzaniga is such an under rated keeper truly believe he could stafor teams like palace everton west ham or even leeds easily shd look at him as a long term replacement for tim krul instant upgrade everton is bigger than manchester city congrats dom well earnt mucka,"[('everton', 0.3817), ('feminine west ham', 0.3826), ('west ham', 0.3835), ('manchester city congrats', 0.4568), ('palace everton west ham', 0.4715)]"
