,tweetpositive,keyphrases
119,man city would win the champions league chelsea were crowned european champions for the second time as kai havertzs first half strike sealed a 1 0 victory over a lacklustre manchester city in porto based on popular demand from clubs like arsenal liverpool man u and man city the management of chelsea will be taking a masterclass on how to win champions league watch this space nottingham forest has a better european pedigree than man city congratulations to chelsea s african duo hakim ziyech and edouard mendy who won 2020 21 title after beating manchester city 1 0 ask him who has won more champions leagues out of tranmere rovers and 1 billion spending the best team in the world ever man city manchester city will win the champions league next season,"[('champions league', 0.5267), ('man city congratulations', 0.5312), ('city manchester city', 0.5486), ('champions league chelsea', 0.5878), ('man city manchester city', 0.6503)]"
120,at this moment in time were the best team in the world and you cant take that away from us manchester city will win this year s champions league love and suppoto you you have a fantastic coach and a fantastic squad congrats chelsea a dark horse for winning the ucl title and yap man city is still the beast one happy for my dad that chelsea won he was a happy man they deserved it city oh well all that spent and still no european trophy goodnight pep thanks to god almighty we are the champions thanks to god amen kante performing fantastically tonight take heart man city fans joy comes in the morning on better news chelsea beat manchester city and won the champions league like the season was a success,"[('man city fans', 0.5119), ('chelsea', 0.5183), ('champions league love', 0.5434), ('chelsea beat', 0.5749), ('congrats chelsea', 0.6778)]"
121,just what to congratulate chelsea on such a professional performance if there is ever a ruke book on how to beat the beast that is man city that is it watch a kai havertz goal and ngolo kant masterclass ensured chelsea are the champions of europe jubilant scenes in portugal for thomas tuchels men evra having fun with manchester city fans but congrats to them anyway for a second champions league trophy better luck next time manchester city chelsea manchester city leicester city arsenal villarreal cf yall did well id take arsenal winning a treble over man city winning a cl thats how strongly i feel about that club dear dada please please give my great city pune the host man ship of t20 world cup in india mind well this great city has biggest sports trp in india,"[('champions league trophy', 0.4862), ('second champions league trophy', 0.5135), ('second champions league', 0.5165), ('chelsea', 0.5245), ('manchester city chelsea', 0.5618)]"
122,now to see what the beautiful game has to offer liverpool won the ucl trophy and as well beat barcelona best team in the world like he is got neymar mbappe and messi man city have got alot of average players performing cos of pep guardiola chelsea went through three of the top four teams in spain lol and manchester city solid run thomas tuchel confirms that both kante amp mendy are fit to face manchester city tomorrow we getting lit tonight rip man city ayyyy chelsea wanted it more and they played better than man city did and pep guardiola got in his own way heck guardiola played a stronger side against my team watford in the 2019 fa cup final yes we got whipped than he did against chelsea tonight in the,"[('messi man city', 0.4671), ('manchester city tomorrow', 0.5003), ('chelsea tonight', 0.5097), ('pep guardiola chelsea', 0.5619), ('man city ayyyy chelsea', 0.5695)]"
123,city was my first away game in 1994 i was a student in manchester we won 2 0 jason dozzell scored twice we really beat manchester city 3 times in 6 weeks wow this has been the year of the underdog man city ousting liverpool leicester toppling chelsea and chelsea giving a masterclass to man city roll on next season literally mixed emotions right now so proud of city for going so far to the final we have been absolutely amazing but im so heartbroken right now win or lose though i fucking love manchester city so much city till i die liverpool won the pl lol what sterling has done in the last 3 years at man city is commendable not because he is out of form you forget his contributions this was a victory for football,"[('liverpool leicester', 0.4847), ('liverpool', 0.4892), ('underdog man city', 0.4976), ('manchester city', 0.549), ('love manchester city', 0.6677)]"
124,maybe man city might win the fa cup man city fit come back next season solid team and now the players know whats up just get a goalscoring striker either kane or lukaku manchester city still a small club kante the best player in the world atm as good as kevin de bruyne is and how good man city has been hes still not xavi and they arent peps barcelona the stars came together for that team manchester city are welcome to the runners up crew congrats chelsea chelsea beats manchester city 1 0 to win champions league for first time since 2012 congratulations to chelsea fans worldwide manchester city have been brilliant for six months it s difficult to explain why pep would change the system on the biggest night of the season,"[('crew congrats chelsea chelsea', 0.4861), ('congrats chelsea', 0.4871), ('manchester city', 0.5129), ('team manchester city', 0.5858), ('fa cup man city fit', 0.5894)]"
125,so happy we have european pedigree man i d be pulling hair if i was a arsenal spurs city fan one of them is man city celebrating a treble easy trade off a gentle reminder that scott carson is the only person in the man city squad with a champions league winners medal and that was for liverpool this is my city i m just glad man city got nowhere near our treble bevausej love the feeling that both manchester clubs bottled at least the city of manchester would be calm since the noisy neighbours also failed 19 year old chelsea midfielder billy gilmour has become a european champion tonight after his side defeated manchester city 0 1 in the champions league final in porto manchester flower show a city in bloom,"[('champions league', 0.4979), ('city fan', 0.5119), ('glad man city', 0.5266), ('manchester city', 0.5347), ('champions league winners', 0.5351)]"
126,i went to the viewing center today not come back with black stomach neither chelsea or manchester city whoever win i will join the celebration we celebrate together and move me going to bed tonight knowing that divock origi is bigger than man city he did tonight what he does best keep closed every door city tried to open man of the match imo kai havertz the hero as chelsea see off manchester city challenge to lift second ever champions league man city still have no history in the champions league so i m happy ok a very beautiful one what a smol city manchester is today manchester city reached the final of the champions league for the first time in history but lost we hope to arrive next year,"[('manchester city', 0.5433), ('manchester city challenge', 0.5451), ('champions league man', 0.5726), ('today manchester city', 0.5924), ('champions league man city', 0.632)]"
127,chelsea have won all their encounters with manchester city this season with a margin of one in each game the power of just one time to sit back relax and unwind by watching highlights of chelsea s 2021 champions league win over manchester city man city are a top team chelsea won their second today and city will win their first some day keep the faith bro your day will come i predicted chelsea 1 man city goalless congratulations to blues congratulations to manchester city for trying to win the trebel man city were never a threat we r the champs now skysports chelsea stun man city to win champions league chelsea were crowned european champions for the second time as kai have,"[('top team chelsea', 0.5644), ('champions league chelsea', 0.5757), ('skysports chelsea stun man city', 0.627), ('chelsea man city', 0.6634), ('chelsea stun man city', 0.6777)]"
128,thats true it was a good opportunity for man city this year with the spanish teams being below par blue is the colour what a great feeling to be champions of europe once again the joy i feel is so deep and refreshing what a historic hattrick over man city and pep guardiola to win another title kudos thomas tuchel and team for this sweet feat thanks be to god come on chelsea lol same congrats to chelsea tho man city didnt come to play manchester city will still win this match regardless comeback manchester city with no champions league still love to see it nice job we did it,"[('champions league', 0.4417), ('chelsea', 0.4497), ('chelsea tho', 0.4715), ('comeback manchester city', 0.5199), ('chelsea tho man city', 0.5949)]"
129,i have a lot of time for you john but no right to be champions this squad under lampard were unbeaten in the their group this squad under tuchel eliminated atletico porto and real madrid this team beat man city in the final i can t think of more deserving champions chelsea and manchester city two of the richest and most talented teams in england s premier league are playing for the bigge years of incredible quality and ability many league titles and trophies centurions arguably the worlds best manager word class players but no the stone in their shoe tuchel on beating city to champions league chelsea have won the champions league for a second time after beating manchester city 1 0 in porto kai havertz struck in the first half to wow just wow,"[('lampard', 0.4826), ('champions league', 0.4978), ('chelsea', 0.5064), ('champions league chelsea', 0.5794), ('deserving champions chelsea', 0.6531)]"
130,tbh i would like to see man city win the ucl as a farewell gift for aguero what a journey congratulations to the manager and the lads beating man city three times this season well done agreed theyre better than man city kai havertz scores the only goal in the first half to lead chelsea to a stunning win against manchester city in an all eng man city is my city nah we celebrating better chelsea than man city chelsea is the champion of europe again after holding off manchester city in a thrilling champions league final congratulations to fans you guys deserve this proper owner proper football people who run and manage the club chelsea won the champions league for the second time after beating manchester city in a thrilling final in porto,"[('better chelsea', 0.5113), ('city win', 0.5121), ('champions league final', 0.5344), ('man city win', 0.6327), ('man city chelsea', 0.6529)]"
131,won the champions league for the second time as a kai havertz goal secured a tense 1 0 victory over manche i am so confident in my team if man city make it to the finals next year 1000 theyll win it just a reminder that is still the most successful of the english teams in the chelsea beat man citys c team and won wow i love manchester city forever don t worry man city y all would come back stronger sometimes nobody gets what they want for the first time man city kuku did their best abi wait you are man u fan man city is team barca is good team pep is a good coach pep barca the perfect link the best comment for d nite i have every faith in arteta,"[('chelsea beat', 0.4824), ('champions league', 0.4873), ('team barca', 0.5063), ('love manchester city', 0.5076), ('good coach pep barca', 0.5205)]"
132,cant wait to staagain top 4 next season has to be the aim which means finishing above one of man city man utd chelsea or liverpool if i were a man city fan i will take this loss in good faith chelsea deserved it when they eliminated us in the semis i wasn t hurt they re the superior team with the quality to proceed and now they ve proved it congratulations the man city emborile yeses hardware city population kevin callaghan suraya chalabi and tj collins kevin and tj go 1 2 in the boys 400 suraya picks up a 3rd place and her second medal in the girls 400 incredible job,"[('man city', 0.4344), ('chelsea', 0.4462), ('man city fan', 0.4487), ('good faith chelsea', 0.4753), ('man city man utd chelsea', 0.5635)]"
133,like i said haram football at its best they counter attacked pretty well today they get in shape really quickly to defend when man city has the ball they made sure city didn t have any space to play the ball all attacking players for city didn t turn up today yes and the players have improved beyond recognition it s not easy to do to man city what he did he has now done it twice to them i m sure i see a tweet from you earlier saying about man city winning by 2 goals at 2 1 was the best bet you ve seen in a while but i think the 7 2 on chelsea to win was a better bet so proud of all of our players and our manger,"[('sure city didn', 0.3397), ('haram football', 0.375), ('city didn', 0.3797), ('man city', 0.4398), ('chelsea', 0.485)]"
134,sheikh mansour s biggest win manchester city s 4 6 billion increase in value the one positive from today s game is that it showed that united fans are in fact obsessed with manchester city football club we are gargantuan im so happy im not attached to any other spolike i am to tennis and roger loses like man citys can really huthe spirit also all respect to man city peps head is brighter than man citys future man city and my bets are in alignment today pep shouldve started on scott carson tbh he would definitely carry man city are you glad to see win the ucl the only hope i had today is the fact that chelsea always do better when underestimated,"[('manchester city', 0.5479), ('man city peps head', 0.5562), ('manchester city football club', 0.5781), ('biggest win manchester city', 0.6642), ('win manchester city', 0.6678)]"
135,i was so hoping for man city not a big chelsea fan here but am very excited about norwich city getting promoted to premier league highly recommended if you re in around manchester city centre this bh weekend thanks amp congrats to all exhibiting artists this is amazing but man city lost the champions league final do you think you can make me happy again well in a week were we finished 3rd and manchester united and city fans respectfully giving it large it is so nice to turn on the radio and find out not just one but both manc clubs got beat i wish we could have owners like man city n chelsea who are passionate for their clubs we are the champions of europe amp d world well done lads,"[('manchester city centre', 0.4822), ('manchester united', 0.4918), ('manchester city', 0.526), ('man city', 0.5321), ('man city chelsea', 0.6169)]"
136,the win is for the blues and for many other reasons chelsea gewinnt champions league mit 1 0 gegen man city congratulations he was man city best player today man city team is far better than this barca team my european legacy is just as good as manchester city s i ve never played a single minute of european football though thank god it s not manchester city he really did cost city and i think its safe to say that villarreal vs manchester united europa league finals gave us a more interesting and intriguing finals kai havertz s late first half goal led the blues to a 1 0 triumph over manchester city for their second ucl title in club history,"[('chelsea', 0.5101), ('best player today man city team', 0.5167), ('champions league', 0.5219), ('many other reasons chelsea gewinnt champions league', 0.5676), ('manchester united europa league finals', 0.616)]"
137,lols for playing good just against man city and real madrid only come on robehave been instrumental throughout the season diaz have been better than kante too throughout the season whatever happened i still love you lee the best man city fan ever chelsea won the champions league for the second time as a kai havertz goal secured a tense 1 0 victory over manchester city in saturdays final in porto shattering pep guardiolas dream of lifting the trophy for the third time a decade on from his last triumph the sky will forever be blue in london enjoy your champions man city oh wait azpi great leader as thomas said we cannot forget what frank lampard has done for us i m excited to see the inside i really should think about purchasing my own house in the city,"[('man city fan', 0.502), ('chelsea', 0.5063), ('champions league', 0.5303), ('best man city fan', 0.5401), ('champions man city', 0.5561)]"
138,she was enjoying herself and the cake the gt gt nothing came off and chelsea deserved their win with defensive midfielder kante the best player on the pitch good news for man city fans guess who s coming into work on monday manchester is our city blueeee chelsea are champions league winners for 2021 the blue boys from london beat manchester city 1 0 in porto to lift the european i ain t going to shade the man city their stan are so nice in the final analysis chelsea winning the final was well expected man city should learn from this and do better in the future they were the underdogs and pep guardiola knew that more than anyone else but congrats on the epl trophy,"[('kante', 0.429), ('champions league winners', 0.5062), ('city blueeee chelsea', 0.533), ('chelsea', 0.5385), ('final analysis chelsea', 0.5547)]"
139,i came here in 2012 after that champions league win i wanted to repeat that champions league success it is amazing my family are here captain cesar azpilicueta hailed a special special day as chelsea beat man city to win the man city won the league and league cup liverpool won the top 4 trophy its crazy how big soccer is i went out for few minutes saw more chelsea and man city jeseys and fans in 5 minutes the i have canucks jerseys in a year lol congratulations chelsea on winning for second time what a incredible match to watch tonight both incredible clubs playing commiseration to manchester city really unlucky,"[('chelsea beat', 0.5291), ('champions league win', 0.5451), ('champions league success', 0.6035), ('year lol congratulations chelsea', 0.6334), ('congratulations chelsea', 0.6512)]"
140,well it seems like an age since i watched man city v high wycombe on a rainy tuesday night it wasn t our result tonight but i ll take it we ve come a long way baby true i am a man city supporter but i truly respect and love the man what a gentleman congratulations to them they deserve it chelsea crowned champions league winners after beating manchester city 1 0 what a night it should also be acknowledged how classy pep and man city were afterwards fair play to them and they ve had a sensational season congrats blues ogun go kill man city yeah we on that big man city pack today let s get it,"[('champions league winners', 0.4431), ('big man city pack today', 0.4745), ('manchester city', 0.479), ('man city', 0.5011), ('man city supporter', 0.6833)]"
141,city v chelsea good job by tuchel he came he conqured timely decision by abramovic to sack lampard and got him in chelsea football changed completely they started playing dazzling football hats off to tuchel psg will regret for ever looking good man man city actually started to play well in this competition since 2019 mowaa today is a win win situation for manchester united fans yeah me too he deserved at least one for man city if we didnt have reached in the finals i would have supported man city just because of him tbh we for commot for this planet if man city win,"[('manchester united fans', 0.4524), ('tuchel psg', 0.4855), ('chelsea good', 0.4884), ('city win', 0.4991), ('man city win', 0.5795)]"
142,chelsea turned a season of turmoil into the ultimate triumph as kai havertz s ice cool finish sunk manchester city 1 0 to swipe champions league glory in porto mason mount s inch perfect assist stunned domestic double winners city at the estadio do chelsea wins champions league trophy after beating man city cuz man city lost i m so happy i love you manchester city i was man city but in the end sportsmanship is a thing so congrats to chelsea my history teacher has been bantering abt city winning for weeks now i cant wait to walk into his classroom on thursday man,"[('manchester city', 0.4518), ('champions league glory', 0.4866), ('champions league trophy', 0.4912), ('chelsea', 0.5184), ('chelsea wins', 0.5692)]"
143,man city are probably the best english team i ve ever seen pep guardiola the best coach of my lifetime not sure why they went 1980s wimbledon style in that last few minutes good to be able to say we gave the champions league winners a decent game though well done chelsea man city all the way so it was still a great achievement for them congratulations to manchester city above everything else i am a winner in jesus christ man city loss is nothing i am more than a conqueror totally agree with you he will win the championship league with man city remember my words winning in style and beating some of the best teams in europe liverpool fans must be grinning,"[('champions league winners', 0.4987), ('jesus christ man city loss', 0.5023), ('manchester city', 0.5206), ('best english team', 0.5633), ('chelsea man city', 0.5921)]"
144,so happy for kante winning the champions league and for mendy as well what a great example of never giving up on your dreams and working as hard as you can to achieve them congrats to chelsea and i m sure manchester city will be back sooner rather than later fascinating game tuchel winning the tactical match up so far with the chelsea wingbacks and high defensive line mancheste yeahhhh you did congratulations but thank god for tuchel in your lives i congratulate chelsea fc for beating manchester city 1 0 to win the european champions league when you look at phil fodens numbers compared to english legends at the same age you realise just how special he rea city city the best team in the land and all the worrrllllddddd keep your head up blues,"[('fascinating game tuchel', 0.3981), ('sure manchester city', 0.4173), ('chelsea', 0.4308), ('chelsea wingbacks', 0.4338), ('chelsea fc', 0.4425)]"
145,that was my only reason for supporting man city habari24 blues are king of europe chelsea edge man city 1 0 to lift 2nd ucl title quer a que gane manchester city llegu a ver casi el final congrats lol maybe but pep inherited the best teams wherever hes gone and been backed massively man inherited the best barca team ever cl winning bayern team and a city team with unlimited cash jorginho amp his mother both chelsea legends today thanks to everyone who entered and well done to our winner never been happier for chelsea especially for beating man city and so the had chelsea celebrate in portugal leaving dejected manchester city to try again coming season congratulations chelsea amp new manager tuchel manchester city are still alive here balotelli,"[('chelsea celebrate', 0.504), ('new manager tuchel manchester city', 0.512), ('season congratulations chelsea amp', 0.5294), ('congratulations chelsea', 0.5311), ('europe chelsea edge man city', 0.5367)]"
146,sorry to the all the 2 man city fans out there you guys put up a good fight a good day to remind you that i don talk my own laycon anyways i wish chelsea good luck and a win over at least the media won t force the pep guardiola and this manchester city squad the best thing to happen to english football for a week i think man city may have the greatest manager of all time so said gary neville after the league cup final that might well prove the case 10 15 years from now when it comes to guardiola but the rush to make everyone right now better than everyone else ever is so misplaced i hope to meet a real life manchester city fan one day goodnight say it back,"[('chelsea good', 0.5091), ('manchester city squad', 0.5095), ('man city fans', 0.557), ('manchester city fan', 0.5755), ('real life manchester city fan', 0.6049)]"
147,full time manchester city 0 1 chelsea chelsea are the champions of europe we beat arsenal 2 years ago today to win the europa league and did the same tonight against man city to win the champions league 29th may is special buhari is still the president and you are happy that chelsea won man city from a man city fan congrats man city champions chelsea are champions of europe after beating man city in ucl final im supporting man city if they ever get to the final again so anyway congrats to chelsea and also thanks for officially being our bxtch helping us to protect our treble and stopping man city to join us weldone man city we go again next season stronger and better,"[('chelsea', 0.5862), ('man city fan congrats', 0.5954), ('man city champions', 0.6104), ('manchester city chelsea', 0.6252), ('city champions chelsea', 0.6865)]"
148,chelsea won the champions league for the second time with a fully deserved victory over manchester city in the all premier league confrontation in porto i am immensely proud of man city you lost tonight but i hope you win some other time ive been a man cty fan as long as i can remember and i will be a fan till i die xx the city is united in the bottling business my manchester united friend just collect the phone he gave to me tonight because of this chelsea victory over manchester city pls celebrate this victory for me this guy was man of the match in the 3 games involving real madrid and manchester city chelsea we won ucl man city we won epl leicester we won fa cup,"[('manchester united', 0.4906), ('champions league', 0.5085), ('chelsea', 0.5231), ('manchester city chelsea', 0.5825), ('chelsea victory', 0.6482)]"
