,tweetpositive,keyphrases
327,and some people said before that man city is the best team in europe good game zam respect to man city di dunia ini menang tdk ada yg sempurna hehehe in the end they deserved it and what a job tuchel has done tough luck for pep and city but man chelsea s spirit was sensational you jesus for the victory over the powerful man city barcelona will forever be the big team you wish your oil money club manchester city will ev r be enjoy the mud history will remember these two things which were unbreakable mr i love you man emotionally one team is stonger in manchester and its not the boys from the city you know 2012 and now 2021 chelsea fc are the champions of europe congratulations chelsea for uefa champions league glory well,"[('chelsea fc', 0.5373), ('chelsea', 0.5667), ('congratulations chelsea', 0.6395), ('man chelsea', 0.6659), ('europe congratulations chelsea', 0.6889)]"
328,most clean sheets in europe s top 5 leagues all comps since thomas tuchel became chelsea manager in january i was pleased they won with man city winning the league well done chelsea what a night to be hold we won lads chelsea won the ucl congrats lets gooo schei man city hero of the day kanteee a first half goal from kai havertz was enough to get the better of manchester city in a pulsating final at the est dio do drag o chelsea win the champions league with havertz scoring the only goal of the game i stand tall proud and strong congrats congrats manchester is a quiet city tonight lmao i love that,"[('chelsea manager', 0.4893), ('chelsea', 0.5027), ('champions league', 0.5155), ('lads chelsea', 0.5415), ('strong congrats congrats manchester', 0.5488)]"
329,chelsea deserved to win they played a perfect balanced football held everything down man city just couldnt get through it surely wasnt luck we wont hear word again but nice game chelsea and manchester city presently far better than my manchester united they stepped up when it matters and has won the at one point they were out of top 4 they lost to aston villa while man city were winning 5 0 against everton nobody expected them to win the final but they believed in themselves and took home the champions league man city fans acting strong well done to chelsea deserved winners man city never showed up tonight we are the champions my friends no time for losers like man utd and man city man city boys will come back stronger,"[('man city fans', 0.5659), ('champions league man city', 0.5674), ('nice game chelsea', 0.5948), ('champions league man city fans', 0.6356), ('chelsea deserved winners man city', 0.856)]"
330,kai havertz finally proved he was worth every penny as the 71m signing made the difference for chelsea in the champions league final man city are definitely buying kane now chelsea was better than manchester city this night got lucky in counter attack and scored one congrats to chelsea fantastic game manchester united fan right lovin the lost for city n proud of chelsea i was rooting for man city but i admit kante is the only player i like in that chelsea squad what can we do didnt turn up tonight just have to be happy with linfield double and man city champions not a bad 12 months i watch that hoe buzzed and with man city fans so it was fun congratulations chelsea you did a great job,"[('chelsea', 0.4388), ('man city champions', 0.4708), ('fun congratulations chelsea', 0.5427), ('chelsea fantastic game manchester united fan right lovin', 0.5544), ('congratulations chelsea', 0.5669)]"
331,manchester united is proud as long as manchester city didnt win it once again congratulations chelsea chelsea stopped man city from winning fa cup now it s champions league well done boys well deserve still suppopep still love man city we will go again next season and this time we will go the distance the city of manchester will rise again thouroughly deserved win for chelsea man city we re woeful agreed a masterclass from kante manchester city is still the biggest club in london no worries man you deserve it done city over three times and pretty well too conclusive proof that leicester are the best team in europe up yours chelsea and man city if it where any other team beating man city id be ecstatic,"[('united', 0.4902), ('manchester city', 0.5205), ('congratulations chelsea', 0.5438), ('manchester united', 0.565), ('chelsea man city', 0.5811)]"
332,chelsea have won their 2nd uefa champions league final they are the champions of europe 20 21 congratulations chelsea football club chelsea fc congratulations i thought man city would win win the champions league for the second time in 9 years after kai havertzs first half strike clinched victory over man city in porto manchester city wow man city are still the best team in europe dont me thank god manchester city didnt win chelsea wins champions league over manchester city christian pulisic makes history chelsea are champions they have beaten manchester city thanks to kai havertz first half goal so close last year but one better this time around,"[('2nd uefa champions league', 0.6005), ('chelsea wins', 0.6362), ('win chelsea', 0.664), ('congratulations chelsea', 0.6824), ('congratulations chelsea football club chelsea fc congratulations', 0.7108)]"
333,heartbroken for sergio aguero feel for this guy man a city legend and one of the best strikers of this generation well now lets win it with barcelona please change our fortunes and make us happy respect good game man city congrats chelsea congratulations to the new european champions enjoy your celebrations commiserations to man city on coming so close to european glory commiserations to pep and his man city couldn t have asked for better opponents humble in defeat and shame for kdb but we re still champions a big chance for chelsea liverpool getting champions league football and man u and man city both bottling finals all in the space of 7 days what a great week said yesterday that man city are destined to win this years champions league now its chelsea that won it,"[('chelsea congratulations', 0.5056), ('champions league football', 0.5084), ('champions league', 0.517), ('congrats chelsea', 0.5303), ('man city congrats chelsea', 0.6735)]"
334,chelsea are the champions of uefa champions league manchester city will have to wait if for how long i don t know what i know they ve waited for 66 years to reach the final maybe another 66 years will do congratulations chelsea london is definitely blue i am so happy tonight 3 times weve faced a manchester city side thats arguably the best club in the world three times weve beaten them man city are a better team without kdb i said what i said tonight our hope is i m actually surprised they lost tho i really thought they were going win against chelsea i m a massive man utd fan but i love the man city goalkeeper ederson he s so fit i want to congratulate you guys and all other fans world over,"[('champions league manchester city', 0.5204), ('uefa champions league manchester city', 0.5228), ('chelsea', 0.5297), ('congratulations chelsea', 0.6838), ('congratulations chelsea london', 0.6871)]"
335,havertz goal wins champions league for chelsea against manchester city city still had an amazing season 2 trophies and loads of premier league records set or broken throughout the season now to endure more heartbreak following england in the euros thanks for all you have done for man city 20 both of them are definitely the two best teams in europe right now credits to man city as well for a solid campaign aston villa is bigger than man city ynwa well done chelsea you injured man city i mean kdb and thats how you win well played,"[('manchester city', 0.4575), ('premier league', 0.4878), ('chelsea', 0.5382), ('champions league', 0.5448), ('havertz goal', 0.5484)]"
336,to all my man city fans out there we may have lost a great one today but the pain we feel is only for now shake it off cry it out and clap for our boys for it s not easy to reach the finals it s been a great season for us even if we couldn t end it with a bang we stand tall congratulations manchester united and manchester city up on receiving your losers medals congrats chelsea for winning ucl baru nak tgk man city pegang 2 trophy good to see that liverpool won the man city didn t win the champion s league cup tonight must happy with that one hey man city fans looks like sergio aguero will be staying with the club one more year a promise is a promise,"[('manchester united', 0.468), ('man city didn', 0.4904), ('city fans', 0.5086), ('congrats chelsea', 0.5882), ('man city fans', 0.6153)]"
337,well done to chelsea as a brighton fan we beat man city as well breaking news the gok has ordered that all bodaboda riders in kenya to offer free rides for customers for the next 40 days to celebrate chelseas victory against manchester combined city united easy game for real madrid seeing man city broken makes me happy man city i stan forever havertz goal wins champions league for chelsea against man city chelseas kai havertz repaid some of his huge transfer good game man city respect chelsea won the champions league for the second time after beating manchester city welcome to fnktv online congratulations for chelsea nice winning on manchester city manchester united is still better than city ngl i m happy chelsea won specifically for kante and pulisic but the satisfaction of knowing man city lost unmatchedddddd,"[('manchester city welcome', 0.5471), ('chelseas victory', 0.6206), ('happy chelsea', 0.6287), ('man city chelseas kai havertz', 0.6612), ('good game man city respect chelsea', 0.7127)]"
338,man city liverpool chelsea arsenal have all won trophies in the past 1 year man might have to cut ties with this beautiful game today we beat man city 80million well spent chelsea beating manchester city in the ucl final today is sweet and spiced by the fact that our goal was scored by a flop when you win vs at madrid twice and real madrid and man city you deserve to be the champions congrats to man city on their best ever finish in ucl ngolo kante as man of the match single handed midfielder carried chelsea france and leicester city to the glory he is a truly modern midfielder for all manchester utd amp city fans stay strong from most of all i m glad that did not win tonight congratulations for the unexpected title,"[('chelsea', 0.4926), ('manchester utd amp city fans', 0.4952), ('liverpool chelsea', 0.505), ('man city liverpool', 0.6107), ('man city liverpool chelsea arsenal', 0.6737)]"
339,tough loss for manchester city but congrats to chelsea and especially christian pulisic the first american man to win we fucking beat man city 3 times in a row nobody does it better absolutely stunning man city just lost the champions league it s a very special occasion for us united fans i m happy to repocork is now out chelsea are my heros chelsea was the better team manchester city is a funny team dont worry man city fans you could always go back to supporting chelsea great result for chelsea i can t help thinking the fact chelsea had to fight for top 4 right up to last game may have helped them whilst man city could drop the intensity man city thank leicester for this,"[('manchester city', 0.4798), ('united fans', 0.4838), ('team manchester city', 0.5409), ('man city fans', 0.5507), ('better team manchester city', 0.5863)]"
340,the difference between man city and chelsea winning the champions league is kante absolutely outstanding man city remain a small club u love to see it guardiola joins the best team in each league he moves to it will positive signs though 2nd highest points tally since christmas beging man city 3rd best defense in the league all season somehow and no distraction of european football next season when manchester city win fini then we celebrate plus song every 2 weeks biaa chelsea hy3 man city the system is working if man city won the sky will still be blue just calm down,"[('champions league', 0.5032), ('chelsea', 0.5081), ('man city', 0.512), ('weeks biaa chelsea hy3 man city', 0.5894), ('manchester city win', 0.6209)]"
341,it is with heavy heathat i acknowledge the defeat of man city by chelsea i must categorically state that the defeat of man city will not tear my heabecause im conscious that in 2023 general elections in zimbabwe we will celebrate than never before shout out to the fans of the city of manchester stay united don t worry manchester city u won the title and carling cup that s enough for u much luv to all my brothers and sisters of manchester city there s only one winner in a final sadly pep and man city will be back and will definitely win the trophy i m still very proud of manchester city amp pep lest we forget the exceptional season they ve had,"[('man city', 0.4452), ('united', 0.465), ('manchester', 0.4783), ('manchester city amp pep', 0.4992), ('manchester city', 0.5226)]"
342,you gloated at man its sounded super confident about man city win went ahead to say whichever team won would be a victory for you hence im congratulating you on the city loss perhaps jose mourinho can win the champions league for manchester city bigger than manchester city congrats well deserved boys im just so happy man city didnt win congrats on the win why is there so much hate in football cant we be lovers of the game amp fans of a club without hating other clubs chelsea were good and won on the day pep guardiola is a legend coach and man city one of the most successful teams both need to be respected if not loved just wasnt man citys day congrats chelsea this is manchester city what a feeling and goosebumps must watch before the,"[('city win', 0.5485), ('congrats chelsea', 0.5728), ('man city win', 0.6506), ('manchester city congrats', 0.6565), ('man citys day congrats chelsea', 0.7276)]"
343,leicester city is better than man city wins a great victory against guardiolas manchester city congratulations chelsea on winning the and congratulations man city for taking pain the most boring ucl final in history automated tweet congratulations manchester city abeg abeg just enjoy your win and dont throw shade everyone knows man city performed extremely well this season losing champions league doesnt mean they did any less man city had their greatest season ever and still finished with oasis crying it s too funny congratulations for winning the still scratching my head at the lineup picked for manchester city but chelsea played so well it was a hard fought victory between a talented manchester city and a resolute chelsea and it is chelsea who are the champions of europe,"[('congratulations chelsea', 0.5822), ('manchester city congratulations', 0.6485), ('congratulations manchester city', 0.6608), ('guardiolas manchester city congratulations chelsea', 0.6659), ('manchester city congratulations chelsea', 0.7355)]"
344,that was a cracking performance by chelsea there they had man city will under control thoroughly deserved congrats kings of europe celebration time for roman abramovich as chelsea beat manchester city to give owner second champions league glory via nice list so far how about chelsea over man city dont wanna go to chelsea elivs costello chelsea has won the champions league for the second time with a fully deserved victory over manchester city in the all premier league confrontation in porto ft manchester city 0 1 city kai hartvez solitary strike handed chelsea their 2nd ucl diadem congratulations to all chelsea fans chelsea are the ucl champions 2020 21 massive respect for this city team especially pep always take the lost like a man good game i wanted man city to win but i m happy for chelsea,"[('chelsea', 0.5201), ('chelsea fans', 0.5438), ('fans chelsea', 0.5558), ('chelsea fans chelsea', 0.5835), ('chelsea beat', 0.6248)]"
345,feeling good chelsea win champions league after kai havertz stuns manchester city congratulations they got they wanted to hold city on a counter which worked for them they waited for man city to come them and once they came kante managed they cm very well which man city out of position and resulted in a goal i am so happy man city didn t win this good to see majority of man city players wearing their losers medals unlike man utd players earlier in the week willy caballero lets talk about this man went from man city to chelsea to win the ucl what a man chelsea juara 2021 juara yang kedua congrats did man city win i hope man city won,"[('man chelsea juara', 0.595), ('man chelsea', 0.6314), ('man city win', 0.6406), ('chelsea win champions league', 0.6453), ('good chelsea win champions league', 0.6838)]"
346,chelsea getting an easy route to the final is a myth icl managed to beat porto knocked out juve athletico madrid la liga champs real madrid and pl champs man city well deserved to be honest 2012 and now 2021 chelsea fc are the champions of europe congratulations chelsea for uefa champions league glory well deserved sorry manchester city chelsea fc all the way hip hip hurray ktbffh congratulations chelsea love you guys na joke i dey joke since o mi o le rojo man city should be given awards for a lifetime commitment to banter,"[('manchester city chelsea', 0.5211), ('chelsea', 0.5411), ('sorry manchester city chelsea fc', 0.56), ('congratulations chelsea', 0.6325), ('europe congratulations chelsea', 0.6488)]"
347,think about it you can barely go to europe in your own league but you become the biggest in europe wow congratulations to chelsea who played as if they were defending england tonight man city i hope next year thanks to the whole world for this good match got to feel for aguero man what a player he has been for city over the years he can hold his head up high for all he has achieved is simply better than city this season period it s all good in chelsea we trust fuck man city kante for ballon d or this year what a performance against the mighty midfielders of man city private school manchester city vs streetwise chelsea was always going to go one way always congrats to us never ever underestimate the streets,"[('streetwise chelsea', 0.4373), ('england tonight man city', 0.4382), ('chelsea', 0.4794), ('man city kante', 0.5176), ('fuck man city kante', 0.5677)]"
348,congratulations to chelsea and their fans the outplayed and mesmerized man city ahh well we will be back stronger learn or die trying kai havertz is bigger than man city this man city tears is sweeting me cant stand chelsea but fully deserved that win tonight hopefully next year bt will get some new commentary teams in darren fletcher saying man city are destined to win the champions league chelsea win the champions league with victory over manchester city in porto thought the champions league final was an interesting game but man city just didnt get going chelsea were excellent defensively but kante in particular was outstanding just a one man midfield did everything cabalero jugak tenang keluar man city menang ucl kt chelsea haha like a king,"[('man city', 0.4344), ('champions league final', 0.4833), ('chelsea', 0.5038), ('man city tears', 0.5123), ('champions league chelsea', 0.5318)]"
349,congrats to they played with great heaand deserved this win man city simply didnt show up mendy is definitely getting the golden glove a cleansheet against manchester city in ucl give pitso man city he wins everything congratulations to who have beaten manchester city 1 0 in the becoming the champions of europe for the second time in the clubs history chelsea crowned european champions for second time as kai havertzs first half strike sealed a 1 0 victory over a lacklustre manchester city in porto congrats to chelsea fans congratulations chelsea for beating manchester city in tonights champions league final get in there congratulations to brentford fc for making the premier league,"[('champions league final', 0.4842), ('history chelsea', 0.4954), ('win man city', 0.5553), ('congratulations chelsea', 0.6053), ('chelsea fans congratulations chelsea', 0.6533)]"
350,on behalf of all liverpool fans i cant believe im saying this thank you and congratulations to chelsea man city is still a small club with 0 champions league man i was really looking forward to seeing benjamin mendy hyping up the city players during the trophy celebrations lmaoooo where are those people that were betting 1m 5m 10m on man city e go pain im not even a chelsea fan and im this excited people will wear chelsea jersey to church on sunday we are bringing it home not a classic but well done chelsea on their success against manchester city the club just won the ucl 2020 2021 after the victory over manchester city at the drag o stadium by 0 1 the blues conquered the 2nd champions league of their history,"[('liverpool fans', 0.5175), ('chelsea', 0.5488), ('champions league man', 0.5589), ('chelsea fan', 0.5805), ('chelsea man city', 0.6729)]"
351,well it did just just glad it s not city congrats chelsea fans man city 200m and he s yours chelsea were lucky tonight giroud should do a thank you man city please chelsea player ratings kante produces masterclass james outstanding via manchester city may had a great team and coach but chelsea got a man named kante i never seen someone working this hard on football pitch kante were everywhere on pitch he deserve this he deserves ballon dor i love how experts thought was a done deal for man city before the finals same for de bruyne but man city will surely be back chelsea win champions league against manchester city after exceptional final tuchel the chelsea manager just taught all of us a useful lesson,"[('chelsea fans', 0.492), ('chelsea win champions league', 0.5483), ('chelsea player ratings kante', 0.5774), ('congrats chelsea', 0.5839), ('city congrats chelsea fans man city', 0.6945)]"
352,kepa is motm for me his presence on the bench had immense impact on man city players congratulations to chelsea football club amp their fans for winning the champions league 2020 21 tough luck man city yet great fight till the end what a great final to watch feeling sorry for pep guardiola hey adrian i think we can officially say chelsea is the father of man city we love manchester city hmmmmm this aged well chelsea brilliant man city bottle it chelsea are champions of europe for the second time in their history after defeating man city 1 0 the only person i believe to have lifted the champions league trophy before in the man city squad is the one and only scott carson this is sweet to put it mildly congratulations,"[('man city squad', 0.4553), ('man city players', 0.4604), ('manchester city hmmmmm', 0.4773), ('chelsea brilliant man city bottle', 0.5149), ('love manchester city', 0.5171)]"
353,well done chelsea you have the same number of european cups as nottingham forest 2 i want everyone who said chelsea great but man city bout to win to line up kenya man city fans you can win by getting chelsea beats manchester city 1 0 to clinch the champions league title its first since 2012 yes kepa receiving more cl winners medals than manchester city football club has made my day wanted manchester city to win cause i think kevin de bruyne is cute chelsea have been crowned champions league winners after beating manchester city 1 0 in the final at the est dio do drag o in porto portugal,"[('man city fans', 0.4973), ('champions league title', 0.5057), ('chelsea', 0.5147), ('cute chelsea', 0.5249), ('champions league winners', 0.5795)]"
354,unbelievable turnaround pulled off by in shoa shospan led chelsea to finish the top four in premier league reach fa cup final and now won the biggest trophy in europe salute the champions league final today can t wait chelsea fc are the champions of europe am sure man city had shirts made to celebrate should they win when i pray it comes to be and i pray now that chelsea wins against manchester city on saturday it is f man city fans we will win the champions league they are champions of europe they are the best team in england id like to give a massive thanks to after beating city in the cl final remain the only eh i have good friends in city abeg wuna get that song oh my neighbor,"[('champions league', 0.4953), ('chelsea', 0.5131), ('chelsea fc', 0.5136), ('chelsea wins', 0.5908), ('champions league final', 0.5925)]"
355,champions of europe once again wonderful display from the london club hard luck to man city something that we did twice man city failef trice fair play chelsea and congrats good game man city still has the pl championship so that takes out some sting rip man city you wouldve loved winning the champions league chelsea defeated manchester city three times congratulations champions chelsea just won the 2020 21 champions league incredible invisible stealth by chelsea think the long ball kick amp run developed by spurs 1961 double team is back i didn t want this for man city but will still congratulate hard work congrats to all chelsea associates grats to chelsea though they played well and tuchel once again outsmarted pep 1 kante is a legend thank you for coming to my ted talk,"[('champions league', 0.5651), ('chelsea', 0.5693), ('fair play chelsea', 0.6175), ('champions league chelsea', 0.6379), ('times congratulations champions chelsea', 0.6847)]"
