,tweetpositive,keyphrases
437,i mean he should have been first but lovely for the best right back ever to grace this universe to get the recognition he deserves he scored many goals and caught many carp the away kit will definitely be worn on sunday absolutely theres so much that hes doing for the youth over there trying to get them away from so many hardships they are but they can do better than 16mil come everton broo be a great gesture from the club love the hummel brand and designs any chance though we can get better sizing defo mate hes told me that he really would love to attend a game at the old lady,"[('away kit', 0.2252), ('many goals', 0.2683), ('sizing defo mate', 0.3294), ('everton', 0.4476), ('16mil come everton broo', 0.5317)]"
438,i did expect that she is ambitious she should be as well such a brilliant manager she is she knows villa will give funds and she can build a team like united or everton who can be relevant to the league title aspiration teams in womens football derby rivalry isnt big yet lol sweet thanks for nothing everton brilliant only everton damn was really looking forward to after the everton game and the final on the bright side i can go buy a knock off united jersey and be called a global fan immediately coutinho had a better season than messi for fc barcelona what an amazing magician he wouldve won us la liga and ucl on his own had he not fought with koeman who took his car parking i wonder which lucky club will get him,"[('brilliant manager', 0.3847), ('villa', 0.398), ('everton', 0.4324), ('coutinho', 0.4814), ('nothing everton brilliant', 0.5263)]"
439,brilliant thread class again they have more to offer at the moment were currently in a situation where the likes of leicester west ham and possibly everton will attract better players than us i know but a win and that last night has me in high spirits soucek for me scored so many important goals this season for us 2 last minute goals against fulham and everton the goal against west brom yesterday to get us back into it thank you for supporting my mum met him when my lad played at finch farm for stoke made a right fuss of him seems a great bloke that pace wow watched him go past 4 everton players last night like they were stood still i found it easy to be an outsider even now im just being me via,"[('stoke', 0.4155), ('leicester west ham', 0.4482), ('everton players', 0.5106), ('past everton', 0.5306), ('everton', 0.5443)]"
440,i think it would be so true if jill scott mbe scored on her final appearance manifesting for everton being an outsider is fine don t panic about it it s all right being yourself forward to the new season afc manchester city can confirm that there will be a special farewell ceremony for sergio aguero in front of the fans against everton this is going to be emotional i m sure and will agree this man should be in the premier league hall of fame gd evng brian and timothy hw was your day i was live today watching black angles game they deserve to be raligatade i was happy to see my team arsenal winning and newcastle all my prediction was through i wasnt happy seeing everton winning greats bayuda flavia kubi felix,"[('premier league', 0.336), ('sergio aguero', 0.379), ('new season afc manchester city', 0.3807), ('aguero', 0.39), ('everton', 0.4604)]"
441,leicester will be hell bent on winning by a good margin as goal diff may factor in top 4 race everton travel to citeh best result is win everton win useless lose one of the best when he was up for it i genuinely would be pleased if we drew or won and everton won because i would rather finish 16th then play in the conference league great memory trevor what was interesting for a club that had not won in 14 years think many of us fans knew we would win that final the trust in you guys was unequivocal which has been rare as a blue thank you for all those memories especially bayern everton love playing away from home too he was a classy player too,"[('bayern everton love', 0.4302), ('everton', 0.4381), ('leicester', 0.5311), ('everton win', 0.5841), ('win everton', 0.5874)]"
442,im too excited for this they knocked this seasons kits out the park so now im nervous then you give him an average everton team give him players like allan james rodriguez docoure etc who are much better than players leeds have yet leeds will most likely finish above them this year lets do it chelsea everton 0 1 wolverhampton three thoughts toffees play in front of fans for first time in months earn massive win great curler chat jonathan my favourite goal is the curled free kick into the opposite beckham v everton hinchcliffe v qpr or my favourite barnes v arsenal with the perfect brian moore commentary brilliant singing lewis fabulous but the drink would be a cup of tea,"[('everton team', 0.3907), ('average everton team', 0.3972), ('chelsea everton', 0.4043), ('everton hinchcliffe', 0.4059), ('everton', 0.4079)]"
443,im going to have the time of my life watching everton spurs arsenal rock up to the falkland islands to play their team gareth bale and son rocking up to stadion miejski to play rak w cz stochowa big 4 became the big 6 now its the big 7 with leicester could become the big 8 with everton getting continuous investment if their decision making improves to all the blue family if you can spare a few quid to help prosper with our everton nigeria teams then please do hes h best moment s chelsea 2 5 west brom villa 7 2 liverpool to all the blue family if you can spare a few quid to help prosper with our everton nigeria teams then please do hes helping the kids thru football under the blue umbrella,"[('chelsea', 0.3997), ('liverpool', 0.4016), ('everton', 0.4819), ('everton nigeria', 0.552), ('everton nigeria teams', 0.561)]"
444,beth england is backing a canine games challenge starting tomorrow before then she hopes chelsea can beat everton in the fa cup england said im glad that weve got this game as we can try amp do the things that we didnt against barcelona leicester will be hell bent on winning by a good margin as goal diff may factor in top 4 race everton travel to citeh over to you now goooooooaaaaaaal for liverpool winjaldum scores with his left foot in the 20th minute against everton villa will have fans back for the first time against chelsea too everton always comes through for barca when we are in crisis lovely cricket ground he visited via and p amp o,"[('canine games challenge', 0.4003), ('beth england', 0.401), ('everton villa', 0.4237), ('chelsea', 0.4382), ('everton', 0.4544)]"
445,moving on from yesterdays comments conference league is looking like reality for arsenal right now europa league outta reach confirmed tho which im totally fine with only arsenal can make themselves drop points against brighton compared to everton amp spurs liverpool hero mcmanaman would love everton to sign coutinho happy anniversary to our friends across the park liverpool hero mcmanaman would love everton to sign coutinho tribal football absolutely love this lad everton captain all day long what a player jesus christ i love him so much carlo ancelotti confident of good season regardless of european push fate u18s youngster liam higgins managed to return from injury after 5 months out and grab a goal for everton u18s everton always coming to save the day love it that have backed themselves expecting excellence bring it,"[('europa league', 0.5053), ('coutinho happy anniversary', 0.5111), ('europa league outta reach', 0.5137), ('lad everton', 0.5162), ('everton u18s everton', 0.521)]"
446,everton having their best season in years winning the transfer window getting a huge cash influx beaten us at home and will probably finish 7 8 thank god for everton hes back for good even as a liverpool supporter this melts my hea great singing lewis and congratulations everton is our only hope u18s youngster liam higgins managed to return from injury after 5 months out and grab a goal for everton u18s on the weekend as they beat newcastle united 4 2 in the last game of the season everton and juventus are really interested in signing sergio romero and have made contact juventus at this stage great home footage of everton homecoming parade following their fa cup final victory over watford davies allan doucoure is the dream midfield trio for the last game then strengthen in the summer,"[('everton homecoming parade', 0.519), ('everton', 0.6201), ('everton u18s', 0.6451), ('season everton', 0.6571), ('congratulations everton', 0.7143)]"
447,he always wore a smile was a consummate gentleman and loved a good joke which fantastic singing lewis possibly but i think city are more likely to smash everton to parade the title and leeds to beat wba after a great season we only beat them 4 0 away so quietly confident everyone s predictions about us are so accurate not sure how the club feels about it but i ve seen a few everton fans talk about it in positive ways which i understand it s a chance at a trophy and it might yield a positive outcome im going to be so incredibly successful next season that im leaving now to spare you the heartbreak of not being able keep me in a years time what football is all about good luck always loved everton,"[('singing lewis', 0.3514), ('leeds', 0.3576), ('fantastic singing lewis', 0.3759), ('everton', 0.4898), ('everton fans', 0.5876)]"
448,just read somewhere that its the 26th anniversary of everton last winning a trophy congratulations on that if i great tackle this this is a relief as i only ever have old shirts now i remember wearing an everton tracksuit to school on civvies day and people were asking me if i played in a womens youth team todibo 8 5m nice thinking of his precious everton lmao would this be a good signing fans i thought havertz was brilliant as a 9 against everton atletico madrid cp and real madrid just rewatch the game and see how he contributed not only look at stat sheets everton palace madrid arsenal from what i remember it s enough to convince me he d do well if given a sancho type creator brilliant singing lewis utt this has warmed me hea,"[('good signing', 0.4687), ('everton atletico madrid cp', 0.4799), ('stat sheets everton palace madrid arsenal', 0.4858), ('good signing fans', 0.5138), ('precious everton lmao', 0.5929)]"
449,the best paof this is whoever runs the twitter is a legend nice one now come on over and join your mate at could the gunners achieve the biggest turn around and make it to europe all they need is a win and ties for spur this is a great read pass it on love ye mick all the world and back again could the gunners achieve the biggest turn around and make it to europe all they need is a win and ties for spurs and everton both teams have tough opponents pink blue striped is my fav not long now welcome to one of the most successful club in english football history love the fact you follow on twitter,"[('everton', 0.4008), ('english football', 0.4153), ('english football history', 0.4255), ('successful club', 0.4525), ('gunners', 0.6378)]"
450,everton have never lost at goodison park in the premier league under carlo ancelotti with fans in attendance 6 wins 2 dra all sorts of good everton recruitment content out there just so much great stuff here you decide search for the channel ladsbroke on telegram and join winning team making money through sports betting the guy is good with punting odds best tipster so far in football betting tips enjoy your retirement once a blue always a blue everton deserve all credit after double gesture for nervous fan good morning please dm me when you see this want to talk to you about getting the word out on some book plates that rog is dedicating to everton usa supporters to help us raise funds for our local project in the carolinas,"[('blue everton', 0.5426), ('everton', 0.593), ('good everton recruitment content', 0.6153), ('good everton', 0.6187), ('everton usa supporters', 0.6308)]"
451,got you covered bro it s on sale too ag ero has been injured off late but pep said he will hopefully be ready to play against everton and with it being his final game i m sure pep will feature him on sunday a huge punt for gw38 but one that i like the look of the winger has also been involved in 29 of goals this season 3rd best in the squad looking at the minutes mahrez previously had a full weeks rest before playing 90 vs brighton so he has a great chance of starting against everton hence he is a great shout for this week you re most welcome,"[('gw38', 0.3011), ('squad', 0.3141), ('winger', 0.3748), ('pep', 0.4651), ('sure pep', 0.4996)]"
452,i m a celtic and everton fan so was never a fan but i do like the way he carries himself and him being up in scotland even if it is as rangers manager is good for the game up here must admit i ve been impressed with anguissa this season i think everton can do it they are tight right now and city might bench a few of their good player to get ready for their champions games on the 29th they will definitely help us what i want is they should buy more than 1 players from us everton women are in for a surprise tonight seems ideal for you celebrity video messages on instagram kevin ratcliffe has just recorded some more amazing personal video messages for fans link in bio,"[('celtic', 0.3875), ('everton women', 0.4394), ('rangers manager', 0.4409), ('everton', 0.4982), ('everton fan', 0.5763)]"
453,tricky trev my favorite player from that team immediate reaction to this win was phew thank god we won a trophy that was a long 8 years best team performance leicester a best individual performance ogbonna v everton a most improved player fornals everton are no pushovers for sure being well underrated i hope this game shows he is good enough for england squad surprised so many are considering city players for gw38 everton haven t conceded an away goal since gw27 revisit liverpools best club everton deserve all credit in the world after double gesture for nervous fan cheers ryan they really deserve a lot of credit love it wish some of his teammates showed the same commitment great news for,"[('club everton', 0.4498), ('everton', 0.4519), ('best team performance leicester', 0.4949), ('improved player fornals everton', 0.4997), ('best club everton', 0.5304)]"
454,we avoid the ignomy of the europa conference league and benefit from fewer fixtures next season as we actually finally mount a challenge for top 4 and we get to celebrate a st totteringhams day too love reading things like this about our club what a touch to have the bag waiting for you as well love it and congratulations to you and the wife fella big fan of the everton kits looking forward to seeing the chevrons in black and green the kits are going to be unreal again this year ings would be a good bye but i would go for younger players in the everton striker and abraham of chelsea as both could be anything and are proving goal scores please do a favour on sunday and thanks in advance,"[('chelsea', 0.4431), ('europa conference league', 0.4932), ('everton striker', 0.5015), ('everton kits', 0.5225), ('everton', 0.5229)]"
455,leave it be gerrard is a legend i saw him play once and ill never forget a conductor with an orchestra 4 0 against everton the stuff of dreams i bet all those youve named will get their day people need to calm down its like theyre choosing their favourite children everton thank you ooh you ve gotta beat brighton that s a tough game super super sunday a brilliant end of season s football a big win for the new premier league champions against everton ha ha will do mate the goal they used to show at staof grandstand for a couple of years after unrelated but you ll appreciate a mate of mine other halves dad is an everton legend from the same era got tickets for everton let s go jealous a win is a win right,"[('new premier league champions', 0.3586), ('premier league', 0.3753), ('everton', 0.4399), ('everton legend', 0.5493), ('favourite children everton', 0.5599)]"
456,well done to the squad this season beat sheffield united to qualify for europe or beat man sheikh brave choice well done lads wtf everton is one of the biggest clubs in england they have 9 league titles mina and gomes doesnt even stafor everton st totteringham s day is like a trophy massive congratulations to and on winning last nights matchday challenge we will dm you sh we made it to the semi final of the europa league better than last szn and theres a pretty good chance well finish 7th better than last szn above spurs everton top work again from this time going above and beyond for so he could watch at goodison last night wow thank you so much st torrenham dey always give me joy nice to hear your interest in our nac,"[('sheffield united', 0.5252), ('spurs everton', 0.5256), ('everton top', 0.536), ('everton top work', 0.5837), ('lads wtf everton', 0.6087)]"
457,thank you lads i always look to see how are doing throughout the season amp hope they always have success big game this evening which needs to be won love this story good luck with the new tiny toffee and well done proud to be blue will probably be playing as a lcm next season since henderson will most likely be back seems to be better on the left side as well from the game we saw against everton in the first game dropped a blassic that game out of all the everton kit leaks this 2012 13 one is probably my favourite except for the badge of course i know it was just a nike teamwear template but its just so nice kevin ratcliffe has just recorded some more amazing personal video messages for fans at,"[('season amp hope', 0.3375), ('lads', 0.3575), ('everton', 0.4404), ('everton kit leaks', 0.4579), ('everton kit', 0.5217)]"
458,it was a great kit season we signed virgil scoring against everton on his debut truly are amazing jealous youve got them to partner im lucky enough to wear them on my everton shi ronnie is a nac legend everton always coming through for us makes a man proud a very happy 26th anniversary to the last time everton opened their trophy cabinet htt coutinho was superb at liverpool but like all foreign players you have to cross your fingers when everton come calling it is hoped that he would fit into their plans what a player i remember that goal v everton in a 1 0 win better than i remember a lot of the goals from,"[('last time everton', 0.501), ('time everton', 0.5154), ('everton shi ronnie', 0.5155), ('nac legend everton', 0.5565), ('goal everton', 0.6299)]"
459,what a player i remember that goal v everton in a 1 0 win better than i remember a lot of the goals from this year bro west brom and everton got a better lukaku than we did and like i said martial is a fan favourite same way ozil was for you man i d like to believe we can win a title with him and we signed sanchez to stop him goin city and look how that went just how good was michael keane tonight blues nice one anne just listened they should use you as an everton fan on tuesday evenings i hope arsenal wins their last match o make everton and tottenham play draw i wan watch uefa league 3 n mme kalju vs arsenal would be fun,"[('arsenal', 0.3889), ('everton', 0.4252), ('michael keane tonight blues', 0.47), ('everton fan', 0.4825), ('goal everton', 0.5372)]"
460,imo he s one of the best young rb in the world just a matter of time everton also wanted him congrats to finally everton bring the score to me after all too late but better than nothing road to top 500k for covid season fpl in final gw 13 points to chase liverpool to win best of luck for the final day hopefully kdb amp foden choose full violence vs everton glad ive already got the 2020 21 home kit i use to love this one and i really wish clubs would go back to the collar mci is a different beast and not just because they have 6 days in between gw38 vs everton and the cl final but because of pep roulette,"[('collar mci', 0.309), ('liverpool', 0.3742), ('everton', 0.422), ('best young rb', 0.4356), ('time everton', 0.473)]"
461,we drew with everton they re fighting for europe logic says we would be in the fight for europe as well hope this helps dave watson when i went to an everton football camp when i was a kid absolute gent he was now hes improved to be fair coutinho first and then neto haha everton amp barca are good friends we lift the trophy for you kun ohh i am intrigued i have faith in everton they are gonna be our saviour thank you ladies and gentlemen its been a wonderful career i remember winning the john west tuna chunks cup in sweden love the quote tweets of this if it takes this soof silly clickbait to trigger a flood of appreciation for yerry mina and the outstanding season he s had so be it,"[('everton amp', 0.4798), ('everton football camp', 0.5244), ('everton football', 0.5735), ('everton', 0.5746), ('haha everton amp barca', 0.5915)]"
462,if arsenal and leeds both win their games and man city beat everton everton will finish 10th in the league stretty news exclusive juventus and everton really interested in sergio romero watford manager xisco munoz makes amazing carlo ancelotti and jurgen klopp claim mid table teams are getting better leicester west ham leeds wolves everton and villa to some extent god bless everton buy sergi roberto too 30m only joe buck is excited when everton rangnick as dof and either potter or ten hag and im satisfied happy thursday x please be interested in sergi roberto and umtiti as well bless him did he enjoy himself everton always arrive on time to save bar a ill pass the message onto dad as hes not on social media thank you thank you michael,"[('sergio romero watford manager xisco munoz', 0.4145), ('wolves everton', 0.4918), ('everton', 0.5126), ('everton everton', 0.5292), ('everton buy sergi roberto', 0.5801)]"
463,if you want to invest in one of the most innovative token atm look no further then leicester will hopefully beat spurs 69 59 i love everton we love everton everton 1 wolves 0 i was made up scored i m celebrate it carlo ancelotti a big paof this victory came from the supporters in the history of this club there is this kin nothing better than a big tackle getting the crowd going at goodison well done lewis singing your heaout supporting everton from now on in the prwm brilliant footballer back in the day an excellent role model to any of the younger fellas coming through happy birthday johnny have a great day all my homies love everton,"[('spurs', 0.3584), ('prwm brilliant footballer', 0.4096), ('leicester', 0.4627), ('everton everton', 0.4906), ('everton', 0.4926)]"
464,we were able to ship iwobi to everton for near on 40mil so it wouldnt be a stretch to ask for the same regarding willock as rightly stated goals form have really increased his value buy back clause should become standard in all dealings going forward this season looks a massively improved player and i cant wait for the next 150 apps i was so pleased he signed for everton then to play for tranmere as well at times he was unplayable and his service for aldo was excellent love him supporters attending manchester city s premier league finale at home to everton on sunday are being encouraged to remain in everton are our saviors better than liverpool,"[('goals form', 0.2373), ('premier league', 0.2845), ('liverpool', 0.3278), ('everton', 0.4273), ('willock', 0.446)]"
465,ive gotta say one player who has flipped my opinion of them 180 is yerry mina i think hes become our most consistent centre half injuries aside this season hes been excellent amazing thanks so much youve been solid all season even if you wont be as solid against everton on sunday please give us your best performance against the noisy tomorrow s my birthday and now i m even more excited some things just make players it s the fans for this fella they give him that extra pep in his step i love everton always paying good prices for our average players up for sale oh sweet everton my club all the best for your pending baby blue great read this and well done to,"[('injuries', 0.2582), ('yerry mina', 0.3114), ('consistent centre half injuries', 0.4384), ('everton', 0.4825), ('sweet everton', 0.526)]"
466,footballs back and were delighted to have supplied the cumbria branch of everton supporters club with this fantastic 6ft x 3ft flag making its home debut at goodison park in last nights 1 0 victory over wolves lovren was technically much better than nat that pass for origi against everton is probably the best example so we didnt lose a ball playing cb great season indeed record rare home win great to see the event at this wknd once again leading the way and supporting the government as an everton fan i approve pep has to staaguero against everton and then sub him off after 10 minutes and everyone gives him a guard of honor would honestly be so magical,"[('rare home win', 0.3298), ('pep', 0.3301), ('everton', 0.5142), ('everton fan', 0.5218), ('everton supporters club', 0.5504)]"
467,i also emailed the club saying i was worried my would not make the 3 mile trip to the game got my seat completely empty no new car keys haha on serious note congratulations hope all goes well and great the club looked after you ay no wonder pickford played well he clocked evertons future number 1 i like the white and blue kit but hope they dont get rid of the gold kits hope they make a new gold kit this season congratulations now give us a glory moment against everton massive congratulations to and on winning last nights matchday challenge we will dm you shortly on how to claim your prize thanks again to everyone who entered i wish we have him in everton he is a good player,"[('evertons', 0.3584), ('massive congratulations', 0.3591), ('season congratulations', 0.397), ('everton', 0.406), ('pickford', 0.4204)]"
