,tweetpositive,keyphrases
0, what a performance from the man of the match the world s best cdm no doubt friends of manchester city are you ready for the victory tonight 2 chelsea have won their last two matches against manchester city in all competitions both coming since thomas tuchel took both semi finals against madrid and the final versus city he was man of the match in all 3 by a mile thats what big players do no talk no hype just action speaking for them c sar azpilicueta on kai havertz this guy is going to be a superstar he is already he scored in a champions league f when kante turns up we win it is as simple as that man single handedly dominated real madrid and manchester citys midfi,"[('champions league', 0.4024), ('manchester citys midfi', 0.4295), ('chelsea', 0.4335), ('kante', 0.4833), ('tonight chelsea', 0.5072)]"
1,so happy to see man city lose to chelsea a beautiful day it was the best or worst first meeting tuchel on relentless c bbc spo chelsea boss thomas tuchel congratulates his team on their win over manchester city in the c city showed courage in really good final guardiola bbc spo manchester city manager pep guardiola says he is proud of his sides courage after their 1 0 chelsea fc are the champions i am planning to by my wife a man city jersey cause i love beating her just like we love beating man city aguero just as i predicted three weeks ago chelsea and villarreal have won uefa champions leag hear fans celebrate chelsea winning champions league chelsea clinched the champions league title after beating manchester city 1 0 in the all english final,"[('tuchel', 0.4856), ('chelsea', 0.4915), ('man city lose', 0.5159), ('champions league chelsea', 0.5327), ('chelsea boss thomas tuchel', 0.6051)]"
2,i love sergio aguero i love kevin de bruyne and win or lose i love manchester city we go again next year pep guardiola insists manchester city still had an exceptional season we are the champions of europe professor you re going to win the champions league chelsea players but man city have de bruyne one of the best midfielders in the premier league ngolo kant one of the greatest midfielders of his generation man of the match in the 2nd leg against atl tico in both semi manchester city will splash 150m on kane let s be serious they will end up winning it soon manchester city could have won the fa cup and the ucl to complete an unprecedented quintuple if manchester city win to day i will share 10k to all my followers,"[('champions league chelsea', 0.4681), ('sergio aguero', 0.4801), ('premier league ngolo kant', 0.484), ('manchester city win', 0.5306), ('love manchester city', 0.574)]"
3,cool picture but man city is small leicester clear everything about chelsea football club is very beautiful and sexy manchester city i laju sangat kante ni confuse man city sksksksk pape pun congrats chelsea if manchester city win the ucl tonight they ve done the treble can t wait for pep guardiola to achieve this man when you meet a man city fan give em a hug they need it manchester city has everything going for them ahead of the but the day favours chelsea chelsea will so much beat manchester city tonight manchester city have been brilliant for six months it s difficult to explain why pep would change the system on the bigge he did again won it against manchester city kante is indeed uefa president son in law,"[('man city fan', 0.5556), ('manchester city', 0.5558), ('manchester city kante', 0.5958), ('manchester city tonight manchester city', 0.6145), ('manchester city win', 0.62)]"
4,i think chelsea is going to win based on their last top forms in the matches against manchester city and do we beat atletico madrid real madrid and manchester city fully deserved all those wins too no element of luck this time so glad man city didnt win the champions league haha chelsea win the champions league for the second time with a 1 0 victory over manchester city in the final in yeah was just having a similar discussion with a friend we are quite a likeable team nowadays unlike the older teams with characters like terry jose even costa etc felt like alot of neutrals supported us today although a bit had to do with man city being the opponents haha chelsea are crowned uefa champions league winners after beating manchester city 1 0,"[('champions league winners', 0.5425), ('uefa champions league winners', 0.5619), ('chelsea', 0.5689), ('champions league haha chelsea', 0.5984), ('opponents haha chelsea', 0.6298)]"
5,feeling hella good hahahaha man city can win the league pero they can t win in the big cup won the champions league for the second time in their history after defeating manchester city 1 0 at the estadio ngolo kant one of the greatest midfielders of his generation man of the match in the 2nd leg against atl tico in both semi finals against real madrid and now again in the final against manchester city even by his incredible standards that s just phenomenal then im happy ahahahahag greater love hath no man than this that a man lay down his life for his friends champions league final matthew mcconaughey sends good vibes to chelsea for ucl final vs manchester city watch all thanks to the exciting new de,"[('chelsea', 0.4621), ('manchester city', 0.4733), ('champions league', 0.4839), ('good hahahaha man city', 0.5043), ('champions league final', 0.523)]"
6,still so gutted after wednesday so much gratitude to pep guardiola and manchester city for giving some joy to my week manchester city showing dominance in the league liverpool and chelsea making a mark in europe chelsea were crowned european champions for the second time as kai havertzs first half strike sealed a 1 0 victory over ma chelsea champion congratulations chelsea beat manchester city 1 0 to win the champions league final matching two of the richest and talented teams in england didnt let atletico real madrid and man city have a sniff of even a chance of victory no gratitude no humbleness no destiny this time chelsea really are the best team in europe if pep guardiola wins the champions league with manchester city is he the best football manager of all time,"[('europe chelsea', 0.5037), ('time chelsea', 0.5226), ('best football manager', 0.5392), ('congratulations chelsea', 0.5976), ('chelsea champion congratulations chelsea', 0.6575)]"
7,thomas tuchels mission has been accomplished hey life goes on and more games championships and trophies to fight for are yet to come liverpool lost vs real madrid and the next season they won it all so why not man city manchester city will defeat chelsea tonight and lift the champions league trophy thank you chelsea for saving the football world from a man city champion s league win chelseas kai havertz repaid some of his huge transfer fee as his first half goal sealed a 1 0 win for his side over manchester city in the champions league final on saturday est dio do drag o we are champions man city might win the next season cristiano ronaldos mum has touched more champions league trophies that chelsea and manchester city combined,"[('chelsea tonight', 0.4922), ('champions league trophy', 0.5094), ('champions league trophies', 0.5251), ('man city manchester city', 0.5609), ('champions man city', 0.5862)]"
8,jack harrison leading the way as leeds united aim to finish strongly while rodrigo took much of the acclaim after a brilliant two goal contribution off the bench to show he is finally looking like a record si but come to think of it i m so proud of kante i think he deserved to win this than the entire man city team long live king kante chelsea are champions league winners for a second time man city deserves it chelsea fc z european champion once again congrats to t tuchel and d lads for shaming our enemies especially fans champions league final man citys false nine approach has proved a pep guardiola stroke of genius via best team in europe yen yen yen yen,"[('champions league', 0.4185), ('kante', 0.4746), ('champions league final', 0.4922), ('king kante chelsea', 0.5159), ('champions league winners', 0.5413)]"
9,chelsea win the champions league for the second time with a 1 0 victory over manchester city in the final in porto first champions league final for man city under pep denied by tuchelsea this guy is a master tactician beating pep under 7 weeks is incredible congratulations to chelsea for winning the champions league against man city in porto portugal goal from kai havertz i really feel that man city will win it next year lg is very much a tribute to him the man who explained the history and the potential of glasgow to me i hope im doing him and my city proud well done to for a much deserved cup what a city started watching football in 2012 and already want to celebrate a ucl,"[('manchester city', 0.4283), ('porto first champions league', 0.4557), ('champions league', 0.5024), ('chelsea', 0.5363), ('champions league final', 0.5491)]"
10,agreed and it might just happen hes consistently won man of the match in the last 3 champions league matches including this final vs city to use your terminology tuchel constipated man city well done keeping peps mob to virtually nothing on target is a massive tactics win i really do commend the effothomas tuchel has done with chelsea was in a difficult position to regroup that team when he joined they they champions full respect to him and chelsea more happy man city fans are crying coz they still haven t won a champions league oil city fc true but we still rocking with man city over here timo werner is so good he beat man city with just his pace 3 times in different competitions no goals needed from him,"[('man city fans', 0.3517), ('champions league', 0.3671), ('effothomas tuchel', 0.48), ('terminology tuchel', 0.4924), ('tuchel', 0.542)]"
11,you did a good job man city but go on chelsea manchester united liverpool chelsea city then arsenal ur 5th biggest now chelsea are champions of europe yes that is an easy one yes we will chelsea boss thomas tuchel is very confident ahead of the champions league fi just reminder that aston villa and nottingham forest are still a bigger club than manchester city bernard he s undeniably a great coach and motivator and we are in no way qualified to judge the man but i askedbefore he took over city has he proven that he s the greatest he took over franks barca team that had unbelievable talent and roy hodgeson would have been successful,"[('chelsea', 0.4701), ('liverpool chelsea', 0.5024), ('chelsea city', 0.5177), ('chelsea manchester united liverpool chelsea city', 0.5356), ('chelsea boss thomas tuchel', 0.6032)]"
12,he deserves a million likes for his class performance against what has been a dominant city side this season n golo kante you are a man this guy will be spoken about as one of the greatest players weve seen in the premier league jamie carragher continues to be blown away by the chelsea midfielder kai havertzs first half goal has won the champions league for chelsea in porto and prolonged manchester citys quest for e hes going to man city and win it for them even a man city fans celebrates with us kante was so good he man city look like man united trying to breakdown villarreal out of ideas no where to go and reduced to hoofing in crosses jorgihno made the right decision to join chelsea over manchester city,"[('man city fans', 0.4669), ('chelsea midfielder kai havertzs', 0.4958), ('premier league jamie carragher', 0.5041), ('us kante', 0.509), ('kante', 0.5396)]"
13,tough night for so called manchester united fans who supported manchester city you lot deserved it nottingham forest of the championship are a much bigger club than manchester city always great to see man city take a harsh l too like you say w united coming back stronger is what matters city in the cl are progressing better from pep s first year it s only a matter of when for city in the near future whether if it s pep or a successor and it is all joy for the chelsea fans chelsea win their second champions league and thomas tuchel beats manchester city three times in six weeks join us for they played well nullified man city,"[('fans chelsea', 0.5534), ('manchester city', 0.5542), ('manchester united', 0.5662), ('united fans', 0.5925), ('manchester united fans', 0.6531)]"
14,captain christian pulisic became the first american male to play in and win a after chelseas 1 0 win over man city on saturday with the win chelsea becomes lmaooooooo i love how manchester city admin admitted this im so happy cause manchester city lost kante has to go down as one of best in hsi position he can actually help arsenal to get top 7 and help psg or man city to a ucl trophy cuz thats just kante congrats you won runner up too but my family apparently doesnt like man city so i am happy ruben dias totally deserves the pfa poty for the massive impact he s made on manchester city today we re likely to witness manchester city win a treble and we re still content and relatively happy with the progr,"[('win chelsea', 0.4937), ('kante congrats', 0.5151), ('manchester city today', 0.5291), ('manchester city win', 0.5479), ('happy cause manchester city', 0.6328)]"
15,reece james 21 years old chelsea through amp through starts in a champions league final help keeps a clean sheet vs manchester city and becomes a champion even their managers best pe teachers you could ask for over confident and amazing bottlers congrats man city won man city sha una well done o hoping all my man city mutuals are doing well take care lads rio ferdinand loved what he saw from the immense chelsea star chelsea are winners of the champions league for the second time pr xima jornada wants to wish good luck to r ben dias jo o cancelo and bernardo silva tonight for the uefa c man city really did good this season tho props to chelsea the best oil money club ever man city psg would never,"[('manchester city', 0.5067), ('chelsea', 0.5464), ('old chelsea', 0.5598), ('care lads rio ferdinand', 0.5667), ('immense chelsea star chelsea', 0.5842)]"
16,fans of sekondi takoradi ghana celebrating the win against man city the only reason arsenal fans and tottenham fans supported manchester city tonight london is forever blue chelsea is the worlds best team and today cements the fact manchester city no reach qf porto aren t small boys they ll definitely win chelsea pulisic is bigger than manchester city i want you guys to go to the playoffs man lol your city needs a playoff run despite everything i love you i love you manchester city i wouldn t change you for anything congratulations to manchester city i could get busy by the time they win the most valuable player ever il est petit il mang leo messi man city ngolo kante,"[('fact manchester city', 0.5038), ('arsenal fans', 0.5389), ('manchester city tonight london', 0.541), ('win chelsea', 0.5564), ('tottenham fans', 0.6075)]"
17,tuchel has won it with chelsea now the trending goes like this guadiola man city final 2020 vs i dont know anyway congrats to chelsea that s how it feels to be champions of europe xxxx manchester city 0 1 chelsea city showed courage in champions league final guardiola still major achievement for city man nobody ever win their first cl final before big step for them manchester city are winning the quadruple 2021 22 last time chelsea won the cl their opponent won the year after lol wouldnt be surprised if man city win next year liverpool 2019 win the ucl congratulations to manchester city on reaching one sixth of the ucl finals cristiano ronaldo reached,"[('time chelsea', 0.4708), ('man city win', 0.4937), ('manchester city chelsea', 0.5039), ('last time chelsea', 0.5151), ('champions league final', 0.5481)]"
18,yeah in wes brown s 22 year career he achieved more than manchester united have in the last 5 years and manchester city have in the last 141 years combined in both cases the manchester team was the pregame favorite the prem is the most exciting league by a mile we expect more in tonights match thats good to hear man and yes manchester city will come back next season to try win it finally today a london club brentford has won the championship playoffs think about this question and answer it honestly does really watch that game tonight and think he has to go to man city he suits us more we also become the best team in the world if he joins he managed the best bayern munich team and,"[('man city', 0.4336), ('manchester', 0.4416), ('manchester team', 0.4722), ('manchester united', 0.4893), ('manchester city', 0.5025)]"
19,man city coming back stronger next season hats off pep and man city players this season claude mak l l it doesnt matter that the favourite is manchester city i think chelsea have the capacity to win this tro thousands of chelsea fans flood the streets of west london to celebrate as the blues beat man city in the final best manchester city goal this season is kevin de bruyne the best soccer player in the world chelsea beat man city again and are the champions of europe kai havertzs goal in the first half was the difference as chelsea earned a deserved victory over manchester city chelsea didn t win man city chelsea won the world what a feeling man i love this city but damn y all be doing the most,"[('man city players', 0.5268), ('final best manchester city goal', 0.5512), ('manchester city chelsea', 0.5937), ('win man city', 0.6031), ('man city chelsea', 0.6806)]"
20,chelsea beat manchester city to win champions league for the second time in history chelsea have secured their second champions league congratulations chelsea fc juara champions league 2020 2021 as a man u fan happy chelsea won and not man city they have better individual players whereas chelsea have coach that is tactically better than man citys coach man city had the greatest champions league season in their entire life and they still came second its too funny a lot of people mocking guardiola but hes done a fabulous job at manchester city this season this current team is no longer at the level of the centurions but he still almost win them the treble 2nd team bayern munich easy league with amazing players,"[('happy chelsea', 0.5374), ('greatest champions league season', 0.5523), ('chelsea beat', 0.5826), ('second champions league', 0.6032), ('congratulations chelsea', 0.6039)]"
21,chelsea won the champions league for the second time as a kai havertz goal secured a tense 1 0 victory over manchester cit we re going to beat manchester city in the champions league final this was probably the easiest chance he had at winning one at man city sterling and mendy are two big money players man city can sell immediately and it d actually help the team on 29th may 2021 in porto chelsea became champions of europe again read our match repoon this legendary night tuchel we can use this to become even better a smiling thomas tuchel was able to reflect on turning champions league final disappointment last year with psg into triumph this year with chelsea after his side got the better of manchester city for a thi thats fine please suppoman city,"[('manchester city', 0.4107), ('porto chelsea', 0.4909), ('champions league', 0.527), ('chelsea', 0.5355), ('champions league final', 0.5937)]"
22,chelsea are winners after defeating manchester city 1 0 pep guardiola insists manchester city still had an exceptional year despite champions league loss in my dream i will still win man city chelsea were crowned european champions for the second time as kai havertzs first half strike sealed a 1 0 victory over manchester city in porto chelsea have been crowned uefa champions league winners for a second time with a 1 0 win manchester city well played chelsea fc some reflection for pep and man city for next season unlucky great final to watch if zinedine zidane have this present man city team at his disposal he will end up winning five 5 ucl consecutively i bet anybody for this chelsea beats manchester city 1 0 winning the champions league for the second time love u so much,"[('champions league loss', 0.5542), ('champions league winners', 0.6128), ('win manchester city', 0.6194), ('uefa champions league winners', 0.6344), ('man city chelsea', 0.6472)]"
23,well sterling was right manchester city delivered as he predicted good ebening man utd man city feeling blueeeeeeeeeeeeeeee lol congratulations too the sky blues on their ever this morning against 1st euro leagues trophy in 2012 so i guess this just proves in life if you want anything bad enough amp you work hard for it good things happen in life chelsea secure their second champions league title after defeating manchester city 1 0 tuchel we can use this to become even better a smiling thomas tuchel was able to reflect on turning champions league final i knew chelsea were going to win the champions league when supported man city to win it for this club its a dream and all the wonderful players thanks they had a better season thats all man city women are better than them,"[('second champions league title', 0.4591), ('champions league title', 0.4687), ('manchester city tuchel', 0.4987), ('chelsea', 0.4999), ('life chelsea', 0.53)]"
24,don t worry i m confident manchester city will win it next season losses like these provide a team with so much extra motivation to come back stronger no wonder chelsea won the ucl trophy now it all makes sense video rudiger pulls off incredible last gasp block against foden to keep chelsea v man city score level congratulations to all chelsea fans and the team as a whole and better luck next time to did well on second half i really admired him for that though they were not favourable to win the trouphybut he put up a very good performance manchester city fans loved what dias had to say following question on best portuguese defender,"[('chelsea man city', 0.5557), ('manchester city fans', 0.5566), ('performance manchester city', 0.5588), ('confident manchester city', 0.58), ('good performance manchester city fans', 0.6058)]"
25,manchester city fans loved what ruben dias had to say following a question on who is the best portuguese defender of all time with the 24 year old centr it s literally a fact mate no denying it wes brown is more successful that manchester city as a club roman abramovich remain the best club owner one of the happiest days of my life i never ever really wrapped my head around that this was possible we must not forget man city as a great team today is not for shitting on them we know how it feels to lose ucl final come you blues i love you champions of europe gt champions of england weve had a better season than manchester city morning have a blessed and beautiful sunday guys,"[('best portuguese defender', 0.4572), ('manchester city morning', 0.4718), ('manchester city', 0.4801), ('ruben dias', 0.5213), ('manchester city fans', 0.6233)]"
26,congratulations to chelsea after beating man city in the champions league final not bad thanks katy im glad man city lost tonight as a neutrul football fan supporter the argentine has one final game to come and its huge chelsea have emerged champions of europe once again the blues defeated manchester city in portugal on saturday night may 29 2021 german international kai havertz scored the all important wi he has played with a false 9 for most of the season to great effect de bruyne foden sterling even gundogan have all done relatively well there most thought manchester city was going to take it but congrats to chelsea congrats to chelsea fc won the for the second time as a goal secured a tense 1 0 victory over,"[('huge chelsea', 0.4841), ('chelsea fc', 0.5124), ('chelsea', 0.5194), ('champions league final', 0.5608), ('chelsea congrats', 0.717)]"
27,send the man city fans to maccies they need a happy meal congratulations to chelsea for their win against manchester city were the best in europe right now yep and celtic have more champion leagues than city life is good man man city fans have been a class act fair play and best wishes your day will come man city and the rest of england you are welcome congrats to chelsea for winning the ucl final beating man city 1 0 again tactical masterclass by thomas tuchel and peps 3rd straight defeat to chelsea not sure why theres no holding midfield in the citys lineup me as a arsenal fan im delighted they won they played brilliant football the defence was incredible man city were poor manchester city deserved the win btw most successful teams this season in england,"[('good man man city', 0.4811), ('manchester city', 0.4901), ('poor manchester city', 0.5382), ('man city fans', 0.608), ('good man man city fans', 0.6346)]"
28,c sar azpilicueta on kai havertz this guy is going to be a superstar he is already he scored in a champions league and not only that he ran like crazy great to see two teams in manchester city and chelsea fight so hard to win a competition they wanted to leave a month ago my bae former chelsea legend pays tribute to heroic performance from n golo kante vs man city when the mom is a chelseafan and yout is a man city fan congrats to chelsea man city are still the best team in world football though and without a doubt they will be back gg man city but congratulations chelsea bad game for man city more aggressive next time nice night guys we are massive,"[('man city fan congrats', 0.4844), ('former chelsea legend', 0.5048), ('congratulations chelsea', 0.5092), ('chelseafan', 0.5424), ('chelsea man city', 0.5767)]"
