,tweetpositive,keyphrases
278,graham careys bulgarian cup win liam mcalinden scores in consecutive games for the first time since august 2019 seamus colemans 350th everton appearance and a little more in the midweek round up i saw it on the time line so i thought it might be a good idea sharing with you guys until i saw someone inside it turned to be a great one very black but nice new everton top is nice love it you have done it again cant wait for the home shirt whens that released that is a cracking shirt that new away everton top is really nice there s got to be someone in merchandising over there who after releasing this beautiful piece has turned their eye to timepieces the road kits for next year are definitely buying me one of those,"[('bulgarian cup', 0.5055), ('new everton', 0.5196), ('everton top', 0.5363), ('nice new everton top', 0.603), ('seamus colemans 350th everton appearance', 0.6079)]"
279,the most clinical in terms of goals per shot appreciated for all candidates lad we re in prime position to get the conference league spurs have leicester everton have city and we have brighton we have what should be the easiest game and spurs and everton will probably lose although i hope everton win sunday is likely to be the last time we see gini wijnaldum wearing a liverpool shirt he has given us some great moments some great moments from james rodriguez whose time at the club could well pass as a blur when does a small problem become a much bigger one i certainly love a sash dont mind the new kit apafrom the collar but we could wear anything as far as im concerned so long as were a decent team and winning games,"[('everton', 0.4139), ('everton win', 0.4381), ('leicester everton', 0.4451), ('liverpool shirt', 0.4592), ('hope everton', 0.4846)]"
280,we ve been listening to all your wishes and now we can t wait to show you the new 2021 22 away kit as i say in my bio if its hummel its good i love it collymans had a good run of late getting my everton tattoo yesterday and then posting about it has done wonders for my follower count ancelotti on rodriguez now he will be focused to prepare for the copa america with his national team i hope to have him back next season at his best england highest league 1927 28 everton was a champion this year 60 goals in 39 games i like it new away kit but the new home kit have to say you ve done a cracking job with the away shirt,"[('home kit', 0.3837), ('new home kit', 0.4298), ('away shirt', 0.4763), ('away kit', 0.4906), ('new away kit', 0.5656)]"
281,cool am going to recreate bohemian rhapsody by singing the show must go on sure all the family will be immensely proud hope ros and neil are well enough to attend im old school declan appreciating the nod that it is toward the black watch kit efc 1880 81 see attached ive always loved seeing everton play away wearing an amber kit gimme the kits of the mid 60s and early 70s nice and simple already mentioned everything i need to in the pots allan doucoure and james have all been fantastic but nobody even comes close to the impact that big ben has made on this club this season,"[('club', 0.2877), ('proud hope ros', 0.3062), ('black watch kit efc', 0.308), ('everton', 0.3745), ('bohemian rhapsody', 0.4534)]"
282,joshua zirkzee is 100 coming back to fc bayern after his loan spell at parma he doesn t need any surgery after his injury and he s almost ready for the pre season then bayern will decide his future everton are interested in signing zirkzee since last january too good for a small club like everton would really appreciate your vote but encourage you to take a good look and vote for who you think will represent you all in the best way its a promising sign for the future if the home form can improve bloody lovely that top job i hope james is here next year i want to see him play live for everton heres the stunning new everton away strip from that harks back to their early days as the black watch,"[('fc bayern', 0.4567), ('everton', 0.4658), ('stunning new everton', 0.4795), ('new everton', 0.4937), ('future everton', 0.5694)]"
283,thank you carl really appreciate the vote you will be seeing tweets from me daily on this soon in the running for the england u21 job one of my favourite modern day everton players new and stunning everton away kit for 2021 22 season theyll use it for the first time vs mancity this sunday anyone else think the new away shiwould look good with the name amp numbers in the same burnt orange got plenty of time for him like you said seems a quality fella you can tell he amp klopp are mutual admirers he s one of the few whose post match stuff i ll watch after they ve played us always thought he was the type of manager everton needed deserves a decent job next x that is a stunner hummel makes my favorite shirts,"[('day everton', 0.4735), ('everton players', 0.4816), ('manager everton', 0.5075), ('stunning everton', 0.5293), ('favourite modern day everton players', 0.5724)]"
284,pickford has had a fantastic season hes kept everton in games and saves 73 of his shots the best for an english goalkeeper his distribution is also fantastic and i think he deserves more respect and recognition as englands number 1 one extra win for west ham might have got them a euro place he also done well with preston amp everton wonder was he considered for the celtic role he lost me 4 about 35 years on the coupon never forgiven only joking i liked him as a celtic player chelsea women bounce back from champions league disappointment with resounding win over everton reports that s absolutely gorgeous i love the red stripe if everton got a win against city in this new black kit imagine the sales uplift,"[('amp everton', 0.3564), ('everton', 0.3941), ('english goalkeeper', 0.4019), ('preston amp everton wonder', 0.4445), ('pickford', 0.5609)]"
285,nice little mention for on the launch of the new away kit black watch we won 19 titles and 6 european cups since your club existed it s yer da s day soon so we ve got these everton beer mats and yes we ve got liverpool ones too for a dead unique gift for a unique da im not an everon fan but that kit is quality its celebrating skint footballers chosen tipple as in this team bonding lunch in 1949 i am finding it hard to understand what people aren t liking about this stunning kit it is literally a piece of history we ve cried out for a bespoke kit maker who doesn t give us a shit template of another team s kit this is rich with everton s heritage amazing,"[('away kit', 0.4001), ('everton', 0.414), ('liverpool', 0.4275), ('new away kit', 0.4427), ('everton beer mats', 0.5036)]"
286,even better with godfrey on the back me too some of the training tops are good too im pretty sure its already impressing everton fans and neutrals alike to reference such a historical shiin this the modern day is a very cool move indeed always good to celebrate the origins of your club here is the new shifrom and its lovely its lovely for many reasons it references the 1881 82 kit one of their earliest the team back then were named the black watch has a bit of a game of thrones vibe to it all just me this is glorious another job well done the blacked out logo is a great touch not something a brand would do lightly nice hint of red there this is funny but tbh i love a sash on a kit,"[('logo', 0.3024), ('club', 0.3036), ('new shifrom', 0.3506), ('everton', 0.4608), ('everton fans', 0.4619)]"
287,it s more red in person and we re here for it whether you like the new away kit or not you have to give props to hummel the second away kit they ve done that s a throwback they ve learnt the history of the club the sound waves from goodison on this years kit they seem to get the club everton are honestly such a gift that s red all day mate i like this with his everton defense id expect his move to be cancelo to somebody he can staso yeah bamford looks a good option for your xfer id go son to raph harrison and play nacho over greenwood,"[('everton', 0.3826), ('red', 0.4226), ('club everton', 0.4227), ('second away kit', 0.4584), ('new away kit', 0.4619)]"
288,big ben has played across the backline for everton this season and been fantastic wherever hes played i think without him everton would be languishing in the bottom half of the season multiple big performances and many more to come an absolute beauty of a strike from against everton in november his 2 goals in the 4 0 comeback will always be remembered stunning spurs nike london should take notes liked the new kit if only calvert levins beautiful curly hair hadnt been in a bun carlo ancelotti on ben godfrey i think ben did his best in this season amp if he will be selected it will be a fantastic gift for him and a great gift for a season that was absolutely outstanding the competition in squad is really high but for me he did enough,"[('stunning spurs', 0.3499), ('everton', 0.3716), ('ben godfrey', 0.4194), ('ben', 0.4313), ('big ben', 0.5374)]"
289,ancelotti the motivation is really high the pressure also maybe this is the most important game of the season but me ca says he doesn t know what the chances are of ben godfrey being called into the england squad for the euros it would be a nice gift and for ancelotti he s done his best for so that s enough for him carlo ancelotti on man city they usually play a style of football amp it doesnt matter who is or isnt going to play they have a fantastic squad amp idea of football so we expect the best manchester city possible keep singing and supporting the blues lewis your a little champ you and your best mate mick keep looking out for each other,"[('manchester city', 0.3772), ('england squad', 0.3988), ('best manchester city', 0.4354), ('carlo ancelotti', 0.4728), ('ancelotti', 0.4937)]"
290,i think we can get even more even though his loan entire season wasn t good everton and i think psg were after him maybe we are lucky for once and are heading towards a bidding war on the uefa confernence league ca says we used it have 3 uefa competitions it could be good for the future of the club to play in it carlo ancelotti on europa conference league its a different competition a new competition its not the most exciting in europe we know but to participate could be good for us amp the future of this club really like it shows that you guys have done your homework and actually listened to the fans that s why we love this club,"[('uefa competitions', 0.3878), ('uefa confernence league', 0.398), ('everton', 0.3983), ('europa conference league', 0.4009), ('good everton', 0.4657)]"
291,ancelotti on expectations against they usually play a style of football amp it doesnt matter who is or isnt going to play they have a fantastic squad amp idea of football so we expect the best manchester city possible ancelotti on europa conference league its a different competition a new competition its not the most exciting in europe we know but to participate could be good for us amp the future of this club carlo ancelotti on everton s summer plans the profile is to find a winger that scores goals that is able to defend to sacrifice put crosses these kinds of player are not easy to find but there are a lot of profiles there are a lot of good players around the world most surprising player omg that everton jersey is gorgeous win for me oo,"[('everton', 0.4025), ('best manchester city', 0.4343), ('everton jersey', 0.4573), ('ancelotti', 0.5992), ('carlo ancelotti', 0.6001)]"
292,carlo ancelotti we have to put more quality in the squad amp to play more attractive football ancelotti on recruitment plan the profile is to find a winger that scores goals that is able to defend to sacrifice put crosses these kinds of player are not easy to find but there are a lot of profiles there are a lot of good players around the world the anfield derby win gets a mention in todays press conference carlo ancelotti im really pleased that we were more competitive compared to last season more competitive against the strong teams we won the derby we won a lot of games away this was the best parts of this season,"[('anfield', 0.4524), ('anfield derby win', 0.4526), ('ancelotti', 0.6051), ('carlo ancelotti', 0.629), ('attractive football ancelotti', 0.6825)]"
293,ancelotti on response v wolves they responded but i knew this the season was like this after a defeat usually we had a great reaction we lost at home a lot of games amp there were really difficult games away we were able to win holgate starting fingers crossed he has a good game on the positives this season ca says they ve been more competitive compared to last season especially against the strong teams amp won at they now need to improve the quality of their play nicely done on this one one of my favorite everton kits in the last few years definitely getting me one james wants to get to bed earlier put the players out who have just warmed the bench all season they might even surprise you by being good,"[('favorite everton kits', 0.3464), ('ancelotti', 0.353), ('strong teams', 0.3813), ('wolves', 0.3833), ('strong teams amp', 0.4547)]"
294,ancelotti on areas to improve for next season we have to put more quality in the squad amp to play more attractive football im declaring everton as the winners of the best kit of 21 22 its so important for us to win our match before the ucl final everton will need it more but thats the key to momentum ancelotti on proudest achievement with this season im really pleased that we were more competitive compared to last season more competitive against the strong teams we won the derby we won a lot of games away this was the best parts of this season what a surprise humbled and grateful to be among the 10 remaining candidates to join the my commitment to this club its fans and growing evertons suppoand brand globally is very important to me,"[('final everton', 0.415), ('evertons', 0.4181), ('everton', 0.434), ('ancelotti', 0.441), ('evertons suppoand brand', 0.4959)]"
295,love a bit of red on the bitters away kit ca says is a strong team with strong attitude and strong defensively buzzing to see our creative released and being talked about around the world huge congrats to the and team here ancelotti on man city game on sunday we wanted to fight until the last minute of the last game for europe and we are there to fight with all our motivation and energy this is the most important game of the season mentally and physically we are ready the motivation is really high the pressure also mentally and physically we are ready ca says they wanted to fight to the last minute in the last game they will fight with all their motivation it will be difficult but they are confident with their away form,"[('team', 0.3577), ('important game', 0.3669), ('man city game', 0.3777), ('ancelotti', 0.3822), ('strong team', 0.4491)]"
296,carlo ancelotti this is the most important game of the season but mentally amp physically we are ready ancelotti maybe this is the most important game of the season but mentally amp physically we are ready ancelotti this is the most important game of the season but mentally amp physically we are ready ancelotti the motivation is really high the pressure also maybe this is the most important game of the season but mentally and physically we are ready manager we wanted to fight to the last minute of the last game and we are there we know it may be the most difficult game against the champions but we are confident as we had fantastic results against top teams away bremer player stands out for summer move everton and liverpool with chance to get signing,"[('liverpool', 0.3834), ('ancelotti', 0.4427), ('carlo ancelotti', 0.4499), ('summer move everton', 0.4683), ('ready ancelotti', 0.5291)]"
297,want this is a stunning kit my fave in a while please everton score 3 past city so we can have the least conceded goals in the league if brighton can you can too thats an easy w for us yes more peachy and grey in real life but still a nice kit hummel did a very nice job on recreating their 1881 kit hmmmm he s not bad in fm21 excited to watch him real life please join everton smashed it again you beauties but he has incredible control over his body heading chesting shielding think hed be a really good signing for brighton which if you think about it probably arent super far off from west ham or everton who are also linked cheers mr b good morning evertons 21 22 away kit is absolute fire,"[('nice kit', 0.448), ('everton score', 0.4534), ('kit hmmmm', 0.4552), ('good morning evertons', 0.503), ('nice kit hummel', 0.5171)]"
298,my favourite everton kit is the one from season 1969 70 not because it was my first kit as a kid but because it was undeniably everton just royal blue and white nothing else required spoken like a true parent there mate i agree completely i think this could be the best selling away kit for years reposuggests everton are pleased with remarkable loanee made to look uncomfortable nice to see everton channeling the success of the city into their away shinext season city liverpool utd chelsea leicester all comfortably have a far better squad we have just been fortunate to have harry kane loving evertons bold new away shifor the 21 22 season kudos to,"[('everton', 0.4401), ('away kit', 0.4598), ('years reposuggests everton', 0.4694), ('everton kit', 0.7012), ('favourite everton kit', 0.7817)]"
299,think its nice mate sound for the kids you wont see the chocalate and mud on it with it being black not like the white shorts not too shabby collars aren t my favorite but a really clean kit and an ode to a kit warn in the 1800s you better believe it s amus is back here you go blues you can download the first book in my fantasy series for free for a limited time any likes and retweets would be greatly appreciated more pictures of the beautiful kit pls gareth barry for everton great signing,"[('clean kit', 0.399), ('nice mate sound', 0.4107), ('kit', 0.4126), ('kit warn', 0.4242), ('beautiful kit', 0.4721)]"
300,in these days when football is beset with multi millionaire gatecrashers who have no understanding of club histories its great to see everton remind us all of their humble beginnings when players shirts were dyed to save the costs of new ones remember the black watch with pride everton women showing interest in two biggest stars at same club director aware of brilliant keep supporting and singing lewis remember many moons ago just before attending my alma mater the soccer team under the doc won the fai cup amp played at tolka park the place was full amp rocking for 0 0 game everton won the cup winners cup that yr it is mate like it better than our new one yeah hahaha love it the smiles on everton womens faces made it so lovely,"[('game everton', 0.5395), ('everton', 0.5832), ('everton women', 0.6186), ('everton womens faces', 0.6332), ('pride everton women', 0.6957)]"
301,you chose that as your first tattoo insane nice though a big week for everton starts tonight can they overtake spurs in the table and kickstaa strong premier league run new everton away kit 2021 22 welcome to the black watch heard their name ring out around the stadium as fans of everton celebrated winning the community shield my first one this hahaha good 7 8 hours lovely kit mate not too keen on the black bit though danny it s orange if you see it in the flesh i think it s tremendous it s totally unique to efc as well not a template that other manufacturers use and just change the badge and colours so glad its salmon and an embroidered badge make the best kits ever,"[('best kits', 0.372), ('new everton', 0.3779), ('efc', 0.4113), ('lovely kit', 0.418), ('lovely kit mate', 0.4533)]"
302,remember this alan ball everton tell us about it please retweet for other people to enjoy amp must have liked playing over here zirkzee to everton reminds me of kean so much remember this alan ball everton tell us about it please retweet for other people to enjoy amp comment haha he was an everton youth player and a huge everton fan truly stunning design and colour the burnt orange and black look fabulous together hummel have yet again listened to the fans and have delivered the goods prefer amber and blue as that goes back to teams when i was very young but it s a nice nod to the club s history best kit yet great work and listening to the fans too,"[('alan ball', 0.4659), ('everton fan', 0.5115), ('huge everton fan', 0.5297), ('everton youth player', 0.5342), ('alan ball everton', 0.5774)]"
303,they will be wearing it against city so if we win n yall lose i am definitely robbing a bank to buy the shirt its 60 about 1000 rand so isnt bad we the people club new everton away kit is something special very very classy spoke all about everton their kits and those chang beer elephants to on my radio show this week if you re interested i am starting a trust fund to be able to buy the shirt i will post the link in a while please do all you can to support ay yo hummel blessed us hoping that he will give us 1 last final amazing display ben godfrey is that good hes already evertons cover boy,"[('away kit', 0.2904), ('shirt', 0.4321), ('evertons', 0.4432), ('everton', 0.4588), ('new everton', 0.5062)]"
304,joshua zirkzee is 100 per cent coming back to bayern munich after his loan spell at parma everton are interested love it not just a basic sample kit like other manufacturers actual thought about history and tradition has gone into it and looks brilliant he s produced some truly incredible moments and scored a lot of very important goals my old man has great memories of the everton fans when they got to the cup winners cup final of 1985 thousands of our fans went to suppothem against rapid and even had a hail hail the celts are here banner great club everton always have been would love a everton kit yc this helps me like it abit more well in lewis that s the way to enjoy yourself we still have europa league hope,"[('parma everton', 0.4605), ('club everton', 0.4846), ('banner great club everton', 0.5098), ('everton kit yc', 0.6464), ('everton kit', 0.656)]"
305,top work again from this time going above and beyond for so he could watch at goodiso im loving the new away kit definitely going to pre order little history lesson all good fun it s nod to the 1881 everton kit it s a masterpiece this is the good stuff the new chelsea kit is getting hammered and i quite like that one too i ll be putting the everton away shion my xmas list i reckon everton u 23 manager believes future is bright for sensational teen i do love that it has to be made explicitly clear that its burnt orange not red esports has been on my radar for quite a while now and i am excited to take my first steps into the space,"[('away kit', 0.3187), ('everton', 0.4053), ('new away kit', 0.4055), ('new chelsea kit', 0.5471), ('everton kit', 0.5961)]"
306,my mum liked clara schumann amp loved she was born in 1933 amp now has a seat dedicated to her next to her brother who played violin for them in the adeco auditorium built after the fire everton won the fa cup in 1933 but its probably not connected everton chief claims club has a sensational talent coming through he makes it look really easy fair play winning the league this season i really liked the yellow road kits this season that said these are cool too utft good one shaun 54431142 this changes everything nuno on wednesday defeat i am really pleased with the way we compete against everton i truly believe we made a good game especially in the first half really good game the boys worked and played very good everton kit reveal tomorrow we cant wait,"[('fire everton', 0.531), ('everton', 0.5357), ('everton chief claims club', 0.5591), ('good everton kit reveal tomorrow', 0.5688), ('good everton', 0.6029)]"
307,lets meet some members of the liffey college family we are proud to introduce you to gabriel brindamour assistant director of studies verton tadeu marketing director and sanjiv oberoi director of operations oh my lord black watch finally returns best kit we ve ever done and sandro ramirez is the first player we probably all think of when we see it nuno on adama traore contract i believe that everything is going to be okay just look at how adama performed against everton i hope and expect everything will be solved that everton away kit for next season is a beaut sure hopefully you get a few new followers anyway count me in we never lost a single game in this kit,"[('everton hope', 0.3763), ('adama traore', 0.3896), ('adama', 0.4007), ('sandro ramirez', 0.4821), ('adama traore contract', 0.4905)]"
308,hayes the players deserve every bit of credit they ve gained this year chelsea women booked our place in the vitality women s fa cup quarter finals with a 3 0 victory over everton and emma hayes is delighted with the response from her players it s a really nice kit but would have been even better with cazoo in black as with the hummel logo i ll definitely be getting one of these sounds a perfect everton striker this is absolutely spot on honestly one of the best everton kits ive seen in years hummel kits are some of the best about the now although the wolves result made it a bit better,"[('everton', 0.5092), ('everton striker', 0.543), ('perfect everton striker', 0.5947), ('everton kits', 0.6807), ('best everton kits', 0.7426)]"
