,tweetpositive,keyphrases
239,bigger than man city false no one could have done a better job than aguero for city i am happy manchester city didnt win the champions league i was hoping that manchester city would have been champions of europe tonight i always had a soft spot for manchester city over the years long before the arabs came on the scene i ve had the same thought since i was sat at the etihad next to someone with liverpool shorts on supporting man city there s easy ways to win don t overthink it funny that chelsea brave and tactically spot on and what a job tuchel has done in just six months man city underwhelming congratulations chelsea f c we are gargantuan club,"[('job tuchel', 0.4113), ('manchester city', 0.4206), ('chelsea', 0.4497), ('happy manchester city', 0.498), ('congratulations chelsea', 0.5184)]"
240,man city were absolutely incredible and clearly the best team in the world for most of the season winning the premier league by a mile and yet they get to the cl final and get deservedly beaten by 4th place chelsea who end up champions of europe love you chelsea uefa champions league final chelsea defeat man city 1 0 to win the champions league havertz goal wins champions league for chelsea against man city chelseas kai havertz repaid some of his huge transfer fee as his first half goal sealed a 1 0 win for his side over manchester city in the champions by dua lipa has turned up and preformed well at more champions league finals 1 than man city 0,"[('4th place chelsea', 0.5304), ('champions league final', 0.5319), ('final chelsea', 0.5714), ('chelsea uefa champions league', 0.5768), ('man city chelseas kai havertz', 0.6478)]"
241,it s amazing cause football analyst have been heaping praises on him for playing without a traditional striker all season long the other one said pep can play 11 defenders and wins cause he is a masterclass i cant wait for chelsea to beat manchester city in the ucl finals so that i can tweet jesus wept chelsea have won the champions league for a second time pep guardiolas team selection did surprise me tonight fernandinho is the heabeat of that team he should stahe gives manchester city that little bit more protection also they need a number 9 but much better with gabriel jesus on the pitch the false 9 system didnt work man city fans and selenators are still staying friends right i really started to enjoy football because of you so man city win the premier league,"[('fernandinho', 0.4119), ('amazing cause football analyst', 0.444), ('time pep', 0.4451), ('tonight fernandinho', 0.4474), ('pep', 0.4641)]"
242,tuchel knows how to beat city man unreal performance by chelsea ngolo kante what a player its a crying city manchester we will be back stronger next season we beat man city 3 times in a row do you know how crazy that is tuchel the players were determined to win this we wanted to be the stone in man city s shoe we encouraged everybody to step up to win their one on one battles we deserved this congrats to pompey boy mason mount and the rest of chelsea on winning the champions league 2021 in porto by beating man city 1 0 fully deserved well done mason mount and the london blues liverpool bounced back from defeat in kyiv to win the trophy something manchester city will doubtless want to emulate next campaign,"[('champions league', 0.4226), ('chelsea', 0.4615), ('chelsea ngolo kante', 0.4666), ('trophy something manchester city', 0.4994), ('tuchel', 0.5586)]"
243,but it shall be chelsea who meet villarreal at the super cup in belfast hopefully later in the summer who end the season on a high man city man utd and surprise third team dominate premier league team of the season 2020 21 man city going prime rory delap has made my night yall realize we won this thing with a clean sheet against man city gaada yg perlu disesali dari man city they doing great job prospek tuh ada ditambah ambisi dari owner berdampak ama tim gg m8 he was just too good today have to say it even as a man city fan he was phenomenal in his role with his play style,"[('man utd', 0.4676), ('man city fan', 0.4694), ('premier league', 0.4742), ('premier league team', 0.4942), ('chelsea', 0.6013)]"
244,i love it even though i dont like chelsea i love seeing man city fail to get the trophy theyve literally invested a billion pounds for i really wanted pep s magic to work man city to lift the cup amp ag ero to score the equaliser but at the end of the match it s all bout who was a better team congrats man city s board before the takeover is the only reason your club is still standing today you re welcome mason mount won in his first ever champions league final against man city match report chelsea 1 man city 0 chelsea are the champions of europe again lovely end to your man city career have a nice time in barcelona we are coming for you league title next season we are the champions,"[('champions league', 0.5126), ('chelsea', 0.5728), ('man city match report chelsea', 0.6396), ('chelsea man city', 0.6751), ('man city chelsea', 0.7052)]"
245,chelsea are winners once again after defeating manchester city 0 1 to lift the trophy tuchel is an incredible manager changed their fortunes immediately and had man city in jail all game rudigar azpi and christensen were rock solid gave almost no chance to any man city players and kante is almost equal to 3 players in midfield amazing work rate one chance and chelsea used it to win the match but this is the icing on the cake winning the champions league against the citizens manchester city 0 1 chelsea kai havertz goal secures champions league trophy for chelsea blues forever man city s best and only chance of winning it and they played shiteeeee hahahah love it bro the most important pathat chelsea is the champion,"[('champions league trophy', 0.4823), ('manchester city chelsea', 0.5057), ('chelsea blues', 0.517), ('chelsea', 0.5297), ('chelsea kai havertz goal secures champions league trophy', 0.6237)]"
246,this has been a tumultuous season for chelsea with a bunch of new faces and a managerial change midseason however their story had a happy ending with a 1 0 win over man city in the here is my recap of the match alrighttt bro man city has won ngolo kante is a world class player aguero amp city were a match made in heaven a journey which gave the club the greatest moments in the clubs history 10 years at mancity with 15 titles congrats mason mount and the rest of chelsea on winning the champions league 2021 in porto by beating man city 1 0 fully deserved well done mason mount and the london blues,"[('bro man city', 0.4318), ('man city', 0.451), ('champions league', 0.4614), ('chelsea', 0.5061), ('match alrighttt bro man city', 0.5093)]"
247,guys the chelsea football club was crowned as europe champion team congratulations to all the blue fans the team the directive the coaching staff etc congratulatios to the manchester city too for be a great rival had a great night only to come home and get my heabroken by soccer but well done man city we still proud of you they are litterally heroes cuz they saved us all from the villains man city kante is the best player in the world brilliant you ve raised him right best pafor us is my son is playing at the man city cup in san diego i can t wait to wear my shiall weekend around the fields chelsea stun man city to win champions league chelsea were crowned european champions for the second time as kai havertzs,"[('chelsea football club', 0.5353), ('fields chelsea stun man city', 0.5538), ('champions league chelsea', 0.5773), ('europe champion team congratulations', 0.6076), ('chelsea stun man city', 0.6189)]"
248,it was a really good final chelsea fully deserved winners pep tried to be clever with his team selection and tactics and got completely out thought and outfought by tuchel never seen man city look so ineffective kante and cihilwell outstanding chelsea played really well congratulations to chelsea for their second champions league trophy man city fans we dominated the whole game kept more possession than you had more attempts up blues and for the ladies please suppoour guys by giving him good pussy to eat for tonight man city guys should go and hug transformer he managed the best bayern munich team and the best manchester city team its an honour to defeat man city man city will definitely try and sign kane after that performance manchester city got premiere league trophy you should be proud of your club,"[('best manchester city team', 0.5524), ('outstanding chelsea', 0.5636), ('final chelsea', 0.5659), ('second champions league trophy man city fans', 0.6098), ('good final chelsea', 0.6615)]"
249,chelsea are champions of europe once again congratulations fc city was not at their game today just one game winners take all when will it be my time to celebrate a championship man we havent had any luck at manchester city but i think the future is better and that we will be better with everyones suppo chelsea fc are winners of this years champions league with a 1 0 win over manchester city fc i love seeing man city fans cry it s my daily medicine my weekly energy and my monthly inspiration their loss is the only reason i m still alive i was born to witness and enjoy the failure they have achieved,"[('manchester city fc', 0.5379), ('man city fans', 0.5383), ('chelsea', 0.5646), ('chelsea fc', 0.5772), ('everyones suppo chelsea fc', 0.6182)]"
250,i don t even know what to say boys but congrats to our beautiful team for their unbelievable season we ll be back stronger world has now discovered what manchester city can do in champions league still pep is the best thing ever happen to manchester city football club we will win it next season good night folks we did it champions of europe wow what a match that second half was really intense brilliant defending from chilwell rudiger and azpilicueta we looked really dangerous tonight and man city just couldnt stop us i am grateful to be here and i will always be grateful for the opportunity manchester city gave me manchester city fans and supporters world wide go and listen to ease your mind by wizkid,"[('manchester', 0.4896), ('opportunity manchester city', 0.5137), ('manchester city', 0.5302), ('manchester city football club', 0.5602), ('manchester city fans', 0.6482)]"
251,we eat while rejoicing on man citys pain manchester is quiet this evening kealeboga youre immortal nothing can kill you man city really they were gonna win the on their debut in the final we the best anyway congratulations i no be man city fan sef breaking chelsea wins champions league second time bests man city see lineups atletico real madrid and manchester city tuchel has outwitted simeone zidane and guardiola superbly organised maste kante won the game for chelsea he was everywhere he did everything but score that being said that pass from mount to havertz was truly inspiring chelsea won the champions league for the second time by beating manchester city 1 0 thanks to kai havertzs first half kante really balled tonight handled man city midfielders like a boss the only chelsea player i am happy for,"[('chelsea wins', 0.5406), ('manchester city thanks', 0.5486), ('man citys pain manchester', 0.5658), ('inspiring chelsea', 0.581), ('man city fan sef breaking chelsea', 0.6835)]"
252,i rate that but good job well played mmekuwa dawa ya man city this season so happy for man city what a small club hahahahah man city winning it this season chelsea won the champions league for the 2nd time by beating manchester city 1 0 chelsea we love you thunder fire man city one of the greatest ever to play football hardwork talent and humbleness pays off ref was brilliant congratulations to thomas tuchels chelsea as they defeat pep guardiolas manchester city 1 0 in the fi congratulations champions fc congrats to you guys a well deserved victory congrats to the newest champion of europe also nice one to man city fc you guys did greatly this season you guys played fantastic football kudos to you guys,"[('manchester city', 0.4903), ('deserved victory congrats', 0.534), ('season chelsea', 0.5405), ('manchester city chelsea', 0.5525), ('man city fc', 0.5535)]"
253,chelsea just made my weekend by beating hated man city love it pep you will never win a champions league with city this was your best chance man city bottling a european final you love to see it i also think chillwell played well both wbs pressurised mahrez and sterling on the ball stopping man citys plan of stretching the play and creating space chelsea won the champions league for the second time as a kai havertz goal secured a tense 1 0 victory over manchester c congrats to chelsea on becoming the new uefa champions league winners although my heabreaks for manchester city we go again next season its nice to see that psg made a huge mistake by letting a manager like tuchel go and a beast in defense like thiago silva go,"[('uefa champions league', 0.5281), ('champions league', 0.5344), ('champions league winners', 0.5568), ('new uefa champions league winners', 0.5629), ('uefa champions league winners', 0.5634)]"
254,3 best midfielder in england is kdb hands up and check your dm loves i dont know if you guys noticed how man city were playing cross and nod for about 15mins to the end of the game it was so funny to me thomas tuchel the players were determined to win this we want to be the stone in man city s shoe we encouraged everybody to step up to win their one on one battles we deserved this congratulations absolute fantastic performance who makes man city look like that these days that manchester city would make a comeback in this match against chelsea,"[('manchester', 0.4295), ('chelsea', 0.431), ('thomas tuchel', 0.4476), ('manchester city', 0.467), ('best midfielder', 0.5144)]"
255,as for me i love arsenal first and foremost barca is my second love depending on the situation i love liverpool chelsea and man city too manchester united is the club i dont like at all would never suppothem unless i need their favour to get points at the city of manchester they painted the sky blues and they call for celebration at emirates stadium dine and wine at stamford bridge london man city just needs to get good cyaa believe we just win the champions league against manchester city man city memang strong tapi taktikal tuchel memang terbaik bila jumpa pep terciduk habis man city season ni bila jumpa chelsea congrats chelsea photo news popular musician paul nonso okoye aka rudeboy celebrates chelsea fc victory in this years champions league final against manchester city on saturday night,"[('manchester city man city memang', 0.5485), ('chelsea', 0.5508), ('chelsea congrats', 0.557), ('chelsea fc', 0.5725), ('rudeboy celebrates chelsea fc victory', 0.5831)]"
256,in it was manchester united and manchester city combined vs chelsea kante made the difference between the two teams and that is amazing is blue nice game chelsea beating man city but sad for debroina for injured all chelsea played well and kante rudiger james in defense unbelievable chelsea won the champions league for the second time by beating manchester city 1 0 thanks to kai havertz s first half goal as pep guardiola s overthinking proved costly again in the all english final man city and pep are the perfect example of adojutini omo congratulations to for winning this years against man city iam a top fan and this is legendary iam veeeeeeeeeeeeeeeery happy all smiles tuchel we love you congratulations ku bafana ba chelsea and more pain kubafana ba man city what a brilliance performance from chelsea,"[('manchester city thanks', 0.4935), ('blue nice game chelsea', 0.5378), ('defense unbelievable chelsea', 0.5496), ('nice game chelsea', 0.5839), ('congratulations ku bafana ba chelsea', 0.6191)]"
257,congratulations chelsea at less u win ucl n man city win epl balance hahaha up the man city reds patrice evra is absolutely loving man citys loss chelsea have won their 2nd champions league title after a kai havertz goal was enough to trump manchester city in the yes we won the match but seeing these stats against a team like manchester city makes me proud to be a blue chelsea i dont know how but we beat man city in the biggest game possible we got lucky today lyes man utd need a hell of a summer i was so shook city were gonna win today congratulations to leicester for fa cup congratulations to man city for the league congratulations to chelsea for champions league and finally congratulations to man u for a top 4 finish,"[('city win', 0.5273), ('lucky today lyes man utd', 0.589), ('man city win', 0.5998), ('man citys loss chelsea', 0.6803), ('congratulations chelsea', 0.6815)]"
258,chelsea fc won 1 0 vs manchester city in the finals nets need to do this this year congratulations to chelsea and all the fans of chelsea champions and king of europe congratulations a well deserved victory well played manchester city manchester city got the talents well deserved congrats kante man of the match by a mile only 30 not sure where that leaves gilmour short term but chelsea are rising under tuchel showed that man city are powder puff if you get organised congratulations ola it was a well deserved victory for you guys man city were to flat all through they didnt even deserve an equalizer chelsea have won their 2nd champions league title after a kai havertz goal was enough to trump manchester city in the final,"[('2nd champions league title', 0.4849), ('champions league title', 0.5016), ('chelsea', 0.5364), ('chelsea fc', 0.5629), ('chelsea champions', 0.5965)]"
259,tuchel the players were determined to win this we wante to be the stone in man city s shoe we encouraged everybody to step up to win their one on one battles we deserved this man city are the new mayo get that up yee hey man finals are tough good job on reaching the final two though congrats chelsea congrats zam mengekalkan record no ucl untuk man city haha man city will rise again the agility thomas tuchel has inculcated in chelsea can outrightly be demonstrated in the kind of play they demonstrate pep guardiola is also good only this time it wasnt for manchester city its so beautiful man city losing aguero crying guardiola still unable to win without messi thank you for describing man city accurately congratulations to manchester city for winning their first champion league trophy,"[('chelsea', 0.4539), ('tuchel', 0.4719), ('congrats chelsea congrats zam', 0.5483), ('congrats chelsea', 0.5723), ('chelsea congrats', 0.5936)]"
260,ngolo kante played amazing in tonights champions league final chelsea deserved the win hard luck to pep and aguero feeling especially glad for tuchel tiago silva amp kante kante was fantastic tonight the central midfield role is always important commiserations to man city you have a fantastic manager and so many amazing players its only a matter of time till you win it yourself i was crushed when man united beat us but when you finally win this competition that pain youre feeling now will have been worth it i think chelseas formation was just superbly done cutting out marez by chillwell sterling by james as well as de bruyne by kante in the first half technically shutting man city attacking prowess congratulations to chelsea and commiserations for man city and,"[('champions league final', 0.4607), ('ngolo kante', 0.5192), ('kante', 0.5412), ('final chelsea', 0.5428), ('tuchel tiago silva amp kante kante', 0.5561)]"
261,ngolo kante of chelsea getting all the praise for his outstanding performance so far pep guardiolas no dm manchester ci thanks manchester city united for the joy nick congrats for beating man city that was you at right wing right levy take notes this is how you win big prizes by pushing the boat out and spending on the right players and man city won congrats well done manchester city congratulations to manchester city for winning their first champions league trophy still liverpool 6 city 0 tuchel is a smaoperator and a great man manager getting the best out of the players he has especially against the top teams good game manchester city thomas tuchel chelsea played guardiola man city three times and beat him he is the better coach congrats to man city too,"[('great man manager', 0.5374), ('tuchel chelsea', 0.5457), ('dm manchester ci thanks manchester city', 0.5839), ('manchester city congratulations', 0.5988), ('good game manchester city thomas tuchel chelsea', 0.6688)]"
262,congrats to disappointment to man city anyway as a liverpool fan im happy england most successful club in england europe and world what a football season it was thomas tuchel today they were determined to win this we wanted to be the stone in their shoe the stone in the clockwork of man city we encouraged everybody to step up and step out to go for duels one on one 11 duels won most thank you i like man city a lot shame someone had to lose you ll be back next year i am only happy bc it was not city because manchester is always red we are proud to be the noise makers,"[('man city', 0.4714), ('manchester', 0.5186), ('liverpool', 0.5247), ('liverpool fan', 0.5276), ('happy england', 0.5387)]"
263,only one man can win city a champions league as a fan i personally would gladly donate him to the cause it s what football needs do the right thing sheikh mansour true on all those tuchel deserves all the credit chelsea have beaten man city thrice since january underlines how good he is as for pep playing kdb as a false 9 overthinking best coach my left ball am i one of the only one happy chelsea won tonight we still own the bragging rights of something man city haven t brought yet he was great but to be fair kyle walker was comfortably man city s best player today too bikomeje kwanga cyane cyane iyo bigeze ku gikombe cyamatwi manini bipfira he gusa irakoze kudukiza manchester city congratulations to chelsea,"[('chelsea', 0.449), ('credit chelsea', 0.5044), ('happy chelsea', 0.5152), ('irakoze kudukiza manchester city congratulations', 0.5204), ('manchester city congratulations', 0.5311)]"
264,congratulations to all chelsea club fans on your victory against manchester city man city to win the cup get involved via man city s bogey team is chelsea chelsea s bogey team is somehow arsenal chelsea won the champions league einstein s relativity theory proves that we too won the champions league tonight he carry man city straight win 3 consecutive wins with all as crucial matches yeah its to cool to count your success but arsenal still got more trophies than man city and chelsea combine as a barca fan pep is the best manager weve had true congrats to tuchel and chelsea deserving man city what a team i won my predictor at the 5th stand man city was better placed but chelsea used its opportunity effectively and efficiently well done blues of london,"[('arsenal chelsea', 0.487), ('manchester city man city', 0.5116), ('chelsea chelsea', 0.5377), ('chelsea', 0.5478), ('chelsea club fans', 0.5963)]"
265,we are the champions of europe and tough luck to all the naysayers who predicted 2 0 to man city scott carson remains the only person in the man city squad to have won a european cup champions of europe congratulations to chelsea on winning the uefa champions league after beating manchester city 1 0 in th city the smallest club in manchester haha what a joke man love seeing aguero cry man that made me soo happy thats what you deserve oilchester city chelsea fc have won champions league after beating manchester city 1 0 manchester city are still the champions of england we can still be incredibly proud of this season up the blues am a manchester city fan but congratulations meanwhile feel free to join me and we stalearning web development at for free,"[('uefa champions', 0.5064), ('oilchester city chelsea fc', 0.5165), ('champions league', 0.5192), ('uefa champions league', 0.5305), ('manchester city fan', 0.5794)]"
266,good performances in champions league finals kante deserves this retweet official chelsea become the winners of the 2020 21 uefa champions league after winning 1 0 over man city a masterclass performance by chelsea tonight and i say congratulations to the blues look whatever you might say about pep guardiolas manchester city the fact remains europe or no europe the man has won more check a trade auto windscreen trophies than any other manager in english football history hes an all timer congratulations chelsea excellent goal from kai havertz full match here later he was lost for words as a manchester united fan i will suppochelsea to win the ucl over man city they did but i like man city way more,"[('chelsea tonight', 0.5332), ('timer congratulations chelsea', 0.5348), ('champions league finals', 0.5417), ('congratulations chelsea', 0.6028), ('champions league finals kante', 0.7148)]"
267,i saw chelseas grove happening saw loss prayed theyd lose facup and hunger so theyd take city great now to enjoy but chelsea are the title winners next season but for klopp the man of miracles good job guys from man city fan my baby brother is probably crying manchester city lost mna ke gqeberha im so happy chelsea fc won never been this huin my life but it happens wada we lose or win i love you manchester city forever and for always the super league was an amazing idea and manchester city should definitely reignite a new one we are champions we are king of europe bbk kdua chelsea memang hrus lbih mnderita krna srangan bertubi tubi dr pmain city untungnya prthanan kita solid dn ada juga keberuntungan menyertai kita we are chelse come on chelsea,"[('chelseas', 0.5061), ('man city fan', 0.5106), ('chelsea', 0.5164), ('happy chelsea', 0.5266), ('happy chelsea fc', 0.562)]"
